username;date;retweets;favorites;text;geo;mentions;hashtags;id;permalink
IndiaEduNews;2016-04-18 14:25;0;1;"Education programme for differently abled children launched - Times of India http:// news.google.com/news/url?sa=t& fd=R&ct2=in&usg=AFQjCNGMZeVpQoTUmNthRYlfVoGxMfvB_g&clid=c3a7d30bb8a4878e06b80cf16b898331&cid=52779083371724&ei=-KAUV-j3Lsa03gGs-5nwAw&url=http://timesofindia.indiatimes.com/city/guwahati/Education-programme-for-differently-abled-children-launched/articleshow/51800251.cms … #education #india";;;#education #india;"721985456515235840";https://twitter.com/IndiaEduNews/status/721985456515235840
CatherineODrisc;2016-04-18 14:15;0;0;"Rothschild Czar Bill Gates To Face Trial In India : Millions Of Children Poisoned By Vaccine! |... http:// fb.me/7OR7N2Pdw";;;;"721982997570928640";https://twitter.com/CatherineODrisc/status/721982997570928640
ikidsworld;2016-04-18 14:15;0;0;"The Alphabet Letter G & Color Green for children . #Kids #Preschool #ECE #Parents #US #England #Canada #India #Japan https:// youtu.be/NKReuTxne1E";;;#Kids #Preschool #ECE #Parents #US #England #Canada #India #Japan;"721982903522037760";https://twitter.com/ikidsworld/status/721982903522037760
ikidsworld;2016-04-18 13:45;0;0;"Learning Numbers for Toddlers and Preschoolers. #Kids #children #ECE #US #UK #India #Turkey #Vietnam #Thailand https:// youtu.be/wDVCzqziqes";;;#Kids #children #ECE #US #UK #India #Turkey #Vietnam #Thailand;"721975351597998080";https://twitter.com/ikidsworld/status/721975351597998080
Apna_Fundaa;2016-04-18 13:30;0;0;"CHILDREN 'S ARE THE FUTURE OF INDIA SO DONT JUST MAKE THEM WORK AS THE AGE OF STUDY #DONT_EMPLOY_LITTLE_ONES";;;#DONT_EMPLOY_LITTLE_ONES;"721971682668228608";https://twitter.com/Apna_Fundaa/status/721971682668228608
smilengo_india;2016-04-18 13:07;0;0;"'Bring smile among street #children in India '- Participate in #Summer #International … (at SMILE ngo) [pic] — https:// path.com/p/1yHypg";Kolkata, India;;#children #Summer #International;"721965755810512897";https://twitter.com/smilengo_india/status/721965755810512897
ROIsaysno;2016-04-18 12:39;3;0;"Reuters India : Ethiopia says death toll from raid rises to 208; 108 children kidnapped. http:// google.com/newsstand/s/CB Iwo8PazyQ … -T";;;;"721958855484289026";https://twitter.com/ROIsaysno/status/721958855484289026
BrehonAdvisory;2016-04-18 12:37;0;0;"We love this. Meet the street children making their own newspaper in India http:// gu.com/p/4t557/stw";;;;"721958243904397314";https://twitter.com/BrehonAdvisory/status/721958243904397314
JaishreeMisra;2016-04-18 12:27;0;0;"I should've also said that proceeds of 'Of Mothers & Others' go to Zubaan & Save the Children India . Not one contributing writer objected.";;;;"721955890740355072";https://twitter.com/JaishreeMisra/status/721955890740355072
yahyaz111;2016-04-18 12:17;0;0;"Saudi Arabia is killing children in Yemen #Japan #Qatar #Newyork #Washington #Argentina #Poland #Russia #India #ksa pic.twitter.com/mzd3fPhOrT";;;#Japan #Qatar #Newyork #Washington #Argentina #Poland #Russia #India #ksa;"721953261809442817";https://twitter.com/yahyaz111/status/721953261809442817
Wish_India;2016-04-18 11:57;0;2;"#publichealth#healthcare#careforchildren WISH staff attending children from the local area at PHC in Rajasthan pic.twitter.com/hyAn2pk9Pn";;;#publichealth #healthcare #careforchildren;"721948352577974272";https://twitter.com/Wish_India/status/721948352577974272
CCTV;2016-04-18 11:30;1;1;"40 million children in #India under the age of 5 are stunted. http:// ow.ly/4mNp4X pic.twitter.com/Pr8AL2np8d";;;#India;"721941384605933568";https://twitter.com/CCTV/status/721941384605933568
Xentagz;2016-04-18 11:05;1;5;"Watching children in India being introduced to Bitcoin for the first time will make you smile. A must watch! https://www. youtube.com/watch?v=8hKN9J -fFSs&feature=youtu.be …";;;;"721935080789295104";https://twitter.com/Xentagz/status/721935080789295104
BhaktiJM;2016-04-18 10:57;0;0;"@incindia For the future of the children , let's spread & make india peace, truth, trust, happiness, kindness, love, equality to all soul";;@incindia;;"721933212478500864";https://twitter.com/BhaktiJM/status/721933212478500864
ReliefIndia;2016-04-18 10:57;0;0;"Relief India Trust #RIT , a NGO providing support to children belonging to lower income strata http://www. financialexpress.com/article/lifest yle/health/relief-india-trusts-success-story-of-treating-five-year-old-disabled-girl/81682/ …";;;#RIT;"721933047453589504";https://twitter.com/ReliefIndia/status/721933047453589504
ikidsworld;2016-04-18 10:00;0;0;"The Letter S for Children . Fun & engaging Underwater Video. #Kids #Parents #ECE #US #Vietnam #SaudiArabia #UK #India https:// youtu.be/9v-a_2ofRps";;;#Kids #Parents #ECE #US #Vietnam #SaudiArabia #UK #India;"721918724744286208";https://twitter.com/ikidsworld/status/721918724744286208
taiaakib;2016-04-18 09:57;0;1;"I believe that together we can create an India where everyone uses a toilet. An India where all children and their families live in healthy.";;;;"721918015999123457";https://twitter.com/taiaakib/status/721918015999123457
JPAL_SA;2016-04-18 09:53;7;4;"Under TaRL children in Class 3-5 are regrouped by learning level & taught using interactive aids from @Pratham_ India pic.twitter.com/nKHAOpdEt9";;@Pratham_;;"721917137233788928";https://twitter.com/JPAL_SA/status/721917137233788928
ncmjax;2016-04-18 09:52;0;0;"We had the privilege of having Dr. Paul Dhinakaran, Jesus Calls Ministry, India , with his wife and children to minister in our church today.";;;;"721916816709263360";https://twitter.com/ncmjax/status/721916816709263360
WebDesigningUDR;2016-04-18 09:06;0;0;"Parents across India are super proud to know their children will be winning the Nobel prize in 10 years.";;;;"721905243710103552";https://twitter.com/WebDesigningUDR/status/721905243710103552
lnagarajah1;2016-04-18 08:41;0;0;"William and Kate meet India 's poorest children . http://www. standard.co.uk/news/uk/prince -william-and-kate-arrive-at-new-delhi-station-to-meet-indias-poorest-children-a3223291.html …";;;;"721898925637181440";https://twitter.com/lnagarajah1/status/721898925637181440
ramkinavy;2016-04-18 08:28;0;0;""882 tribal children died in state-run schools in India " #indianews #whoisaccountable ? http:// economictimes.indiatimes.com/news/politics- and-nation/882-tribal-children-died-in-state-run-residential-schools-across-the-country/articleshow/51871201.cms …";;;#indianews #whoisaccountable;"721895698363322368";https://twitter.com/ramkinavy/status/721895698363322368
nidhi_sharma;2016-04-18 08:25;16;0;"882 tribal children die in state-run residential schools across india . Sexual abuse cases reported too @ETPolitics http:// m.economictimes.com/articleshow/51 871201.cms …";;@ETPolitics;;"721894841572073473";https://twitter.com/nidhi_sharma/status/721894841572073473
misz_india;2016-04-18 07:05;1;1;"She has beautiful children to bad they have a "mother" like that #intervention";;;#intervention;"721874811102826496";https://twitter.com/misz_india/status/721874811102826496
233liveOnline;2016-04-18 06:56;0;0;"International News • 'Diarrhoea killing India 's poorest children ' via @233liveOnline . Full story at http:// 233live.com/International/ 96029/Diarrhoea+killing+India%27s+poorest+children.html …";;@233liveOnline;;"721872418738978822";https://twitter.com/233liveOnline/status/721872418738978822
misz_india;2016-04-18 06:51;0;2;"Bitch got 3 children on drugs and prostitutes but she's doing good for herself? delusional #intervention";;;#intervention;"721871244438712322";https://twitter.com/misz_india/status/721871244438712322
AllTheTwits;2016-04-18 06:11;0;0;"A court in India extends the remand period of two men accused of killing 17 women and children . http:// tinyurl.com/y978fc";;;;"721861291036553216";https://twitter.com/AllTheTwits/status/721861291036553216
hannah_marie321;2016-04-18 05:39;0;4;"Both my people flaked on going to the best children 's choir thing tonight #yourloss They are from Liberia, Peru, and India !";;;#yourloss;"721853088861143041";https://twitter.com/hannah_marie321/status/721853088861143041
Bitcoin_Spain;2016-04-18 04:00;1;1;"Watching children in India being introduced to Bitcoin for the first time will make you smile. A must watch!: http:// ift.tt/1Qgq5kM #bit …";;;#bit;"721828224322445312";https://twitter.com/Bitcoin_Spain/status/721828224322445312
krunox123;2016-04-18 03:52;0;0;"Watching children in India be introduced to Bitcoin will bring a smile to your face. A must watch! http:// ift.tt/1Sfq9U7 (via /r/btc)";;;;"721826307538030592";https://twitter.com/krunox123/status/721826307538030592
melon_masa;2016-04-18 03:48;0;0;"India doesn't seem to teach Indian children such Indian history, like Pakistan doesn't teach Pakistanis it. That is why many can be Hindu.";;;;"721825118771499008";https://twitter.com/melon_masa/status/721825118771499008
theasshatter;2016-04-18 03:43;0;0;"found this in the children 's section of the airport bookstore because India is grand pic.twitter.com/SvDceY61JQ";;;;"721823928348323842";https://twitter.com/theasshatter/status/721823928348323842
tinku_jiya007;2016-04-18 03:33;0;0;"@AsYouNotWish I am pretty sure that the latter is extremely rare. The upbringing of muslim children in India teaches to hate Hindus.";;@AsYouNotWish;;"721821416631316480";https://twitter.com/tinku_jiya007/status/721821416631316480
SOLDMovie;2016-04-18 03:30;11;8;"Thousands of children are going missing from India . We must #EndHumanTrafficking . Read here: http:// ow.ly/4mKQK7 #SoldTheMovie @guardian";;@guardian;#EndHumanTrafficking #SoldTheMovie;"721820726953668608";https://twitter.com/SOLDMovie/status/721820726953668608
melon_masa;2016-04-18 03:28;0;0;"#India should be put under close watch by us, good boys&girls, children of #Buddha , children of good families of the ancestry of Tathagata";;;#India #Buddha;"721820265391345664";https://twitter.com/melon_masa/status/721820265391345664
Kazistaan;2016-04-18 03:15;0;0;"@MoeedNj I wonder why one of the children is holding a placrd that reads, "I Stand for India Against Corruption. do you?" What does it mean?";;@MoeedNj;;"721816766293413888";https://twitter.com/Kazistaan/status/721816766293413888
indigovolunteer;2016-04-18 02:31;2;1;"Would you like to #Volunteer in #India ? Help children with food, clothing, shelter & education #ElShaddai need you. http://www. indigovolunteers.org/projects/el-sh addai-charitable-trust …";;;#Volunteer #India #ElShaddai;"721805771974012928";https://twitter.com/indigovolunteer/status/721805771974012928
yahyaz111;2016-04-18 02:09;0;0;"Saudi Arabia is killing children in Yemen #Paris #India #Lasvegas #Kuwait #USAKillsYemeniPeople #yemen #Nigeria #uk pic.twitter.com/VVOrD7YLPx";;;#Paris #India #Lasvegas #Kuwait #USAKillsYemeniPeople #yemen #Nigeria #uk;"721800165674364929";https://twitter.com/yahyaz111/status/721800165674364929
PearsonCanada;2016-04-18 01:30;1;1;"Meet the street children making their own newspaper in India . #shematters http:// bit.ly/263e8KQ";;;#shematters;"721790334955601920";https://twitter.com/PearsonCanada/status/721790334955601920
vandana_india;2016-04-18 01:24;0;0;"Michael Bublé shuts down haters who mocked the way he eats corn: Internet haters: Hide your children , run for... http:// on.mash.to/1p9o43M";;;;"721788951560728576";https://twitter.com/vandana_india/status/721788951560728576
EDGEofHUMANITY;2016-04-18 00:30;3;10;"#DocumentaryPhotography #Educational #Innovations For The #Disadvantaged #India https:// edgeofhumanity.com/2015/10/30/ali ce/ … #children pic.twitter.com/gSaYH0u3dE";;;#DocumentaryPhotography #Educational #Innovations #Disadvantaged #India #children;"721775260073197569";https://twitter.com/EDGEofHUMANITY/status/721775260073197569
mdCurrent_India;2016-04-18 00:25;0;0;"RT @gatesfoundation : India 's rotavirus vaccine launch is a landmark achievement & great news for children & families: http:// gates.ly/22HKuvs";;@gatesfoundation;;"721774066470948865";https://twitter.com/mdCurrent_India/status/721774066470948865
indiantvshow;2016-04-18 00:24;0;0;"New post (Is India capable of taking care of its children ?) has been published on http:// goo.gl/shf1aI";;;;"721773870445830144";https://twitter.com/indiantvshow/status/721773870445830144
Oko_Anike;2016-04-18 00:21;0;0;"The world's biggest family lives together in India : a man with 39 wives and 94 children ."";;;;"721773159557570560";https://twitter.com/Oko_Anike/status/721773159557570560
1861_again;2016-04-17 23:47;0;0;"Bill Gates Faces Trial in India for Illegal Vaccine Testing on Children http:// fb.me/4igLvifqN";;;;"721764548143902720";https://twitter.com/1861_again/status/721764548143902720
indiachildren;2016-04-17 23:39;0;0;"feeback/review of Grolier products ? - Preschoolers 2-5 years - India http:// bit.ly/23QjpmX";;;;"721762644516937732";https://twitter.com/indiachildren/status/721762644516937732
booksbyjvd;2016-04-17 23:11;0;0;"Rothschild Czar Bill Gates To Face Trial In India : Millions Of Children Poisoned By Vaccine! http:// fb.me/7hIhczZQd";;;;"721755474383761408";https://twitter.com/booksbyjvd/status/721755474383761408
CovertAnonymous;2016-04-17 23:08;5;3;"injustcef: 60,000 children disappear in India every year, i.e.more than 150 a day.";;;;"721754629307031552";https://twitter.com/CovertAnonymous/status/721754629307031552
DrRS76;2016-04-17 22:58;0;0;"Raising money for a under privileged children in India . Kindly donate if you can. https:// mydonate.bt.com/events/smileca mpaign/299255 … Thank you.";;;;"721752214931435520";https://twitter.com/DrRS76/status/721752214931435520
nriworldwide;2016-04-17 22:47;2;0;"Images of India : Street children turn reporters… http://www. nri-worldwide.com/images-of-indi a-street-children-turn-reporters/ …";;;;"721749378533322752";https://twitter.com/nriworldwide/status/721749378533322752
nriworldwide;2016-04-17 22:43;2;0;"Images of India : Street children turn reporters… http://www. nri-worldwide.com/images-of-indi a-street-children-turn-reporters/ … pic.twitter.com/tujF3Jn6lu";;;;"721748469967360000";https://twitter.com/nriworldwide/status/721748469967360000
yahyaz111;2016-04-17 22:15;1;0;"Saudi Arabia is killing children in Yemen #us #Canada #India #Lasvegas #Poland #Oman #France #Qatar #Ukraine #Brazil pic.twitter.com/xVHrwoowH8";;;#us #Canada #India #Lasvegas #Poland #Oman #France #Qatar #Ukraine #Brazil;"721741399293603840";https://twitter.com/yahyaz111/status/721741399293603840
slealey53;2016-04-17 22:02;1;1;"Bill Gates: GUILTY!!! CALL THEM OUT! I PRAY FOR JUSTICE FOR THE CHILDREN OF INDIA ! In 2009, several schools for... http:// fb.me/1em4EoXgi";;;;"721738182526676994";https://twitter.com/slealey53/status/721738182526676994
NewLifeSTL;2016-04-17 21:50;0;0;"Shoes are needed for the Children in India | NEW LIFE EVANGELISTIC CENTER INC's Fundra http:// bit.ly/1p59Hxo ... pic.twitter.com/WgW5eeEy3V";;;;"721734991823138816";https://twitter.com/NewLifeSTL/status/721734991823138816
coghome;2016-04-17 21:40;0;0;"BIG News! Building work as started on @coghome . Over 100 children praying for the construction. #India #GodisGood pic.twitter.com/FVs2pLqUDH";;@coghome;#India #GodisGood;"721732696096026624";https://twitter.com/coghome/status/721732696096026624
Paul1958John;2016-04-17 21:03;3;0;"Bill Gates Faces Trial in India for Illegal Vaccine Testing on Children https:// shar.es/1jA4AY via @@naturalsociety";;@ @naturalsociety;;"721723296606072832";https://twitter.com/Paul1958John/status/721723296606072832
PrashantrTOI;2016-04-17 21:02;8;5;"Children in #Vadodara #Gujarat enjoying first Sunday of Happy Streets - a Times of India initiative @timesofindia pic.twitter.com/0Q4KfPJdUo";;@timesofindia;#Vadodara #Gujarat;"721722964454936577";https://twitter.com/PrashantrTOI/status/721722964454936577
AfghanNews24;2016-04-17 20:55;0;0;"Afghanistan is losing its children to urban warfare, says UN - India Today http:// ow.ly/8Jug9j";;;;"721721282002358272";https://twitter.com/AfghanNews24/status/721721282002358272
annelisepiers;2016-04-17 20:38;0;0;"Meet the street children making their own newspaper in India http:// fb.me/4uBxXNX4p";;;;"721716990151389184";https://twitter.com/annelisepiers/status/721716990151389184
yahyaz111;2016-04-17 20:31;0;0;"Saudi Arabia is killing children in Yemen #SaudiArabia #India #Argentina #Russia #WarCrimesOfSaudiArabia #yemen #us pic.twitter.com/LTMqQmnZSQ";;;#SaudiArabia #India #Argentina #Russia #WarCrimesOfSaudiArabia #yemen #us;"721715165021016064";https://twitter.com/yahyaz111/status/721715165021016064
molinarobustia5;2016-04-17 19:54;0;0;"Colonial India in Children 's Literature by Supriya Goswami Hardcover Book (Engli http:// france-tourism-guide.info/rs/rc/?query=h ttp://rover.ebay.com/rover/1/711-53200-19255-0/1?ff3=2&toolid=10039&campid=5337597384&item=222089756243&vectorid=229466&lgeo=1 … pic.twitter.com/o0oSC5eh6v";;;;"721705927750062084";https://twitter.com/molinarobustia5/status/721705927750062084
globemademma;2016-04-17 19:50;38;97;"Children should just have fun! You only get one childhood! #justhavefun #childhood #india #playtime #adventure pic.twitter.com/DYL1oSq372";;;#justhavefun #childhood #india #playtime #adventure;"721704937286029312";https://twitter.com/globemademma/status/721704937286029312
clothing_india;2016-04-17 19:03;0;0;"Frozen Blue Children 's Backpack (MBE-WDP0396) http:// ift.tt/1W9gKSL pic.twitter.com/4a0KI5XMgd";;;;"721693131205382146";https://twitter.com/clothing_india/status/721693131205382146
NatSecSoc;2016-04-17 18:44;13;3;"Women left destitute and cut-off from children under Islamic divorce law in India https://www. secularism.org.uk/news/2016/04/m uslim-women-fight-to-change-misogynist-islamic-divorce-law-in-india …";;;;"721688164142686208";https://twitter.com/NatSecSoc/status/721688164142686208
tisaiyan;2016-04-17 18:01;0;0;"Passage to India : The Wartime Odyssey of Polish Children and the Good Maharaja http:// toi.in/S5GUTb";;;;"721677350941827072";https://twitter.com/tisaiyan/status/721677350941827072
OrphansInNeedIN;2016-04-17 18:00;3;4;"20,000 orphan children are in education thanks to you :-) #India #Education #charity pic.twitter.com/SNurI7BGjB";;;#India #Education #charity;"721677120603160576";https://twitter.com/OrphansInNeedIN/status/721677120603160576
SeetexTechnik;2016-04-17 17:45;0;0;"Children Baby Maternity Expo 2016 | Mother, Kids and Baby Fair Expo – CBME India http:// ow.ly/3zB7Gf";;;;"721673351660511233";https://twitter.com/SeetexTechnik/status/721673351660511233
forexhippy;2016-04-17 17:01;0;0;"Five things we learned from the children we met in India - Save the Children UK - http:// bit.ly/1oYH3Os pic.twitter.com/BmU15fvDTP";;;;"721662288734908416";https://twitter.com/forexhippy/status/721662288734908416
suway7;2016-04-17 16:44;0;0;"Rothschild Czar Bill Gates To Face Trial In India : Millions Of Children Poisoned By Vaccine! http:// fb.me/4VuMOuDsT";;;;"721658155177021440";https://twitter.com/suway7/status/721658155177021440
jaagriti_india;2016-04-17 16:42;0;0;"Movie Sunday at #Jaagriti ..We took children to watch Jungle Book movie, followed by treat at McDonalds. Thanks... http:// fb.me/77hgxtYwi";;;#Jaagriti;"721657603600859136";https://twitter.com/jaagriti_india/status/721657603600859136
indiantvshow;2016-04-17 16:27;0;0;"New post (Norway custody row ends; children arrive in India ) has been published on http:// goo.gl/NkUGzh";;;;"721653727677927424";https://twitter.com/indiantvshow/status/721653727677927424
omang_ag;2016-04-17 16:14;2;0;"Women Rights and Empowerment Session with others of Children from Arzoo and Teach for India School.";;;;"721650594859978752";https://twitter.com/omang_ag/status/721650594859978752
E_volution;2016-04-17 15:55;0;1;"Meet the street children making their own newspaper in India http:// gu.com/p/4t557/stw";;;;"721645734441959425";https://twitter.com/E_volution/status/721645734441959425
HelicopterP;2016-04-17 15:30;0;0;"Royal India tour: Kate Middleton and helicopter pilot William Arthur Philip Louis Wales 'missing the children terribly'";;;;"721639348299403264";https://twitter.com/HelicopterP/status/721639348299403264
k_sheiba;2016-04-17 15:27;3;0;"Saudi Arabia is killing children in Yemen #Italy #yemen #Iran #Oman #Chile #usa #ksa #Qatar #Russia #India #Ukraine pic.twitter.com/fgf7lxDRV6";;;#Italy #yemen #Iran #Oman #Chile #usa #ksa #Qatar #Russia #India #Ukraine;"721638585657647104";https://twitter.com/k_sheiba/status/721638585657647104
feminamissindia;2016-04-17 15:23;2;4;"@sushruthikrishn surrounded by cute children wearing tiaras in #Bangalore --> #homecoming ceremony. @fbb_ india RT pic.twitter.com/jXbIbdMGkg";;@sushruthikrishn @fbb_;#Bangalore #homecoming;"721637693122162688";https://twitter.com/feminamissindia/status/721637693122162688
Brahamvakya;2016-04-17 12:52;0;0;"@gnanambalam GC or citizenship was not important to me & is not to my children . We are fine in India & will serve whatever way can";;@gnanambalam;;"721599747262427136";https://twitter.com/Brahamvakya/status/721599747262427136
RamchandaniGP;2016-04-17 12:34;0;0;"Aryaavart - भारत - India - हिंदुस्तान is the natural home of children of Bharat Mata across the world. https:// twitter.com/IndianExpress/ status/721592547420815360 …";;;;"721595099222646784";https://twitter.com/RamchandaniGP/status/721595099222646784
barbaralond;2016-04-17 12:34;0;0;"This is a really interesting concept 2 ;sisters created Lawtoons, to educate children in India on law using cartoons http://www. lawtoons.in/collaboration/";;;;"721595095708004352";https://twitter.com/barbaralond/status/721595095708004352
ikidsworld;2016-04-17 11:55;0;0;"The Letter S for Children . Fun & engaging Underwater Video. #Kids #Parents #ECE #US #Vietnam #SaudiArabia #UK #India https:// youtu.be/9v-a_2ofRps";;;#Kids #Parents #ECE #US #Vietnam #SaudiArabia #UK #India;"721585247113068544";https://twitter.com/ikidsworld/status/721585247113068544
twiteritta;2016-04-17 11:47;2;2;"What a super, eco-friendly idea!! https:// youtu.be/ZPUFpEbkOoc #Aarambh #design #education #children @makeinindia #India";;@makeinindia;#Aarambh #design #education #children #India;"721583265694359552";https://twitter.com/twiteritta/status/721583265694359552
iindiango;2016-04-17 11:39;0;0;"Majority of children living in I-India's shelter home are enrolled with formal education and vocational training... http:// fb.me/2ozWXHEDg";;;;"721581281797083136";https://twitter.com/iindiango/status/721581281797083136
JunejaManjit;2016-04-17 11:38;10;6;"@India _Policy Minority schools will follow the norms and language of their religion.Why Hindus send their children there and blame RTE?";;@India;;"721581108660477952";https://twitter.com/JunejaManjit/status/721581108660477952
giniromet;2016-04-17 11:14;8;8;"#India has a problem with education. Our children are working far too many hours but not learning enough. @smritiirani";;@smritiirani;#India;"721575039812771840";https://twitter.com/giniromet/status/721575039812771840
yahyaz111;2016-04-17 10:52;0;0;"Saudi Arabia is killing children in Yemen #Turkey #India #Poland #Ukraine #Pakistan #Qatar #Chile #us #Virginia #ksa pic.twitter.com/JnsRtQZnUD";;;#Turkey #India #Poland #Ukraine #Pakistan #Qatar #Chile #us #Virginia #ksa;"721569577273049092";https://twitter.com/yahyaz111/status/721569577273049092
KumarSaggi;2016-04-17 10:45;0;0;"@India _Policy @neelnabh @arunjaitley @narendramodi Not every middle class urban fellows funding their children education is Neo Rich.";;@India @neelnabh @arunjaitley @narendramodi;;"721567673516236800";https://twitter.com/KumarSaggi/status/721567673516236800
drupadk;2016-04-17 10:44;2;2;"@India _Policy so basically GOI encourages conversion by driving our children into jejus schools";;@India;;"721567517244854272";https://twitter.com/drupadk/status/721567517244854272
India_Policy;2016-04-17 10:38;27;11;"An #RTE school cannot 'fail' a student. An errant cant be punished in any form or expelled. No incentive/deterrent for children to study!";;;#RTE;"721565961162100740";https://twitter.com/India_Policy/status/721565961162100740
medicodutta;2016-04-17 10:36;10;2;"#RepealRTE RTE is a plan strategy of UPA to force children 's to study in Christian schools...sonia's conspiracy to weak INDIA";;;#RepealRTE;"721565567195357184";https://twitter.com/medicodutta/status/721565567195357184
TheSheepleMedia;2016-04-17 10:33;0;0;"Rothschild Czar Bill Gates To Face Trial In India : Millions Of Children Poisoned By Vaccine! http:// fb.me/1cj86wEHO";;;;"721564618297057280";https://twitter.com/TheSheepleMedia/status/721564618297057280
bolly_hollywood;2016-04-17 10:20;0;2;"Anil Kapoor’s Mr India , Aamir Khan’s Taare Zameen Par, Inside Out – 7 children ’s films that Pahlaj Nihalan http:// bollywoodhollywood.net/?p=9002";;;;"721561469494513664";https://twitter.com/bolly_hollywood/status/721561469494513664
saranstm;2016-04-17 10:14;3;2;"India hosted Polish refugees - Passage to India : The Wartime Odyssey of Polish Children and the Good Maharaja http:// timesofindia.indiatimes.com/india/un-to-di splay-gujarat-kings-compassion-for-refugees/articleshow/51860566.cms …";;;;"721559978142633985";https://twitter.com/saranstm/status/721559978142633985
Pratham_India;2016-04-17 10:13;8;3;"AP Govt signed MoU w/ Pratham & @JPAL_SA to improve basic math & Telugu of class 3-5 children , pic @arvindeyunni pic.twitter.com/rya3RHhh87";;@JPAL_SA @arvindeyunni;;"721559586415583232";https://twitter.com/Pratham_India/status/721559586415583232
India_Policy;2016-04-17 09:49;198;86;""I cannot be forced to fund someone else's children , when I myself am making a lot of compromises to get my children educated" #RepealRTE";;;#RepealRTE;"721553735101456384";https://twitter.com/India_Policy/status/721553735101456384
