username;date;retweets;favorites;text;geo;mentions;hashtags;id;permalink
ReliefIndia;2016-04-13 18:05;0;0;"Giving help to the Relief India Trust is like giving the children a positive difference in their lives https:// lnkd.in/bWHa-y5";;;;"720229017173958658";https://twitter.com/ReliefIndia/status/720229017173958658
indiachildren;2016-04-13 17:51;0;0;"Schooling Advice Required!! - Preschoolers 2-5 years - India http:// bit.ly/1Szdyu3";;;;"720225388165660672";https://twitter.com/indiachildren/status/720225388165660672
vandana_india;2016-04-13 17:44;0;1;"Inside the squalid tenements of 1890s New York City: 1895Street children huddle over a grate for warmth on Mul... http:// on.mash.to/1qQFTGB";;;;"720223653716033536";https://twitter.com/vandana_india/status/720223653716033536
sarkar_swati;2016-04-13 17:40;0;1;"@nayanikaaa No, that was another woman in India . He had children with the Japanese lady";;@nayanikaaa;;"720222671561224192";https://twitter.com/sarkar_swati/status/720222671561224192
AapKaGopalRai;2016-04-13 17:30;33;29;"Picnic with children 's at India Gate for awareness on environment and #OddEven https://www. youtube.com/watch?v=VIufOa aJZRA …";;;#OddEven;"720220155045900290";https://twitter.com/AapKaGopalRai/status/720220155045900290
nippynews;2016-04-13 17:30;0;1;"Economic Times - India - I am confident our children will come back Kashmir is their home. - http:// economictimes.indiatimes.com/news/politics- and-nation/mehbooba-mufti-meets-prime-minister-narendra-modi/articleshow/51809085.cms …";;;;"720220012623998976";https://twitter.com/nippynews/status/720220012623998976
yahyaz111;2016-04-13 17:15;0;0;"Saudi Arabia is killing children in Yemen #SaudiArabia #Lasvegas #Argentina #Ukraine #Berlin #Pakistan #India #us pic.twitter.com/8utzbkn8Lm";;;#SaudiArabia #Lasvegas #Argentina #Ukraine #Berlin #Pakistan #India #us;"720216420617961472";https://twitter.com/yahyaz111/status/720216420617961472
TheGlobalCrisis;2016-04-13 17:12;1;0;"Article: In drought-hit India , village children climb down dangerous wells to fetch water http:// mashable.com/2016/04/13/ind ia-water-shortage/#5RVRm_r_805B … #India #TheWaterCrisis";;;#5RVRm_r_805B #India #TheWaterCrisis;"720215565290369024";https://twitter.com/TheGlobalCrisis/status/720215565290369024
idesksolutions;2016-04-13 17:11;0;0;"BBC News - Granny army helps India 's school children via the cloud http://www. bbc.co.uk/news/technolog y-17114718 …";;;;"720215269344460800";https://twitter.com/idesksolutions/status/720215269344460800
KaShFRaNa7;2016-04-13 17:02;0;0;"INDIA : Prince Wiliam and Kate visit Street Children in Delhi. pic.twitter.com/40hjlnnISj";Punjab, Pakistan;;;"720212945867784192";https://twitter.com/KaShFRaNa7/status/720212945867784192
R_Hawkes;2016-04-13 16:52;2;5;"With deafblind children at Blind People's Association India . 18 yrs ago I had the honour of inaugurating this unit. pic.twitter.com/nKznZuk9Fi";;;;"720210497405108224";https://twitter.com/R_Hawkes/status/720210497405108224
JIbbran;2016-04-13 16:48;0;1;"@neelams1231 @shainz123 @sanjivbhatt Why doesnt India correct that mistake. We have lost enough lives and orphaned enough children .";;@neelams1231 @shainz123 @sanjivbhatt;;"720209511143841792";https://twitter.com/JIbbran/status/720209511143841792
Prince_1_George;2016-04-13 16:42;0;0;"Kate Says She’s Missing Her Children – And Reveals The Sweet Reason George Couldn’t Come To India http:// fb.me/3LTVBNXPO";;;;"720208038708305921";https://twitter.com/Prince_1_George/status/720208038708305921
AgendaOfEvil;2016-04-13 16:41;4;2;"#India : Suspected Mujahid gun down a man in front of his wife and #children . pic.twitter.com/k1SyQnRJIB";;;#India #children;"720207802908745728";https://twitter.com/AgendaOfEvil/status/720207802908745728
nydiashiro;2016-04-13 16:37;0;0;"The Duke and Duchess of Cambridge visit a charity working with street children in India on the third day of their South Asia tour.";;;;"720206660153663488";https://twitter.com/nydiashiro/status/720206660153663488
IsossyOccasion;2016-04-13 16:31;0;0;"William and Kate meet homeless children in India http://www. itv.com/news/2016-04-1 2/william-and-kate-meet-homeless-children-in-india/ …";;;;"720205250435661824";https://twitter.com/IsossyOccasion/status/720205250435661824
wonderfulinfo;2016-04-13 16:25;0;0;"Hara hara India – Children initiative towards Swachh Bharat: Following the guidance of the 53rd Dai al-Mutlaq... http:// bit.ly/1VUi9g3";;;;"720203742042152962";https://twitter.com/wonderfulinfo/status/720203742042152962
WIC_India;2016-04-13 16:19;0;0;"Ranjit Lal: Ranjit Lal has written over thirty books for both adults and children . Some of his books include... http:// fb.me/3Fc74cw9q";;;;"720202339152297984";https://twitter.com/WIC_India/status/720202339152297984
indiachildren;2016-04-13 16:18;0;0;"Shy Kid. Not talking or answering to new people - Preschoolers 2-5 years - India http:// bit.ly/1VUhc7d";;;;"720201926290190336";https://twitter.com/indiachildren/status/720201926290190336
maxus1com;2016-04-13 16:16;0;0;"Mashable: In drought-hit India , village children climb down dangerous wells to fetch water http:// ow.ly/3duSVn";;;;"720201576162422784";https://twitter.com/maxus1com/status/720201576162422784
DrBarkatSoomro;2016-04-13 16:14;0;0;"The Duke and Duchess of Cambridge visited a charity working with street children in India on 3rd day of their tour. pic.twitter.com/pdRyk5J0yb";;;;"720200971880697856";https://twitter.com/DrBarkatSoomro/status/720200971880697856
wonderfulinfo;2016-04-13 16:12;0;0;"Hara hara India – Children initiative towards Swachh Bharat http://www. wonderfulinfo.com/hara-hara-indi a-children-initiative-towards-swachh-bharat/ …";;;;"720200599573123072";https://twitter.com/wonderfulinfo/status/720200599573123072
ViratKohliBAE_x;2016-04-13 16:06;0;0;"@KohlisFlickShot @DhonixFaithful But I must you both have bore the best children ever! Atleast 30 kar lena, india ko talent ki zarurat h";;@KohlisFlickShot @DhonixFaithful;;"720198878180610048";https://twitter.com/ViratKohliBAE_x/status/720198878180610048
CRCAsia;2016-04-13 15:49;0;0;"INDIA : #StreetChildren contribute to #UNCRC General Comment on Children in Street Situations. http:// buff.ly/1Sydue8";;;#StreetChildren #UNCRC;"720194597134184448";https://twitter.com/CRCAsia/status/720194597134184448
MirrorRoyal;2016-04-13 15:43;6;10;"Kate Middleton says she's missing her children but says Prince George is 'too naughty' to join India tour: K... http:// bit.ly/1oWPXfl";;;;"720193098060398593";https://twitter.com/MirrorRoyal/status/720193098060398593
poipleshadow;2016-04-13 15:37;0;1;"Latest Blog : Recently I was contacted by THE VOICE KIDS - INDIA , who were looking out for children to perform in... http:// fb.me/8ab9DI19k";;;;"720191713965420545";https://twitter.com/poipleshadow/status/720191713965420545
DavidPapp;2016-04-13 15:37;2;7;"In drought-hit India , village children climb down dangerous wells to fetch water http:// j.mp/1VU9sCk";;;;"720191567554813952";https://twitter.com/DavidPapp/status/720191567554813952
GoaOutreach;2016-04-13 15:34;0;0;"Recently I was contacted by THE VOICE KIDS - INDIA , who were looking out for children to perform in their... http:// fb.me/2YW751pDM";;;;"720191006658981888";https://twitter.com/GoaOutreach/status/720191006658981888
TMStreetAnalyst;2016-04-13 15:32;0;0;"#M1Blog In drought-hit India , village children climb down dangerous wells to fetch water http:// ow.ly/3duOK3";;;#M1Blog;"720190447763722240";https://twitter.com/TMStreetAnalyst/status/720190447763722240
lisabriercliffe;2016-04-13 15:32;1;1;"In drought-hit India , village children climb down dangerous wells to fetch water http:// ift.tt/1oWNrFX";;;;"720190434421645312";https://twitter.com/lisabriercliffe/status/720190434421645312
AKF_India;2016-04-13 15:32;0;2;"Naman Bansal, SBI Fellow, is working with #AKRSP to foster creativity in marginalised children at schools in Bihar: http:// bit.ly/1RTyobD";;;#AKRSP;"720190367262314496";https://twitter.com/AKF_India/status/720190367262314496
Toyota_Venza;2016-04-13 15:32;0;0;"#SuryaRay #Surya Nice Blog @suryaray In drought-hit India , village children … http:// dlvr.it/L2tjh2 #SuryaRay #Indian @suryaray @suryaray3";;@suryaray @suryaray @suryaray3;#SuryaRay #Surya #SuryaRay #Indian;"720190330637656064";https://twitter.com/Toyota_Venza/status/720190330637656064
amassdigital;2016-04-13 15:31;0;0;"Mashable: In drought-hit India , village children climb down dangerous wells to fetch water http:// ow.ly/3duOn0";;;;"720190151926943744";https://twitter.com/amassdigital/status/720190151926943744
LeVarThomas;2016-04-13 15:30;0;0;"In drought-hit India , village children dangerously climb down wells to fetch water: As several p... http:// on.mash.to/1VU8HZV via @Mashable";;@Mashable;;"720189995642818560";https://twitter.com/LeVarThomas/status/720189995642818560
ReliefIndia;2016-04-13 15:30;0;0;"“Giving Help to Relief India Trust” - Have you learned that there are thousands of poor children in India ... https:// tmblr.co/ZsIu1k21rrwSJ";;;;"720189994250465280";https://twitter.com/ReliefIndia/status/720189994250465280
valla_official;2016-04-13 15:30;0;0;"( ! #Axeliito_x3 ! ) In drought-hit India , village children dangerously climb down wells t... http:// on.mash.to/1VU8INE - $ #WizKhalifa $ -";;;#Axeliito_x3 #WizKhalifa;"720189943289483264";https://twitter.com/valla_official/status/720189943289483264
HaskellTech;2016-04-13 15:30;0;1;"In drought-hit India , village children dangerously climb down wells to fetch water: As several parts of India ... http:// on.mash.to/1VU8HZV";;;;"720189920644452354";https://twitter.com/HaskellTech/status/720189920644452354
Martin_beaulieu;2016-04-13 15:29;0;2;"In drought-hit India , village children climb down dangerous wells to fetch water http:// dlvr.it/L2tfkX";;;;"720189743225380864";https://twitter.com/Martin_beaulieu/status/720189743225380864
yo_yo_baba;2016-04-13 15:28;0;0;"In drought-hit India , village children dangerously climb down wells to fetch… http:// dlvr.it/L2tdhX Via @mashable pic.twitter.com/1APCGIGbAA";;@mashable;;"720189448483241985";https://twitter.com/yo_yo_baba/status/720189448483241985
LoriMoreno;2016-04-13 15:28;2;2;"In drought-hit India , village children dangerously climb down wells to fetch water http:// dlvr.it/L2tcpf";;;;"720189354631540736";https://twitter.com/LoriMoreno/status/720189354631540736
sawetachai;2016-04-13 15:28;0;1;"In drought-hit India , village children dangerously climb down wells to fetch water http:// dlvr.it/L2td1n #iPOst";;;#iPOst;"720189350072295424";https://twitter.com/sawetachai/status/720189350072295424
Geekme_;2016-04-13 15:28;0;0;"In drought-hit India , village children climb down dangerous wells to fetch water: As several parts of India fa... http:// bit.ly/1V0L7vH";;;;"720189319562940416";https://twitter.com/Geekme_/status/720189319562940416
redzoneemb;2016-04-13 15:27;0;1;"#SocialMedia #Seo In drought-hit India , village children dangerously climb down wells to fetch... http:// on.mash.to/1VU8HZV #tech #BUSINESS";;;#SocialMedia #Seo #tech #BUSINESS;"720189269843677184";https://twitter.com/redzoneemb/status/720189269843677184
GbrilliantQ;2016-04-13 15:27;1;0;"In drought-hit India , village children dangerously climb down wells to fetch water: As several parts of India ... http:// on.mash.to/1VU8INE";;;;"720189121738637312";https://twitter.com/GbrilliantQ/status/720189121738637312
TheMehulPatel;2016-04-13 15:27;7;6;"In drought-hit India , village children dangerously climb down wells to fetch water http:// on.mash.to/1VU8INE";;;;"720189036799795200";https://twitter.com/TheMehulPatel/status/720189036799795200
MashableIndia;2016-04-13 15:26;0;0;"In drought-hit India , village children climb down dangerous wells to fetch water http:// on.mash.to/1V0KYs4 pic.twitter.com/2HXVhRx3Al";;;;"720189008404418561";https://twitter.com/MashableIndia/status/720189008404418561
fatemidawat53;2016-04-13 15:23;3;3;"#DawoodiBohra Children initiative towards #SwachhBharat https:// youtu.be/MnxWtDHcoeU #DawoodiBohras #Bohras #CleanIndia #GreenIndia #India";;;#DawoodiBohra #SwachhBharat #DawoodiBohras #Bohras #CleanIndia #GreenIndia #India;"720188055018086400";https://twitter.com/fatemidawat53/status/720188055018086400
DisabilityTD;2016-04-13 15:16;1;1;"Kenya to immunise 9 million children against polio - Times of India - http://www. disabilitytoday.co.uk/kenya-to-immun ise-9-million-children-against-polio-times-of-india/ …";;;;"720186290273140736";https://twitter.com/DisabilityTD/status/720186290273140736
guardianobits;2016-04-13 14:55;0;0;"Joe Homan obituary. Founder of a network of villages for destitute children in southern India http:// bit.ly/1S7XZMS";;;;"720181099540951040";https://twitter.com/guardianobits/status/720181099540951040
Patellytubby;2016-04-13 14:41;0;0;"BBC News - William and Kate visit street children in India http://www. bbc.co.uk/news/uk-360226 47?ocid=socialflow_facebook&#38;ns_mchannel=social&#38;ns_campaign=bbcnews&#38;ns_source=facebook …";;;#38 #38 #38;"720177494461165568";https://twitter.com/Patellytubby/status/720177494461165568
ComboNewsIndia;2016-04-13 13:47;0;0;"Madhya Pradesh Villagers Have A Tough Choice: Go Thirsty Or Starve: Women and children of Raja ki... http:// bit.ly/1VTL6si #India #News";;;#India #News;"720164008364351488";https://twitter.com/ComboNewsIndia/status/720164008364351488
The_BPB;2016-04-13 13:45;1;0;"Royal couple visit centre for vulnerable children with #mentalhealth problems in #Delhi , #India : http://www. bbc.co.uk/news/world-asi a-36027793 …";;;#mentalhealth #Delhi #India;"720163432465567745";https://twitter.com/The_BPB/status/720163432465567745
AskAnshul;2016-04-13 13:35;84;60;"Govt must provide Free Education, Govt Job and other welfare facilities to 'Tanzil Ahmed - Farzana' kids. They're children of India 's Pride.";;;;"720160951652237312";https://twitter.com/AskAnshul/status/720160951652237312
waheedgul;2016-04-13 13:30;13;3;"Child marriage in India one of the worst violations of children 's rights #WorldMediaFocusIndianRapes @BBCtrending pic.twitter.com/Lkm70AiS5Z";;@BBCtrending;#WorldMediaFocusIndianRapes;"720159696158457856";https://twitter.com/waheedgul/status/720159696158457856
dlIndianews;2016-04-13 13:17;0;0;"School children pledge they'll follow odd-even - Times of India : The Indian ExpressSchool children pledge they... http:// bit.ly/20ADY4T";;;;"720156455765082112";https://twitter.com/dlIndianews/status/720156455765082112
McGMaryland;2016-04-13 13:12;0;0;"A place to call their own at Little Lamps: India (MNN) -- Today, girls at Little Lamps Children ’s H... http:// bit.ly/1oWuK52 #mcgspirit";;;#mcgspirit;"720155272434425856";https://twitter.com/McGMaryland/status/720155272434425856
Mint_lounge;2016-04-13 12:41;1;1;"Return of #OddEven . School children show hand-drawn posters on air pollution near India Gate. Photo: @rameshpathania pic.twitter.com/zFch06xknJ";;@rameshpathania;#OddEven;"720147361125789697";https://twitter.com/Mint_lounge/status/720147361125789697
mmichav;2016-04-13 12:16;0;1;"Age group of 0 - 6 years is critical to ensure holistic development of children . Support Born Learning to make India … https:// lnkd.in/b4yNvuf";;;;"720141181619871744";https://twitter.com/mmichav/status/720141181619871744
7NewsMelbourne;2016-04-13 12:16;1;0;"The Cambridge royal's visited the slums of India today, connecting with children and the charities that help them. http:// snpy.tv/1oWnXIG";;;;"720141080679751680";https://twitter.com/7NewsMelbourne/status/720141080679751680
vandana_india;2016-04-13 10:56;0;0;"Explainer: why children are at risk of hand, foot and mouth disease: Kerrigan McCarthy, National Institute for... http:// huff.to/1oWeDoc";;;;"720120939581677568";https://twitter.com/vandana_india/status/720120939581677568
larris16;2016-04-13 10:27;0;1;"@SkyNews Has there been any discussions concerning to abuse of women and children in India ?";;@SkyNews;;"720113699747442688";https://twitter.com/larris16/status/720113699747442688
JJZaveri;2016-04-13 10:14;0;0;"Children of illegal immigrants blocked from enrolling in US schools: Report - Times of India http:// ift.tt/1qHaLZL http:// fb.me/2AkiQrBHl";;;;"720110369876942848";https://twitter.com/JJZaveri/status/720110369876942848
9NewsMelb;2016-04-13 10:11;0;6;"The Duke and Duchess of Cambridge have greeted disadvantaged children during their visit to India . #9News pic.twitter.com/LVi3q8NoQy";;;#9News;"720109599697854465";https://twitter.com/9NewsMelb/status/720109599697854465
conventuslaw;2016-04-13 09:47;0;0;"Children In India Have Their Say On Ground-Breaking International Guidance On Street Children ’s Rights. https:// shar.es/1jcOIh";;;;"720103695845879815";https://twitter.com/conventuslaw/status/720103695845879815
Riefs68;2016-04-13 09:44;0;0;"#WTF ...The Children in Kolkata, India , were lay down to be blessed on Gajan Religious Festival, April 12, 2016... pic.twitter.com/F1TiPLN7Nu";;;#WTF;"720102844897079296";https://twitter.com/Riefs68/status/720102844897079296
pappandas1;2016-04-13 09:19;0;0;"Two of Donald Trump's children can't vote in New York primary - The Times of India http:// toi.in/H9Xugb/a18cg via @timesofindia";;@timesofindia;;"720096527193096192";https://twitter.com/pappandas1/status/720096527193096192
ikidsworld;2016-04-13 09:15;1;8;"Video for Kids. Learning Colors Underwater for Children . #KidsTV #ECE #Parenting #US #UK #India #Vietnam #Dubai https:// youtu.be/988teMBLu-c";;;#KidsTV #ECE #Parenting #US #UK #India #Vietnam #Dubai;"720095436489551872";https://twitter.com/ikidsworld/status/720095436489551872
AgendaOfEvil;2016-04-13 09:05;1;0;"http:// timesofindia.indiatimes.com/world/rest-of- world/Boko-Haram-using-more-children-as-suicide-bombers-Unicef-says/articleshow/51803381.cms … #BokoHaram using more #children as #suicide #bombers , Unicef says - Times of #India";;;#BokoHaram #children #suicide #bombers #India;"720093103571537921";https://twitter.com/AgendaOfEvil/status/720093103571537921
indiantvshow;2016-04-13 08:52;0;0;"New post (No takers for Midnight's Children film: India becoming too sensitive?) has been published on http:// goo.gl/1GYjdY";;;;"720089843951230976";https://twitter.com/indiantvshow/status/720089843951230976
shreha211985;2016-04-13 08:43;0;0;"Humble request 4 DNA on d 2 pose wid “slum children ”, lament poverty in India & on d cooking lessons, #Kate &Prince @sardanarohit";;@sardanarohit;#Kate;"720087416611217410";https://twitter.com/shreha211985/status/720087416611217410
JDPasricha;2016-04-13 08:25;0;0;"Prince William & Kate Middleton meet street children in New Delhi, India http:// pinterest.com/pin/2822491016 25464154/ …";;;;"720083061292052483";https://twitter.com/JDPasricha/status/720083061292052483
Krishragavan;2016-04-13 07:46;2;0;"SC JUDGES of India R who R on twitter, do you have guts to stop circumcision, its un scientific cruelty on Children ? #IndSCStop &Listen -1";;;#IndSCStop;"720073208901279744";https://twitter.com/Krishragavan/status/720073208901279744
HollywoodLife;2016-04-13 06:45;11;10;"Kate Middleton charms children in India by crawling on the floor to draw with them http:// hollywood.li/JzCCTsF pic.twitter.com/MqFx9gnYj9";;;;"720057681776615424";https://twitter.com/HollywoodLife/status/720057681776615424
teesmitt;2016-04-13 06:36;1;4;"Thankful for the ability to provide bibles, school supplies, toothbrushes & more for underprivileged children in the slums of India !";;;;"720055582670118912";https://twitter.com/teesmitt/status/720055582670118912
ikidsworld;2016-04-13 06:25;0;6;"Fun & engaging learning video for children . #ECE #Kids #Preschool #Parenting #US #UK #Vietnam #India #Texas #Florida https:// youtu.be/MMQDdT4d1Xk";;;#ECE #Kids #Preschool #Parenting #US #UK #Vietnam #India #Texas #Florida;"720052652764184577";https://twitter.com/ikidsworld/status/720052652764184577
SamanthaJRyder;2016-04-13 06:02;0;0;"3,000 children dying daily from malnourishment in India ,if only more food were the easy solution, @WFP , #womensrights http:// goo.gl/dhl3By";;@WFP;#womensrights;"720046955498487808";https://twitter.com/SamanthaJRyder/status/720046955498487808
FILLIPAdotcom;2016-04-13 06:00;0;0;"Education programme for differently abled children launched - Times of India http:// bit.ly/23CL76F";;;;"720046503784415234";https://twitter.com/FILLIPAdotcom/status/720046503784415234
BishopBrad;2016-04-13 05:53;0;0;"A place to call their own at Little Lamps - India (MNN) -- Today, girls at Little Lamps Children ’s Home in Indi... http:// ow.ly/3du234";;;;"720044669099470848";https://twitter.com/BishopBrad/status/720044669099470848
MumsStop;2016-04-13 05:09;0;1;"#Celebrity #CelebrityNews Kate Middleton Is in Full Mother Mode as She Colours With Children in India http:// dld.bz/ezhkW";;;#Celebrity #CelebrityNews;"720033651564613632";https://twitter.com/MumsStop/status/720033651564613632
forgottenintl;2016-04-13 05:08;0;0;"Children at the Tabitha Enabling Academy in India are given support and education. This academy helps these... http:// fb.me/3eiTjphjC";;;;"720033311834435585";https://twitter.com/forgottenintl/status/720033311834435585
morningshowon7;2016-04-13 04:52;3;5;"The Duke and Duchess of Cambridge have spent an emotional day with disadvantaged children in India . #TMS7 http:// snpy.tv/1Vnbo7O";;;#TMS7;"720029370463551488";https://twitter.com/morningshowon7/status/720029370463551488
TheTodayShow;2016-04-13 04:48;2;4;"It's been a moving third day on tour for Wills and Kate, visiting some of India 's poorest children . #9Today http:// snpy.tv/22sMfHE";;;#9Today;"720028325465300992";https://twitter.com/TheTodayShow/status/720028325465300992
lcphotooftheday;2016-04-13 04:15;0;0;"This shot was taken at a remote village by name Nurpur, India . These local children were playing on the bank of... http:// fb.me/11vbqnaks";;;;"720019954234318848";https://twitter.com/lcphotooftheday/status/720019954234318848
UKRoyalNews;2016-04-13 04:00;0;5;"VIDaeaoa: William and Kate visit street children in India - BBC News #RoyalVisitIndia http://www. bbc.co.uk/news/uk-360226 47 …";;;#RoyalVisitIndia;"720016347216928768";https://twitter.com/UKRoyalNews/status/720016347216928768
Dubintertainer;2016-04-13 02:51;0;0;"Kate Middleton, Prince William Meet With Vulnerable, At-Risk Children in India : Heartbreaking Det... http:// usm.ag/1VRgiZn #Videos #May";;;#Videos #May;"719999021058658304";https://twitter.com/Dubintertainer/status/719999021058658304
nilesholsinger;2016-04-13 02:40;2;6;"Will you help my friend @GeorgianBanov purchase a children 's home in India ? This GREAT soil to sow into! https:// globalcelebration.com/india/";;@GeorgianBanov;;"719996082776727552";https://twitter.com/nilesholsinger/status/719996082776727552
arianeda;2016-04-13 02:34;5;5;"School for migrant children #slum Amazing involvment of #Baddi India factory team @LOrealCommitted #positiveimpact pic.twitter.com/5yOrnFHBwE";;@LOrealCommitted;#slum #Baddi #positiveimpact;"719994601801707520";https://twitter.com/arianeda/status/719994601801707520
cmagazine;2016-04-13 02:30;2;3;"We partnered with Priyam Global to create the Hope Bracelet to help alleviate poverty for children in Southern India http:// bit.ly/1XtPIED";;;;"719993569919045632";https://twitter.com/cmagazine/status/719993569919045632
9NewsAUS;2016-04-13 02:16;23;25;"Duke and Duchess of Cambridge meet abandoned and abused children on third day of tour of India . #9News http:// snpy.tv/23ss7el";;;#9News;"719990206502309888";https://twitter.com/9NewsAUS/status/719990206502309888
SarahThomasdeB;2016-04-13 02:10;2;1;"Royals in India , International Day4Street Children - challenge your perceptions #TweetForTheStreet @streetchildren http:// bit.ly/1VjfI7E";;@streetchildren;#TweetForTheStreet;"719988543020523520";https://twitter.com/SarahThomasdeB/status/719988543020523520
RachelZello;2016-04-13 02:08;0;2;"These are just some of the children who have been rescued from or are still in the slums/ brothels of Pune, India . pic.twitter.com/Jz4YT2sCNr";Haveli, India;;;"719988201771966464";https://twitter.com/RachelZello/status/719988201771966464
kepamer;2016-04-13 02:08;0;1;"Picture of children swimming in a lake in India pic.twitter.com/V0LkmfziZf";California, USA;;;"719988199469264896";https://twitter.com/kepamer/status/719988199469264896
ESkwarczynski;2016-04-13 01:57;1;2;"49 days left to donate toward our move to India so we can serve at the #AzlynnNoelle Children 's Home! http:// buff.ly/1Svs8mj";;;#AzlynnNoelle;"719985437092261890";https://twitter.com/ESkwarczynski/status/719985437092261890
GHeartN;2016-04-13 01:39;0;2;"Be a part of GHN first crowdfunding campaign and help Dr.Sekar repair children 's hearts @India #love #crowdfunding http://www. caringcrowd.org/repairing-chil drens-hearts-india …";;@India;#love #crowdfunding;"719980814293987328";https://twitter.com/GHeartN/status/719980814293987328
SarahThomasdeB;2016-04-13 01:38;1;1;"Royal couple visit street children in India on International Day for Street Children - brilliant! @streetchildren http:// bbc.in/1qFPBeA";;@streetchildren;;"719980601185595395";https://twitter.com/SarahThomasdeB/status/719980601185595395
missimpolitic;2016-04-13 01:02;0;0;"#Asia - Duke & Duchess of Cambridge visit street children in India on the third day of their South Asia tour.... http:// fb.me/2HaVflAPx";;;#Asia;"719971411780087809";https://twitter.com/missimpolitic/status/719971411780087809
missimpolitic;2016-04-13 01:02;0;1;"#Asia - Duke & Duchess of Cambridge visit street children in India on the third day of their South Asia tour. http://www. bbc.co.uk/news/world-asi a-36022964 …";;;#Asia;"719971394763657216";https://twitter.com/missimpolitic/status/719971394763657216
India_travel_s;2016-04-13 00:52;0;0;"No disciplinary action against employees with more than 2 children : Rajasthan government - Economic Times http:// dlvr.it/L2cY6b";;;;"719968980480319488";https://twitter.com/India_travel_s/status/719968980480319488
