username;date;retweets;favorites;text;geo;mentions;hashtags;id;permalink
KvanOosterom;2016-04-23 04:29;3;2;"Impressive exhibition "Passage to India : wartime odyssey of Polish children and the good Maharaja", by @PLinUN pic.twitter.com/MHKoV0hSMh";;@PLinUN;;"723647496275255297";https://twitter.com/KvanOosterom/status/723647496275255297
Manzoor;2016-04-23 01:47;91;35;"Soran Singh Indian wife wanted him to leave #Pakistan , but he refused, which led to divorce. His both children are in India with their mom.";;;#Pakistan;"723606743390015488";https://twitter.com/Manzoor/status/723606743390015488
JustSexQuotes;2016-04-23 01:36;13;18;"The world's largest family resides in India , consisting of one man, with 39 wives and 94 children .";;;;"723603818437574657";https://twitter.com/JustSexQuotes/status/723603818437574657
OpportunityHope;2016-04-23 00:32;1;1;"Children in India and across the world are facing hopelessness, are you willing to step in and make a difference?";;;;"723587687035342852";https://twitter.com/OpportunityHope/status/723587687035342852
WIIS_Global;2016-04-23 00:31;0;0;"via @Reuters : India is working to curb the widespread #trafficking of #women , children . http:// ow.ly/4mWDCM";;@Reuters;#trafficking #women;"723587642290507777";https://twitter.com/WIIS_Global/status/723587642290507777
vandana_india;2016-04-23 00:30;0;0;"Two small children give their mom a highly innovative makeover: Smearing is the new contouring. This Scott... http:// on.mash.to/1VqJs2N";;;;"723587302287507456";https://twitter.com/vandana_india/status/723587302287507456
inspiritwriter;2016-04-22 23:49;0;0;"Had a BLAST with our Channel 4 News team in covering our Humanitarian Aid going to women and children in India !... http:// fb.me/7lQiLeIOO";;;;"723576906604490753";https://twitter.com/inspiritwriter/status/723576906604490753
ckaushik;2016-04-22 23:07;0;0;"For 16 years this ATM security guard has been teaching slum children by night - Think Change India http:// fb.me/12YIYOV2Y";;;;"723566364447764482";https://twitter.com/ckaushik/status/723566364447764482
LCHC_CA;2016-04-22 23:00;0;0;"India suffering from the effects of the consumption of #SSB by their children http:// ow.ly/4mZBKk #SodaKills";;;#SSB #SodaKills;"723564608238305284";https://twitter.com/LCHC_CA/status/723564608238305284
OpportunityHope;2016-04-22 22:59;0;0;"Want to know a great way to invest in the future of children in India ? Visit http:// OpportunityHope.org today and learn more!";;;;"723564290356219904";https://twitter.com/OpportunityHope/status/723564290356219904
RohiniMithra;2016-04-22 22:54;40;51;"" India is the same land which stands firmer than any rock in the world & we're the children of such a country." ~Swami Vivekananda";;;;"723563023810584576";https://twitter.com/RohiniMithra/status/723563023810584576
rangdeindia;2016-04-22 22:31;0;0;"Swachha Bharat Abhiyan books for school children in India got published. Pictures of books of all the grades are... http:// fb.me/5KhLLLBF6";;;;"723557306978295810";https://twitter.com/rangdeindia/status/723557306978295810
valentin_india;2016-04-22 22:19;6;6;"Passover was historically used as an excuse to accuse Jews of murdering Christian children for matzah, then killing the community.";;;;"723554314644512768";https://twitter.com/valentin_india/status/723554314644512768
AIFoundation;2016-04-22 22:18;1;2;"Check out our online campaign to connect children in #India to technology! https:// svgives.razoo.com/us/story/Aif #SVGives pic.twitter.com/ve0FRCAW4G";;;#India #SVGives;"723554089699823616";https://twitter.com/AIFoundation/status/723554089699823616
mdCurrent_India;2016-04-22 21:35;0;0;"High Mortality Risk in Hypoglycemic & Dysglycemic Children Admitted at Hospital in a Non Malaria Low Income Country http:// ow.ly/1089JK";;;;"723543362880573440";https://twitter.com/mdCurrent_India/status/723543362880573440
beingaashu;2016-04-22 21:08;0;2;"Actually These children need reservation but no one protest for them #reservation #zeroreservation #india @PMOIndia pic.twitter.com/BKr0hROo4A";;@PMOIndia;#reservation #zeroreservation #india;"723536359806275584";https://twitter.com/beingaashu/status/723536359806275584
indian24news;2016-04-22 20:49;1;3;"Madhya Pradesh: Two children drown in well while trying to drink water http:// goo.gl/TPjDPT #news #India pic.twitter.com/Skd9NQSFZo";;;#news #India;"723531628245475328";https://twitter.com/indian24news/status/723531628245475328
ikidsworld;2016-04-22 20:00;0;5;"Learning Numbers for Toddlers and Preschoolers. #Kids #children #ECE #US #UK #India #Turkey #Vietnam #Thailand https:// youtu.be/wDVCzqziqes";;;#Kids #children #ECE #US #UK #India #Turkey #Vietnam #Thailand;"723519378663333889";https://twitter.com/ikidsworld/status/723519378663333889
capgaznews;2016-04-22 19:59;0;3;"Around Annapolis: St. Mary's students provide backpacks to children in India 's slums - http:// capgaz.co/1Qs9fj0";;;;"723518988420947972";https://twitter.com/capgaznews/status/723518988420947972
ikidsworld;2016-04-22 19:50;0;5;"The Alphabet Letter G & Color Green for children . #Kids #Preschool #ECE #Parents #US #England #Canada #India #Japan https:// youtu.be/NKReuTxne1E";;;#Kids #Preschool #ECE #Parents #US #England #Canada #India #Japan;"723516782045224960";https://twitter.com/ikidsworld/status/723516782045224960
KG_soton;2016-04-22 19:36;1;2;"National Family Health Survey #India estimates that 8 million under-five children in India are suffering from severe acute malnutrition!!";;;#India;"723513257097592832";https://twitter.com/KG_soton/status/723513257097592832
mildred43533;2016-04-22 19:28;2;0;"Data from the All India Institute of Medical Sciences (AIIMS) has revealed that one in four children seen by the ophthalmic department";;;;"723511181407821826";https://twitter.com/mildred43533/status/723511181407821826
M9Thakur;2016-04-22 19:20;0;0;"More children are produced by Muslims to expand Islam-Pakistani Same applicable in India http:// youtu.be/hjPoRCREslU";;;;"723509379576827904";https://twitter.com/M9Thakur/status/723509379576827904
hillemanlab;2016-04-22 19:17;3;4;"@NHP_ INDIA Indradhanush allows parents to track immunization of their children through a new app http:// bit.ly/1Vn7lbc @mdCurrent_ India";;@NHP_ @mdCurrent_;;"723508457941401600";https://twitter.com/hillemanlab/status/723508457941401600
dharam_vj;2016-04-22 18:56;34;15;"Should India have "2 Children Law" for every citizen? @girirajsinghbjp @anjanaomkashyap";;@girirajsinghbjp @anjanaomkashyap;;"723503346947117056";https://twitter.com/dharam_vj/status/723503346947117056
allindiadaily;2016-04-22 18:50;0;0;"The world’s biggest family lives in Mizoram , India . One man, 39 wives and 94 children , 14-daughters-in-law and... http:// fb.me/598gIM5y7";;;;"723501612245856257";https://twitter.com/allindiadaily/status/723501612245856257
noconversion;2016-04-22 18:48;44;17;"Today is Children Bible Day in INDIA Poor kids are given FREE Bibles instead of TEXT books https://www. facebook.com/revshelleybos/ posts/1699739140297560 … Shame @smritiirani";;@smritiirani;;"723501135282098177";https://twitter.com/noconversion/status/723501135282098177
ADOIndia;2016-04-22 18:32;0;0;"Systematic healthcare interventions for mothers and children at the heart of Bihar’s progress http:// buff.ly/1pnZuwg #ActivHealth #India";;;#ActivHealth #India;"723497260693241857";https://twitter.com/ADOIndia/status/723497260693241857
missionheal_org;2016-04-22 18:32;0;0;"Mission Heal | Helping the Less Fortunate Children In India #flickr https:// flic.kr/p/ESYFzB";;;#flickr;"723497197975818244";https://twitter.com/missionheal_org/status/723497197975818244
ikidsworld;2016-04-22 18:10;0;0;"Video for Kids. Learning Colors Underwater for Children . #KidsTV #ECE #Parenting #US #UK #India #Vietnam #Dubai https:// youtu.be/988teMBLu-c";;;#KidsTV #ECE #Parenting #US #UK #India #Vietnam #Dubai;"723491594163376128";https://twitter.com/ikidsworld/status/723491594163376128
SamhitaDotOrg;2016-04-22 18:01;0;1;"#Education programs usually focus on children , but what about training teachers? #teachertraining http:// goo.gl/pxjazD @forbes_ india";;@forbes_;#Education #teachertraining;"723489435422072832";https://twitter.com/SamhitaDotOrg/status/723489435422072832
DistrictHq;2016-04-22 17:33;0;0;"@stc_ india HAPPY HANUMAN JAYANTI to all save the children team.... pic.twitter.com/ACr3XLfFm6";;@stc_;;"723482302722908160";https://twitter.com/DistrictHq/status/723482302722908160
ikidsworld;2016-04-22 17:20;0;0;"The Letter S for Children . Fun & engaging Underwater Video. #Kids #Parents #ECE #US #Vietnam #SaudiArabia #UK #India https:// youtu.be/9v-a_2ofRps";;;#Kids #Parents #ECE #US #Vietnam #SaudiArabia #UK #India;"723479001042399233";https://twitter.com/ikidsworld/status/723479001042399233
BrainBuxa;2016-04-22 17:19;0;0;"Massive plan to launch Bal Sansad across schools in India | Education News- NEW DELHI:Bal Sansad or the Children � http:// bit.ly/1rq63Al";;;;"723478858318667776";https://twitter.com/BrainBuxa/status/723478858318667776
ashokmehta17;2016-04-22 17:15;0;0;"Nepal, India alarmed by report of children trafficked as slaves to Britain | Reuters http:// in.reuters.com/article/nepal- india-britain-child-trafficking-idINKCN0X21PY …";;;;"723477947739332609";https://twitter.com/ashokmehta17/status/723477947739332609
stc_india;2016-04-22 16:57;1;3;"We wish you a Happy #EarthDay . We must act to give our children and coming generations a cleaner and greener planet.";;;#EarthDay;"723473371900448768";https://twitter.com/stc_india/status/723473371900448768
KentPage;2016-04-22 16:46;96;86;"Immunization can save lives of 400,000 children under-5 in #India . Help spread this message! v/ @unicefindia pic.twitter.com/T02sZHWTMr";;@unicefindia;#India;"723470466900348930";https://twitter.com/KentPage/status/723470466900348930
WomenWorldNews1;2016-04-22 16:37;0;0;"#Hinduism #Hindus This chart tracks helps you track how many children the Sangh Parivar believ... http:// bit.ly/1pom9bP #India #Indians";;;#Hinduism #Hindus #India #Indians;"723468200445272065";https://twitter.com/WomenWorldNews1/status/723468200445272065
raviguria;2016-04-22 16:03;0;0;"In India , over 5 lakh children in the age group of 10-14 are engaged in various e-waste activities, without protection #stopewaste #EarthDay";;;#stopewaste #EarthDay;"723459611714449408";https://twitter.com/raviguria/status/723459611714449408
Sarah_Oughton;2016-04-22 16:00;3;1;"Fantastic story! Meet the street children making their own newspaper and championing children 's rights in India http:// gu.com/p/4t557/stw";;;;"723458938327408640";https://twitter.com/Sarah_Oughton/status/723458938327408640
thisisexeter;2016-04-22 15:43;1;1;"Exeter Express and Echo published Ottery pupils knit up a storm to help children in India : Pupils at The King'... http:// bit.ly/1VphkNk";;;;"723454574372114432";https://twitter.com/thisisexeter/status/723454574372114432
PIB_India;2016-04-22 14:55;37;25;"Millions of women & children are at the risk of losing their lives due to indoor house #pollution ! Join #GiveItUp pic.twitter.com/oomvhsk0RK";;;#pollution #GiveItUp;"723442604717678592";https://twitter.com/PIB_India/status/723442604717678592
missionheal_org;2016-04-22 14:48;0;0;"Mission Heal | Helping the Less Fortunate Children In India https:// lnkd.in/ef9KZzM";;;;"723440878195331072";https://twitter.com/missionheal_org/status/723440878195331072
praxis_india;2016-04-22 14:42;4;5;"Join Praxis in building a safe+just world,and in leaving a better planet to our children #EarthDay pic.twitter.com/jxfeZEome6";;;#EarthDay;"723439327779258368";https://twitter.com/praxis_india/status/723439327779258368
PrinceG13846284;2016-04-22 14:15;0;6;"RoyalTourDay3. Kate colouring with underprivileged children in India . April 12,2016 pic.twitter.com/obG8uWQJlR";;;;"723432565411971072";https://twitter.com/PrinceG13846284/status/723432565411971072
UNICEFwater;2016-04-22 13:50;21;37;"Happy Friday! Remember! All children have the right to water and sanitation #wateris life #unicef #india pic.twitter.com/vKVH3NiKsh";;;#wateris #unicef #india;"723426198097817600";https://twitter.com/UNICEFwater/status/723426198097817600
NRDC_India;2016-04-22 13:21;3;0;"On #EarthDay & temperatures over 102 deg F, children learn about the importance of #climatechange & resilience pic.twitter.com/b6RC8mDSml";;;#EarthDay #climatechange;"723418845856198656";https://twitter.com/NRDC_India/status/723418845856198656
WIONews;2016-04-22 13:11;1;1;"#Nepal and #India express concern over children as young as 10 from both countries being sold as domestic slaves in UK #SouthAsia #WION";;;#Nepal #India #SouthAsia #WION;"723416300798676992";https://twitter.com/WIONews/status/723416300798676992
CambridgePolish;2016-04-22 12:40;0;0;""The Indian Express" on displaced Polish children in India after WWII:... http:// fb.me/3R48TnKUd";;;;"723408688531181569";https://twitter.com/CambridgePolish/status/723408688531181569
offers_india;2016-04-22 12:40;0;1;"Barbie Pink and Blue Children 's Backpack (EI-MAT0021) -- #Amazon .in -- Rs. 670.0 -- Gifting, Stationery & Office S… http:// ift.tt/1SzIAIB";;;#Amazon;"723408660773236736";https://twitter.com/offers_india/status/723408660773236736
dmuleicester;2016-04-22 12:26;2;3;"Children in India are set to benefit from English language support from DMU staff http://www. dmu.social/sjny8 #DMUIndia pic.twitter.com/rHigKYCttQ";;;#DMUIndia;"723405096625668097";https://twitter.com/dmuleicester/status/723405096625668097
Bluemagicboxes;2016-04-22 12:21;1;0;"Shariah coming to India too. Four children at a time. https:// twitter.com/chetan_bhagat/ status/723052747767992320 …";;;;"723403874044792832";https://twitter.com/Bluemagicboxes/status/723403874044792832
233liveOnline;2016-04-22 11:31;0;0;"International News • 'Diarrhoea killing India 's poorest children ' via @233liveOnline . Full story at http:// 233live.com/International/ 96029/Diarrhoea+killing+India%27s+poorest+children.html …";;@233liveOnline;;"723391350549307394";https://twitter.com/233liveOnline/status/723391350549307394
IamAtif4;2016-04-22 11:27;0;1;"@IndianPrism @Retributions @JiyoOrJeeneDo ple felt they represntd d state n india was silent.thus felt if left free children won die anymore";;@IndianPrism @Retributions @JiyoOrJeeneDo;;"723390336886665216";https://twitter.com/IamAtif4/status/723390336886665216
TIS_India;2016-04-22 10:43;2;0;"We do not inherit the earth from our ancestors; we borrow it from our children . #EarthDay #quoteoftheday pic.twitter.com/XunvfDGEfI";;;#EarthDay #quoteoftheday;"723379109947002885";https://twitter.com/TIS_India/status/723379109947002885
AcheDinAaneWale;2016-04-22 10:03;0;0;"If they said run, you ran for your life: GDR children of Namibia recount their story http:// ift.tt/1XLORPL #TopNews #India";;;#TopNews #India;"723368991650013184";https://twitter.com/AcheDinAaneWale/status/723368991650013184
shrimish;2016-04-22 09:43;0;1;"Govt prepares a massive plan to launch Bal Sansad or children 's parliament across schools in India http:// toi.in/W2D4La via @timesofindia";;@timesofindia;;"723363975233081345";https://twitter.com/shrimish/status/723363975233081345
rajivtewari;2016-04-22 09:08;0;0;"FOSTERING CHILDREN : BRINGING GLOBAL BEST PRACTICES TO INDIA http:// journos.in/fostering-chil dren-bringing-global-best-practices-to-india/ … pic.twitter.com/ZFVvJChxjR";;;;"723355173918150656";https://twitter.com/rajivtewari/status/723355173918150656
AnuzPandit;2016-04-22 09:02;0;0;"Haryana MLA, 38, takes Class XII exams with his children - Times of India http:// fb.me/7QMAUgFt3";;;;"723353809213362177";https://twitter.com/AnuzPandit/status/723353809213362177
rajivtewari;2016-04-22 09:00;0;0;"FOSTERING CHILDREN : BRINGING GLOBAL BEST PRACTICES TO INDIA http:// journos.in/fostering-chil dren-bringing-global-best-practices-to-india/ … pic.twitter.com/CrU3NyNDVY";;;;"723353353326071808";https://twitter.com/rajivtewari/status/723353353326071808
kushwahabt;2016-04-22 08:42;0;0;"Yes! India desperately need 'uniform civil code' n '2 Children Policy' to control its population @ndtv @aajtak @BDUTT http://www. indiatvnews.com/politics/natio nal-enforce-two-child-policy-to-keep-hindu-daughters-safe-giriraj-singh-325057 …";;@ndtv @aajtak @BDUTT;;"723348605315244032";https://twitter.com/kushwahabt/status/723348605315244032
psagarindia;2016-04-22 08:28;0;2;"Please come to india and save lives of critically ill children at http:// genesis-foundation.net https:// twitter.com/playing4change /status/720772759597371392 …";;;;"723345280976846848";https://twitter.com/psagarindia/status/723345280976846848
AabhashK;2016-04-22 08:08;0;0;"Brijendra also teaches slum children the value of discipline. (Story via our Think Change India community on... http:// fb.me/7SOJ8Y1of";;;;"723340116702433280";https://twitter.com/AabhashK/status/723340116702433280
RGICS;2016-04-22 07:59;4;4;"MHRD planning massive launch for Bal Sansad or Children 's Parliament across schools in India - @timesofindia";;@timesofindia;;"723337986528579588";https://twitter.com/RGICS/status/723337986528579588
BJPsudhanRSS;2016-04-22 07:14;0;0;"Retweeted Ministry of Health ( @MoHFW_ INDIA ): #MissionIndradhanush : Reaching the left-out & missed-out children ... http:// fb.me/7n85NwmW2";;@MoHFW_;#MissionIndradhanush;"723326536640663552";https://twitter.com/BJPsudhanRSS/status/723326536640663552
ivotoniut;2016-04-22 05:56;0;0;"Your BUSINESS in and with AFGHANISTAN: India helping Afghan children suffering from Conge... http:// ivotoniut.blogspot.com/2016/04/india- helping-afghan-children-suffering.html?spref=tw …";;;;"723306946523222017";https://twitter.com/ivotoniut/status/723306946523222017
abby_y_;2016-04-22 04:46;0;4;"I'm writing a paper on children who are born and raised in the Red Light District of India and straight up crying in the library.";Logan, UT;;;"723289431029899265";https://twitter.com/abby_y_/status/723289431029899265
indian24news;2016-04-22 03:59;0;0;"NIA seeks help of Tanzil's children http:// goo.gl/vvuJ2u #news #India pic.twitter.com/P2n0CjYpF6";;;#news #India;"723277406866280448";https://twitter.com/indian24news/status/723277406866280448
PavanSonar;2016-04-22 03:03;0;1;"Happy World Earth Day 2016 ! Hope our grand children won't have to face situation like this. #WorldEarthDay #India pic.twitter.com/odQcL4kZj0";;;#WorldEarthDay #India;"723263523044741120";https://twitter.com/PavanSonar/status/723263523044741120
Brandammesha;2016-04-22 02:21;0;2;"Meet the street children making their own newspaper in India http:// gu.com/p/4t557/stw";;;;"723252818279161856";https://twitter.com/Brandammesha/status/723252818279161856
FPFCNews;2016-04-22 01:44;0;0;"21 April 2015 - Don't force young people out of children 's homes at 18; Street children from India ask the UN to sec… https:// lnkd.in/ey_UnAb";;;;"723243635781689344";https://twitter.com/FPFCNews/status/723243635781689344
AQpk;2016-04-22 01:31;38;66;"#Pakistanis wish peace for the children of #Pakistan & #India but #India 's rulers can't have peace by killing the people of #Kashmir .";;;#Pakistanis #Pakistan #India #India #Kashmir;"723240278501560320";https://twitter.com/AQpk/status/723240278501560320
UsBusinessNews1;2016-04-22 00:30;0;0;"India is working to curb trafficking of women, children : minister http:// tinyurl.com/h97wec2 :Auto pickup by wikyou";;;;"723224803285458944";https://twitter.com/UsBusinessNews1/status/723224803285458944
EDGEofHUMANITY;2016-04-22 00:30;3;9;"#DocumentaryPhotography #Educational #Innovations For The #Disadvantaged #India https:// edgeofhumanity.com/2015/10/30/ali ce/ … #children pic.twitter.com/iQFVDNd82U";;;#DocumentaryPhotography #Educational #Innovations #Disadvantaged #India #children;"723224798734614529";https://twitter.com/EDGEofHUMANITY/status/723224798734614529
indfinity;2016-04-22 00:10;3;2;"@1981_jain But for @MaliniP , minority rights trumps children 's rights @a_r_j_u_n @HinduRajyam @FakeJourno";;@1981_jain @MaliniP @a_r_j_u_n @HinduRajyam @FakeJourno;;"723219814051909632";https://twitter.com/indfinity/status/723219814051909632
coolandy2000;2016-04-21 23:40;0;0;"Checked it on youtube, in India , they use cobra's as toys for children . And the film maker says "It is not that... http:// fb.me/14rH2dWwD";;;;"723212285406105600";https://twitter.com/coolandy2000/status/723212285406105600
ICRW;2016-04-21 22:49;1;1;"According to one Minister, #India is working to curb trafficking of women, children http:// ow.ly/4mX0NR";;;#India;"723199388223442944";https://twitter.com/ICRW/status/723199388223442944
ikidsworld;2016-04-21 22:31;0;0;"The Letter S for Children . Fun & engaging Underwater Video. #Kids #Parents #ECE #US #Vietnam #SaudiArabia #UK #India https:// youtu.be/9v-a_2ofRps";;;#Kids #Parents #ECE #US #Vietnam #SaudiArabia #UK #India;"723194875571744768";https://twitter.com/ikidsworld/status/723194875571744768
PFCD_India;2016-04-21 22:30;3;3;"#health groups across the world have asked Coca-Cola & PepsiCo to stop marketing their products to children http:// bit.ly/1Nm81ei @thePHFI";;@thePHFI;#health;"723194709322043396";https://twitter.com/PFCD_India/status/723194709322043396
Lifeograms;2016-04-21 22:29;0;0;"Anglo-Indians the forgotten children of the British Raj in India - http:// bit.ly/c22jrU";;;;"723194456770535424";https://twitter.com/Lifeograms/status/723194456770535424
chandu532;2016-04-21 22:01;3;1;"#IshratVideoProof @RShivshankar @premasridevi Hindus should no way support Cong anywhere in India if they think about their Children Future";Patna, India;@RShivshankar @premasridevi;#IshratVideoProof;"723187424545787904";https://twitter.com/chandu532/status/723187424545787904
SamironRoy;2016-04-21 21:52;0;0;"Haryana MLA, 38, takes Class XII exams with his children - The Times of India http:// toi.in/7ZeeNZ/a18cg Cc: @smritiirani for inspiration";;@smritiirani;;"723185060258676736";https://twitter.com/SamironRoy/status/723185060258676736
SFCouncil;2016-04-21 21:49;2;2;"DYK @suryasocial has a strong connection to social responsibility in India . They educate children & help reduce child labor issues. #HPMKT";;@suryasocial;#HPMKT;"723184514328059904";https://twitter.com/SFCouncil/status/723184514328059904
ANCH_India;2016-04-21 21:47;1;4;"Jesus loves the little children (and we do too!) pic.twitter.com/f5Tx3n1CxJ";;;;"723183773186183168";https://twitter.com/ANCH_India/status/723183773186183168
ReviewListed;2016-04-21 21:23;0;0;"India Old Postcard View from BOAT CLUB POONA Pune, Boats, Native Children 2 Boys http:// sports-mem-cards.info/sprtsm/mcrds04 5/?query=http://rover.ebay.com/rover/1/711-53200-19255-0/1?ff3=2&toolid=10039&campid=5337797091&item=152062921866&vectorid=229466&lgeo=1 … pic.twitter.com/UzNhyA5PkF";;;;"723177903471644672";https://twitter.com/ReviewListed/status/723177903471644672
Gjallarhornet;2016-04-21 21:09;0;0;"Images Tell Us How Children Are The Biggest Victims Of The Drought That Is Strangling India http://www. indiatimes.com/news/india/the se-images-tell-us-how-children-are-the-biggest-victims-of-the-drought-that-is-strangling-india-253781.html … pic.twitter.com/wKgfcqePvX";;;;"723174418491412481";https://twitter.com/Gjallarhornet/status/723174418491412481
india_agent;2016-04-21 20:19;0;0;"Indian &#039;baby farm&#039; hospital where mothers are convinced to sell their unwanted children - Daily Mail http:// dragplus.com/post/id/347058 53 …";;;#039 #039;"723161651877425152";https://twitter.com/india_agent/status/723161651877425152
lilethyy;2016-04-21 19:11;0;1;"I can't believe she criticised ppl naming their children after countries yet her daughter is called India https:// twitter.com/gymnol7412/sta tus/723143276283326465 …";;;;"723144655504871425";https://twitter.com/lilethyy/status/723144655504871425
AboutThWorldNow;2016-04-21 19:08;0;0;"Court delay 'huge blow' to poor children in India 's Rajasthan-activist http:// reut.rs/1VjZEmj via @Reuters";;@Reuters;;"723143989528915969";https://twitter.com/AboutThWorldNow/status/723143989528915969
rajivtewari;2016-04-21 19:05;0;0;"FOSTERING CHILDREN IN INDIA BRINGING GLOBAL BEST PRACTICES TO INDIA http:// journos.in/fostering-chil dren-bringing-global-best-practices-to-india/ … pic.twitter.com/nyLNCUJYZX";;;;"723143015326318594";https://twitter.com/rajivtewari/status/723143015326318594
noconversion;2016-04-21 18:48;44;18;"Today is Children Bible Day in INDIA Poor kids are given FREE Bibles instead of TEXT books https://www. facebook.com/revshelleybos/ posts/1699739140297560 … Shame @smritiirani";;@smritiirani;;"723138926341300225";https://twitter.com/noconversion/status/723138926341300225
Modi4India;2016-04-21 18:48;3;4;"@AgentSaffron Reverse is true in S. India , seen many Northies settled in Hyd since long their children don't speak Telugu, same with Banglore";;@AgentSaffron;;"723138732971315200";https://twitter.com/Modi4India/status/723138732971315200
WomenforWomen;2016-04-21 18:30;6;11;"India is working to curb trafficking of women, children . http:// tmsnrt.rs/1rlGDnw pic.twitter.com/smQiUgxDaS";;;;"723134306021863429";https://twitter.com/WomenforWomen/status/723134306021863429
Anandisleepguru;2016-04-21 18:30;0;0;"Helping Hands for India is committed to provide educational opportunities to children in India http:// bit.ly/1ym6uXU";;;;"723134249734295552";https://twitter.com/Anandisleepguru/status/723134249734295552
RichAguilar1;2016-04-21 18:17;1;2;"I'd be honored if my twitter friends would give @OpportunityHope a follow to help our cause of changing children 's lives forever in India .";;@OpportunityHope;;"723131159450775552";https://twitter.com/RichAguilar1/status/723131159450775552
uwbe;2016-04-21 18:08;2;2;"A meeting with the children in the Doddaballapura Anganwadi supported by @uwbe :) #LiveUnited #Children #India #pic.twitter.com/XhuATA8QXr";;@uwbe;#LiveUnited #Children #India #pic;"723128822485377024";https://twitter.com/uwbe/status/723128822485377024
