username;date;retweets;favorites;text;geo;mentions;hashtags;id;permalink
GolfCPR;2012-04-02 13:21;0;0;"Golfing: For Digvijay Singh, golfing life starts at 40 - Indian Sports news http://www. golfcpr.com/for-digvijay-s ingh-golfing-life-starts-at-40-indian-sports-news/ …";;;;"186722584128274432";https://twitter.com/GolfCPR/status/186722584128274432
Sachin_raj10;2012-04-02 12:36;0;0;"Indian sports like 2 April.bcoz last year played worldcup final and now this year playing world series hockey final of 1st edition. Nice na.";;;;"186711095996710912";https://twitter.com/Sachin_raj10/status/186711095996710912
rkjogs;2012-04-01 22:57;0;0;"At 101, Fauja Singh still running! | Indian Sports News http://www. indiansportsnews.com/hot-picks/1158 2-at-101-fauja-singh-still-running.html …";;;;"186504955929182209";https://twitter.com/rkjogs/status/186504955929182209
rkjogs;2012-04-01 21:55;0;0;"Wrestler Geeta makes history, qualifies for London Olympics | Indian Sports News http://www. indiansportsnews.com/top-stories/11 581--wrestler-geeta-makes-history-qualifies-for-london-olympics.html …";;;;"186489493975605248";https://twitter.com/rkjogs/status/186489493975605248
rkjogs;2012-04-01 21:40;0;0;"Sachin was the inspiration behind my World Cup performance: Yuvraj Singh | Indian Sports News http://www. indiansportsnews.com/hot-picks/1158 0-sachin-was-the-inspiration-behind-my-world-cup-performance-yuvraj-singh.html …";;;;"186485698176630784";https://twitter.com/rkjogs/status/186485698176630784
CricketBooks;2012-04-01 15:23;0;0;"Leander Paes: Let's salute the legend on winning his 50th doubles title - Indian Sports news http:// bit.ly/HwVEDI";;;;"186390936673206272";https://twitter.com/CricketBooks/status/186390936673206272
PashokMT;2012-04-01 10:59;3;0;"Sachin celebrated his 100s and now Leander Paes lifts his 50th Doubles title in ATP. Good News era for Indian sports ...";;;;"186324266743119872";https://twitter.com/PashokMT/status/186324266743119872
tejavardhan;2012-03-31 20:03;1;0;"#DesiNews Indian Sports Hockey - Target is to score more in Olympics: Sandeep Singh: The Indian hockey team is s... http:// bit.ly/Ht9tDc";;;#DesiNews;"186098889957453824";https://twitter.com/tejavardhan/status/186098889957453824
CricketBooks;2012-03-31 17:48;0;0;"CSA to release Botha from central contracts - Indian Sports news http:// bit.ly/HDeZVX";;;;"186064827461021697";https://twitter.com/CricketBooks/status/186064827461021697
nor110575;2012-03-31 12:28;2;1;"@realpreityzinta What's with the Bollywood and IPL ? - via Indian Sports news http:// bit.ly/HD1Las";;@realpreityzinta;;"185984499958554624";https://twitter.com/nor110575/status/185984499958554624
sociopost;2012-03-31 12:16;0;0;"Get Latest Updates About Indian Sports : News about politics has been outpaced by todays sports news. There has a... http:// bit.ly/HC6KsY";;;;"185981444848492546";https://twitter.com/sociopost/status/185981444848492546
scottehartley;2012-03-31 12:12;0;0;"What's with the Bollywood and IPL? - Indian Sports news http:// bit.ly/HD1Las";;;;"185980411325845504";https://twitter.com/scottehartley/status/185980411325845504
rkjogs;2012-03-31 11:46;0;0;"Team Analysis: Rajasthan Royals will once again start as underdogs in IPL Season V | Indian Sports News: https:// twitter.com/#!/indiansport news … via @AddThis";;@AddThis;#;"185973932770336768";https://twitter.com/rkjogs/status/185973932770336768
rkjogs;2012-03-31 10:46;0;0;"IPL: Ravindra Jadeja at more than $ 2m makes sense for Chennai Super Kings! | Indian Sports News: https:// twitter.com/#!/indiansport news … via @AddThis";;@AddThis;#;"185958696793280513";https://twitter.com/rkjogs/status/185958696793280513
CricketBooks;2012-03-30 17:38;0;0;"India may slip down further in ICC Test rankings - Indian Sports news http:// bit.ly/HrIlKg";;;;"185700050578579456";https://twitter.com/CricketBooks/status/185700050578579456
samirpai;2012-03-30 16:23;0;0;"3% viwership in overall tv pie shows we are not giving the viewers what they want! Also shows indian sports still in infancy stage!";;;;"185681221186101248";https://twitter.com/samirpai/status/185681221186101248
webbytech;2012-03-30 13:43;0;0;"http:// Webby.co.in - Sachin and I are very good friends: Rahul Dravid - Indian Sports news http:// goo.gl/fb/KNsGP";;;;"185640842835398656";https://twitter.com/webbytech/status/185640842835398656
FogDGlassNSmile;2012-03-30 12:29;0;0;"http:// timesofindia.indiatimes.com/sports/more-sp orts/others/Gold-medalist-archer-Nisha-Rani-sells-archery-equipment-for-poverty/articleshow/12461456.cms?utm_source=facebook&utm_medium=toionFB … Such a sad state of our Indian sports . Where only cricket is our prayer. :/ #indiansports #sports";;;#indiansports #sports;"185622268553068544";https://twitter.com/FogDGlassNSmile/status/185622268553068544
CricketBooks;2012-03-30 10:10;0;0;"Virat says Sachin is the reason behind him playing cricket, Master Blaster ... - Indian Sports news http:// bit.ly/HqiiR1";;;;"185587215450124288";https://twitter.com/CricketBooks/status/185587215450124288
laurabasuki1;2012-03-29 09:57;0;0;"new Sony Ericsson Open: Paes-Stepanek in semis | Indian Sports News: http:// bit.ly/xsBRmh?21 via @AddThis #GhettoKoolAidFlavors";;@AddThis;#GhettoKoolAidFlavors;"185221500297674752";https://twitter.com/laurabasuki1/status/185221500297674752
India_travel_s;2012-03-29 06:24;0;0;"Rajasthan Royals rope in Shera, Salman's bodyguard - Indian Sports news http:// dlvr.it/1N0rN9";;;;"185168142090248193";https://twitter.com/India_travel_s/status/185168142090248193
merincafe;2012-03-28 16:53;0;1;"Top 10 All Time Sportsperson (men) of India | Indian Sports News: https:// twitter.com/#!/indiansport news … via @AddThis";;@AddThis;#;"184963917993361409";https://twitter.com/merincafe/status/184963917993361409
PinsonValley;2012-03-27 21:53;0;0;"Another day of Indian sports ! PV Soccer opens the Metro Bham tournament today, traveling to Spain Park to face to Jaguars.";;;;"184676925845929986";https://twitter.com/PinsonValley/status/184676925845929986
SamikshanDC;2012-03-27 19:19;0;0;"Force India drivers back Narain over Vettel's remark | Indian Sports News: https:// twitter.com/#!/indiansport news … via @AddThis";;@AddThis;#;"184638326941286400";https://twitter.com/SamikshanDC/status/184638326941286400
Viesearch;2012-03-26 14:22;0;0;"Information on Sports, Indian Sports , Cricketers Family Pics & Images - Get information on sports... http:// viesearch.com/668386";;;;"184201091481743360";https://twitter.com/Viesearch/status/184201091481743360
KingBollywoodUK;2012-03-26 10:00;0;0;"Best of sports movies in Bollywood - Indian Sports news Visit: http:// bit.ly/vh5PoB #Bollywood";;;#Bollywood;"184135296726740993";https://twitter.com/KingBollywoodUK/status/184135296726740993
xusie_olympics;2012-03-26 09:35;0;0;"I am peaking at the right time ahead of the Olympics: Saina Nehwal – Indian Sports news http:// dlvr.it/1MN4QL";;;;"184128849695612930";https://twitter.com/xusie_olympics/status/184128849695612930
lokeshbisht;2012-03-25 19:42;0;0;"Ha ha, Indian sports media got so many exclusive shows after Sachin's press conference,,, hope struggling cricket ... http:// m.tmi.me/nqlsk";;;;"183919194025361409";https://twitter.com/lokeshbisht/status/183919194025361409
rkjogs;2012-03-25 16:55;0;0;"Record is meant to be broken, but I hope an Indian breaks my record: Sachin | Indian Sports News: https:// twitter.com/#!/indiansport news … via @AddThis";;@AddThis;#;"183877337119588352";https://twitter.com/rkjogs/status/183877337119588352
rkjogs;2012-03-25 16:05;0;0;"Sports and Bollywood, the never ending ‘Saga’ | Indian Sports News: https:// twitter.com/#!/indiansport news … via @AddThis";;@AddThis;#;"183864606010249217";https://twitter.com/rkjogs/status/183864606010249217
inindia;2012-03-25 15:58;0;0;"Sachin lashes out at critics, says he will retire only when he stops enjoying ... Indian Sports newsMumbai: Days ... http:// bit.ly/H3acLM";;;;"183862988380442624";https://twitter.com/inindia/status/183862988380442624
LankaBreaking;2012-03-25 15:19;0;0;"ICC World Twenty20 2012 tickets launched in Colombo - Indian Sports news http:// tinyurl.com/73jn34f";;;;"183853080448745474";https://twitter.com/LankaBreaking/status/183853080448745474
SamikshanDC;2012-03-25 14:56;0;0;"Gagan bags silver in Kuwait Grand Prix | Indian Sports News: https:// twitter.com/#!/indiansport news … via @AddThis";;@AddThis;#;"183847241340035072";https://twitter.com/SamikshanDC/status/183847241340035072
SamikshanDC;2012-03-25 14:22;0;0;"It is always satisfying to beat the Chinese: Saina Nehwal | Indian Sports News: https:// twitter.com/#!/indiansport news … via @AddThis";;@AddThis;#;"183838738865061888";https://twitter.com/SamikshanDC/status/183838738865061888
Sportskeeda;2012-03-25 10:35;0;0;"COMIC: Lifehacks for the Indian sports fan #79 http:// goo.gl/fb/rZ8R5";;;#79;"183781588625141760";https://twitter.com/Sportskeeda/status/183781588625141760
slavemanG;2012-03-24 22:52;0;0;"Why do Indian sports channels hate us Italian football fans so much?";;;;"183604591756189697";https://twitter.com/slavemanG/status/183604591756189697
ajanta_rc;2012-03-24 19:12;0;0;"(Cont) and implementing it for the INDIAN sports ...Try working with a combination of Indian and American manager n u will get 2 d root of it";;;;"183549399031480322";https://twitter.com/ajanta_rc/status/183549399031480322
blogadda;2012-03-24 18:30;0;0;"The Sorry State of Indian Sports by Maddie in Spicy Picks @http:// adda.at/Spicy100";;@http;;"183538818476015616";https://twitter.com/blogadda/status/183538818476015616
KingBollywoodUK;2012-03-24 17:00;0;0;"Best of sports movies in Bollywood - Indian Sports news Visit: http:// bit.ly/vh5PoB #Bollywood";;;#Bollywood;"183516061797330944";https://twitter.com/KingBollywoodUK/status/183516061797330944
AroundTheRings;2012-03-23 20:05;0;1;"http:// ow.ly/9PUJT Indian sports minister Ajay Maken launched a website to track Indian Olympians at the #London2012 Games on Wednesday.";;;#London2012;"183200197847953408";https://twitter.com/AroundTheRings/status/183200197847953408
sanandmitra;2012-03-23 19:54;0;0;"Indian sports has the potential to be a global leader, but the volume or extent of catharsis needed, prior to the change is massive...";;;;"183197457369407488";https://twitter.com/sanandmitra/status/183197457369407488
CricketBooks;2012-03-23 19:25;0;0;"Angelo Matthews dropped after failing fitness test - Indian Sports news http:// bit.ly/GRn9gn";;;;"183190324292759552";https://twitter.com/CricketBooks/status/183190324292759552
Sye_han;2012-03-23 15:00;0;0;"Adrian Barath will add stability in the batting line-up: Chief selector – Indian Sports news http:// dlvr.it/1LsZwc";;;;"183123595415928833";https://twitter.com/Sye_han/status/183123595415928833
CricketBooks;2012-03-23 13:17;0;0;"Matthew Wade likely to make test debut against West Indies - Indian Sports news http:// bit.ly/GPjaR0";;;;"183097508195614720";https://twitter.com/CricketBooks/status/183097508195614720
Hoopistani;2012-03-23 12:06;0;0;"India's basketball star Geethu Anna Jose - "We need more exposure to compete at highest level" http://www. indiansportsnews.com/sports-intervi ews/11055-we-need-more-exposure-to-compete-at-highest-level-geethu-anna-jose.html … via Indian Sports News";;;;"183079750573633536";https://twitter.com/Hoopistani/status/183079750573633536
rkjogs;2012-03-23 11:52;0;0;"Controversies, lost love, films and the attention, Nupur Mehta seems to have it all | Indian Sports News http://www. indiansportsnews.com/out-of-box/110 91-controversies-lost-love-films-and-the-attention-nupur-mehta-seems-to-have-it-all.html …";;;;"183076327254011905";https://twitter.com/rkjogs/status/183076327254011905
SamikshanDC;2012-03-23 11:44;0;0;"Gaurav Ghei fires sizzling 66, enjoys two-stroke lead | Indian Sports News http://www. indiansportsnews.com/top-stories/11 089--gaurav-ghei-fires-sizzling-66-enjoys-two-stroke-lead.html …";;;;"183074172132524032";https://twitter.com/SamikshanDC/status/183074172132524032
rkjogs;2012-03-23 11:43;0;0;"Armaan Ebrahim set for maiden Indy Lights race | Indian Sports News http://www. indiansportsnews.com/top-stories/11 092--armaan-ebrahim-set-for-maiden-indy-lights-race.html …";;;;"183073902275203073";https://twitter.com/rkjogs/status/183073902275203073
KingBollywoodUK;2012-03-23 11:34;0;0;"Best of sports movies in Bollywood - Indian Sports news Visit: http:// bit.ly/vh5PoB #Bollywood";;;#Bollywood;"183071735367733248";https://twitter.com/KingBollywoodUK/status/183071735367733248
rkjogs;2012-03-23 11:32;0;0;"Pakistani cricket fans jubilant over winning Asia Cup | Indian Sports News http://www. indiansportsnews.com/world-sports-n ews/983-cricket/11090-pakistani-cricket-fans-jubilant-over-winning-asia-cup.html …";;;;"183071175189082112";https://twitter.com/rkjogs/status/183071175189082112
kundansingh;2012-03-23 00:50;0;0;"this story is everything that is wrong with indian sports . why do athletes have to go pay homage to ministers after winning medals";;;;"182909754249719810";https://twitter.com/kundansingh/status/182909754249719810
AvitJ89;2012-03-22 22:48;0;0;"@sardesairajdeep v v sad incident..jst compare it with d muamba incident.. #epl sorry state of affair #indiansports";;@sardesairajdeep;#epl #indiansports;"182878971522842624";https://twitter.com/AvitJ89/status/182878971522842624
Wikinewforum;2012-03-22 22:28;0;0;"TOP 10 Beautiful women in Indian sports (Photos) - Wiki NewForum http:// fb.me/1T9LgSK4y";;;;"182874022357385216";https://twitter.com/Wikinewforum/status/182874022357385216
spnavaneeth;2012-03-22 20:26;0;0;"So sad to hear about the death of a bangalore footballer. Poor victim of bad indian sports facilities. RIP Venkatesh Dhanraj.";;;;"182843252758675456";https://twitter.com/spnavaneeth/status/182843252758675456
SamikshanDC;2012-03-22 14:57;0;0;"EPL: Tevez helps City beat Chelsea | Indian Sports News http://www. indiansportsnews.com/world-sports-n ews/973-football/11032-epl-tevez-helps-city-beat-chelsea.html …";;;;"182760427082620929";https://twitter.com/SamikshanDC/status/182760427082620929
SamikshanDC;2012-03-22 14:54;0;0;"Willstrop weathers Ghosal fight-back at Canary Wharf | Indian Sports News http://www. indiansportsnews.com/top-stories/11 027-willstrop-weathers-ghosal-fight-back-at-canary-wharf.html …";;;;"182759580508495873";https://twitter.com/SamikshanDC/status/182759580508495873
patesalo_e;2012-03-22 14:04;0;0;"Force India sues Caterham, Aerolab for copyright infringement - Indian Sports news http:// paten.to/GKV6tx";;;;"182747077254725632";https://twitter.com/patesalo_e/status/182747077254725632
indiandrives;2012-03-22 12:58;0;0;"News: 2012 Audi TT will be launched tomorrow - Another sports car that will soon enter the Indian sports car market ... http:// ow.ly/1ieect";;;;"182730463599804416";https://twitter.com/indiandrives/status/182730463599804416
menonkaran;2012-03-22 12:43;0;0;"Tragic situation of Indian sports .. Bangalore football player dies coz of Cardiac arrest on field as no ambulance was available!";;;;"182726683672068097";https://twitter.com/menonkaran/status/182726683672068097
hcmehta007;2012-03-22 11:53;0;1;"@indianautos its san storm .... Indian sports car";;@indianautos;;"182714036155187201";https://twitter.com/hcmehta007/status/182714036155187201
KishoreRF;2012-03-22 11:40;0;0;"Sania Mirza fails to qualify for singles draw in Miami | Indian Sports News http://www. indiansportsnews.com/top-stories/11 022-sania-fails-to-qualify-for-singles-draw-in-miami.html …";;;;"182710919791509504";https://twitter.com/KishoreRF/status/182710919791509504
bazooka_93;2012-03-22 00:09;0;0;"Football player dies during the match,lack of medical aid..incident happened in bengaluru..what a sad story of indian sports man & infra...";;;;"182536902333841408";https://twitter.com/bazooka_93/status/182536902333841408
Divakar_Yadav;2012-03-22 00:01;0;0;"" Indian Sports Books" heyya all crazy sports lovers please join, for more of craziness :) http:// fb.me/L1nTSSI5";;;;"182534984299593729";https://twitter.com/Divakar_Yadav/status/182534984299593729
fni;2012-03-21 22:15;0;0;"'Lack of infrastructure, not sports talent in northeast' - Indian Sports news: 'Lack of infrastructure, not spor... http:// tinyurl.com/6ukx5hs";;;;"182508119115563008";https://twitter.com/fni/status/182508119115563008
LaurenceVick;2012-03-21 22:12;1;0;"Indian sports appeal panel raise Q should the world’s stringent #anti -doping laws be applied equally to all nations? http:// on.wsj.com/GHahpr";;;#anti;"182507546660188160";https://twitter.com/LaurenceVick/status/182507546660188160
ToruWat;2012-03-21 21:30;3;0;"This article shows how much of a fuck Indian sports authorities give about football and footballers in this country. http:// bit.ly/GIuNJV";;;;"182497004537135105";https://twitter.com/ToruWat/status/182497004537135105
rkjogs;2012-03-21 20:13;0;0;"Don't put pressure on Kohli, says Sachin Tendulkar | Indian Sports News http://www. indiansportsnews.com/hot-picks/1101 3--dont-put-pressure-on-kohli-says-sachin-tendulkar.html …";;;;"182477652886683649";https://twitter.com/rkjogs/status/182477652886683649
rkjogs;2012-03-21 20:04;0;0;"We have not thought of pulling out of Olympics: Ajay Maken | Indian Sports News http://www. indiansportsnews.com/hot-picks/1101 2-we-have-not-thought-of-pulling-out-of-olympics-ajay-maken.html …";;;;"182475162644512768";https://twitter.com/rkjogs/status/182475162644512768
sagarkarande;2012-03-21 20:01;1;0;"pls RT #ripvenkatesh ... even if the indian sports ministry doesnt, atleast we should stand by our sports and our players #football";;;#ripvenkatesh #football;"182474581733412865";https://twitter.com/sagarkarande/status/182474581733412865
cricketboomboom;2012-03-21 20:00;0;0;"Saeed Ajmal says he is not bothered by India’s allegation on his bowling action | Indian Sports News http://www. indiansportsnews.com/from-newspaper s/10975-saeed-ajmal-says-he-is-not-bothered-by-indias-allegation-on-his-bowling-action.html …";;;;"182474379165306880";https://twitter.com/cricketboomboom/status/182474379165306880
sagarkarande;2012-03-21 19:57;0;0;"rip venkatesh #bangaloremars ... we are witnessing how the indian sports ministry cares for other sports.";;;#bangaloremars;"182473390416855040";https://twitter.com/sagarkarande/status/182473390416855040
rkjogs;2012-03-21 19:49;0;0;"Kyra Shroff's dream run continues in ITF tennis | Indian Sports News http://www. indiansportsnews.com/top-stories/11 011--kyra-shroffs-dream-run-continues-in-itf-tennis-.html …";;;;"182471581803610112";https://twitter.com/rkjogs/status/182471581803610112
MumMeLicious;2012-03-21 18:52;0;0;"Sad state of Indian sports .. :(..RT @ndtv : Bangalore footballer collapses at stadium; no ambulance present http://www. ndtv.com/article/cities /bangalore-footballer-dies-on-pitch-due-to-lack-of-medical-attention-188564 …";;@ndtv;;"182457227976785920";https://twitter.com/MumMeLicious/status/182457227976785920
CricketBooks;2012-03-21 17:39;0;0;"Aamir is a superb bowler and should come back to play after serving his ban ... - Indian Sports news http:// bit.ly/GJ4EHm";;;;"182438887027777536";https://twitter.com/CricketBooks/status/182438887027777536
SportMalaysia;2012-03-21 17:20;0;0;"Narain hires Schumacher's long-time physio Balbir Singh - Indian Sports news: Narain hires Schumacher's long-tim... http:// bit.ly/GIDPon";;;;"182433972108787713";https://twitter.com/SportMalaysia/status/182433972108787713
MissRahulDravid;2012-03-21 11:58;0;0;"" @TeamIndia11 : Swiss Open win inspired by Sachin: Saina http:// fb.me/1OHvuvHSH " So that's what Indian Sports is all about! #ForSachin";;@TeamIndia11;#ForSachin;"182352851610243072";https://twitter.com/MissRahulDravid/status/182352851610243072
Hoopistani;2012-03-21 11:32;1;0;"NBA-India's @troyjustice interview by Indian Sports News: 'Satnam Singh is 1 of the rising stars of Indian Basketball' http://www. indiansportsnews.com/sports-intervi ews/10959-satnam-singh-is-one-of-the-rising-stars-of-indian-basketball-troy-justice.html …";;@troyjustice;;"182346330067316736";https://twitter.com/Hoopistani/status/182346330067316736
KingBollywoodUK;2012-03-21 10:52;0;0;"Best of sports movies in Bollywood - Indian Sports news Visit: http:// bit.ly/vh5PoB #Bollywood";;;#Bollywood;"182336400631410688";https://twitter.com/KingBollywoodUK/status/182336400631410688
webbytech;2012-03-21 10:44;0;0;"http:// Webby.co.in - WSH: Chennai Cheetahs thrash Bhopal Badshahs 4-1 - Indian Sports news http:// goo.gl/fb/45O6Y";;;;"182334275033636865";https://twitter.com/webbytech/status/182334275033636865
fni;2012-03-20 21:37;0;0;"Foreign clubs should invest in India: Sesa Goa - Indian Sports news: Foreign clubs should invest in India: Sesa ... http:// tinyurl.com/7kbwx39";;;;"182136305138933760";https://twitter.com/fni/status/182136305138933760
SamikshanDC;2012-03-20 18:51;0;0;"Sahara Force India looking forward to Malaysian GP | Indian Sports News http://www. indiansportsnews.com/top-stories/10 961-sahara-force-india-looking-forward-to-malaysian-gp.html …";;;;"182094444089184256";https://twitter.com/SamikshanDC/status/182094444089184256
experts_column;2012-03-20 16:56;0;0;"The changing face of Indian Sports : Earlier in an article, I had expressed a doubt that whether the popularity o... http:// bit.ly/GBBSLR";;;;"182065641577132032";https://twitter.com/experts_column/status/182065641577132032
KingBollywoodUK;2012-03-20 16:52;0;0;"Best of sports movies in Bollywood - Indian Sports news Visit: http:// bit.ly/vh5PoB #Bollywood";;;#Bollywood;"182064665415782400";https://twitter.com/KingBollywoodUK/status/182064665415782400
being_malik;2012-03-20 15:51;0;0;"Is Anushka Sharma on Suresh Raina's mind? - Indian Sports news http:// goo.gl/fb/FDtmF #news #entertainment";;;#news #entertainment;"182049295007100928";https://twitter.com/being_malik/status/182049295007100928
xusie_olympics;2012-03-20 13:14;0;0;"Vikas leads Indian challenge in Boxing Grand Prix – Indian Sports news http:// dlvr.it/1L9TMh";;;;"182009673770205185";https://twitter.com/xusie_olympics/status/182009673770205185
SamikshanDC;2012-03-20 13:12;0;0;"Why should Sachin Tendulkar retire: Lata Mangeshkar | Indian Sports News http://www. indiansportsnews.com/out-of-box/109 31-why-should-sachin-tendulkar-retire-lata-mangeshkar.html …";;;;"182009285914537984";https://twitter.com/SamikshanDC/status/182009285914537984
rkjogs;2012-03-20 09:13;0;0;"Services promise to offer jobs to young footballers | Indian Sports News http://www. indiansportsnews.com/top-stories/10 916-services-promise-to-offer-jobs-to-young-footballers.html …";;;;"181949006774153216";https://twitter.com/rkjogs/status/181949006774153216
rkjogs;2012-03-19 20:47;0;0;"Swing of form just at the right time for Saina | Indian Sports News http://www. indiansportsnews.com/hot-picks/1091 2-swing-of-form-just-at-the-right-time-for-saina.html …";;;;"181761202391744512";https://twitter.com/rkjogs/status/181761202391744512
nerdometer;2012-03-19 18:32;0;0;"Virat Kohli will play a bigger role in Indian cricket: Dilip Vengsarkar | Indian Sports News http://www. indiansportsnews.com/from-newspaper s/10709-virat-kohli-will-play-a-bigger-role-in-indian-cricket-dilip-vengsarkar.html …";;;;"181727361144856577";https://twitter.com/nerdometer/status/181727361144856577
nerdometer;2012-03-19 18:32;0;0;"Asia Cup: India’s chances of reaching the final depend upon Lanka-Bangladesh outcome on Tuesay | Indian Sports News http://www. indiansportsnews.com/from-newspaper s/10890-asia-cup-indias-chances-of-reaching-the-final-depends-on-lanka-bangladesh-outcome-on-tuesay.html …";;;;"181727280022822912";https://twitter.com/nerdometer/status/181727280022822912
AXNIndia;2012-03-19 17:49;0;0;"Yesterday was sure a thrilling Day for Indian Sports ! Our Thrilling Women of Action nominee, Saina Nehwal... http:// fb.me/1H9Udl6NS";;;;"181716546404630528";https://twitter.com/AXNIndia/status/181716546404630528
SamikshanDC;2012-03-19 17:08;0;0;"Saina wins Swiss Open to end year-long title drought | Indian Sports News: https:// twitter.com/#!/indiansport news … via @AddThis";;@AddThis;#;"181706095352496128";https://twitter.com/SamikshanDC/status/181706095352496128
SantaBantaPage;2012-03-19 14:45;1;0;"Congratulations to Saina Nehwal as well for winning Swiss Open. 18th March has been one of the greatest days for Indian Sports .";;;;"181670122866487296";https://twitter.com/SantaBantaPage/status/181670122866487296
bazooka_93;2012-03-19 10:33;0;0;"Congrats Saina Nehwal on winning Swiss GP! Congrats Indian cricket team on defeating Pakistan! A good day for Indian Sports !";;;;"181606874402127873";https://twitter.com/bazooka_93/status/181606874402127873
snpunjabi;2012-03-19 09:19;0;0;"Kohli, Yuvi and Saina. Three Indian sports people in the news for all the right reasons. #Win";;;#Win;"181588105499914240";https://twitter.com/snpunjabi/status/181588105499914240
manish2070;2012-03-19 03:30;0;0;"Big Congrats to Saina Nehwal for winning the Swiss Open Title. Good day for Indian Sports . Cheers!!";;;;"181500263662747650";https://twitter.com/manish2070/status/181500263662747650
BeerJabi;2012-03-19 02:16;0;0;"Big Congrats to Saina Nehwal for winning the Swiss Open Title. Good day for Indian Sports . Cheers!";;;;"181481677967720448";https://twitter.com/BeerJabi/status/181481677967720448
LaSlank;2012-03-19 02:02;0;0;"Went to the store and ran into an Indian @Sports Action Foot Wear http:// instagr.am/p/IU8khYpiZs/";;@Sports;;"181478259198922753";https://twitter.com/LaSlank/status/181478259198922753
rohanghuge;2012-03-19 01:42;0;0;"The Golden Girl of India #SainaNehwal wins Swiss Open Badminton Championship. What a day for Indian Sports ..!!";;;#SainaNehwal;"181473223307821056";https://twitter.com/rohanghuge/status/181473223307821056
