username;date;retweets;favorites;text;geo;mentions;hashtags;id;permalink
Ping_Pong_News;2012-05-19 00:01;0;0;"#Chess - National Chess begins; Krishna Teja stuns Karthikeyan - Indian Sports news http:// ow.ly/1jRQ9u";;;#Chess;"203553420903325696";https://twitter.com/Ping_Pong_News/status/203553420903325696
DeliriousPixie;2012-05-18 23:11;0;0;"Wow! @iShravs: #MaryKom qualifies for London #Olympics . Great moment for Indian sports & hopes of Indian medal strengthens with her.. RT PLS";;@iShravs;#MaryKom #Olympics;"203540787278000128";https://twitter.com/DeliriousPixie/status/203540787278000128
anubasheer;2012-05-18 22:46;0;0;""It's definitely a gr8 news. #MaryKom qualifies for London #Olympics . Great moment for Indian sports "";;;#MaryKom #Olympics;"203534556236750849";https://twitter.com/anubasheer/status/203534556236750849
Alok_Mantri;2012-05-18 22:40;0;0;"Good news for indian sports amidst all the #ipl fiasco all the best to marykom http:// sports.ndtv.com/othersports/bo xing/item/190226-mary-kom-qualifies-for-london-olympics?pfrom=home-topstories …";;;#ipl;"203532985788674048";https://twitter.com/Alok_Mantri/status/203532985788674048
UofLnumber1;2012-05-18 21:25;0;0;"Maken orders probe into IPL finances – Cricket News Update: Indian Sports Minister Ajay Maken has ordered a prob... http:// bit.ly/KoQpc6";;;;"203514135458230272";https://twitter.com/UofLnumber1/status/203514135458230272
KLCCEugeneOR;2012-05-18 20:57;1;1;"Oregon Bans American Indian Sports Mascots In Schools - http:// tinyurl.com/6ukb2yg";;;;"203507041355038720";https://twitter.com/KLCCEugeneOR/status/203507041355038720
soorajbhalla;2012-05-18 19:26;0;0;"Mary Kom qualifies for the London 2012 Olympics! Great day for Indian Sports and even greater day for Indian Women.";;;;"203484174320021504";https://twitter.com/soorajbhalla/status/203484174320021504
ronnie_sandip;2012-05-18 18:03;0;0;"#MaryKom qualifies for Olympics. Great news for Indian sports today.";;;#MaryKom;"203463285977264129";https://twitter.com/ronnie_sandip/status/203463285977264129
anantblueakash;2012-05-18 17:10;0;0;"Mary Com qualifies 4 London olympics.She will be top gold medal contender in her weight category.Finally some good news 4 Indian sports 2day";;;;"203449863860527104";https://twitter.com/anantblueakash/status/203449863860527104
all4cricket;2012-05-18 16:56;0;0;"Cricket Report Maken says govt will look into payment patterns of IPL players: The Indian sports minister said B... http:// bit.ly/Kfcj1Y";;;;"203446446014476288";https://twitter.com/all4cricket/status/203446446014476288
kavshik13;2012-05-18 16:46;0;0;"Indian sports fan will deal with quite a few sleepless nights this summer. Champions League Final Saturday, Euro 2012 in June and Olympics.";;;;"203443847630557184";https://twitter.com/kavshik13/status/203443847630557184
asimqureshi73;2012-05-18 15:50;0;0;"“A man who is so highly involved in Indian sports , who acted in Chak De India, inspiring Indian hockey, should not... http:// fb.me/Nvw7rY9J";;;;"203429886851940352";https://twitter.com/asimqureshi73/status/203429886851940352
xusie_sports;2012-05-18 11:45;0;0;"Had I known about the world record, I would have hit more sixes: Chris Gayle – Indian Sports news http:// dlvr.it/1ZtJRd";;;;"203368107039916032";https://twitter.com/xusie_sports/status/203368107039916032
Baileyshapard;2012-05-18 06:10;0;0;"A little upset that i studied alllllllllll year long for a n AP history exam and the DBQ us on an indian sports game?! #cricket #norelavence";;;#cricket #norelavence;"203283797247135745";https://twitter.com/Baileyshapard/status/203283797247135745
OPBnews;2012-05-18 05:40;4;0;"Oregon Bans American Indian Sports Mascots In Schools http:// news.opb.org/article/oregon _bans_american_indian_sports_mascots_in_schools/ … Indians, Braves and Chiefs phased out by July 2017";;;;"203276410096336896";https://twitter.com/OPBnews/status/203276410096336896
mumbai24X7;2012-05-17 15:08;0;0;"Mumbai24X7 Decision whether to ban SRK from Wankhede next week - Indian Sports news: Decision whether... http:// bit.ly/KSiXx1 Mumbai24X7";;;;"203056989205577729";https://twitter.com/mumbai24X7/status/203056989205577729
KKR_FAN_PAGE;2012-05-17 14:59;0;0;"Join Chak De Indian Sports";;;;"203054628819054592";https://twitter.com/KKR_FAN_PAGE/status/203054628819054592
fni;2012-05-16 21:12;0;0;"U-22 selection camp kicks-off in Bangalore - Indian Sports news: U-22 selection camp kicks-off in BangaloreIndia... http:// tinyurl.com/6usofye";;;;"202786133711650816";https://twitter.com/fni/status/202786133711650816
xusie_olympics;2012-05-16 19:16;0;0;"Mission Olympics: Top 5 medal prospects for India in 2012 Games – Indian Sports news http:// dlvr.it/1ZS751";;;;"202756813207244803";https://twitter.com/xusie_olympics/status/202756813207244803
indopak;2012-05-16 16:40;0;0;"IPL spot fixing: Pakistanis not amused by the infamy across the border - Indian Sports news http:// bit.ly/K7cyeH";;;;"202717651410223107";https://twitter.com/indopak/status/202717651410223107
mak_asif;2012-05-16 15:32;0;0;"Indian Sports Minister Ajay Maken says BCCI must be registered as a sports body";;;;"202700563383721984";https://twitter.com/mak_asif/status/202700563383721984
GetCricket;2012-05-16 15:27;0;0;"Highlights: Sports Minister on IPL spot-fixing sting: Indian Sports Minister Ajay Maken speaks on the IPL spot-f... http:// bit.ly/KO2KZE";;;;"202699330384171008";https://twitter.com/GetCricket/status/202699330384171008
drshahrukh;2012-05-16 15:01;2;1;"#shahrukh news Let Ganguly lead his life: Shahrukh: ...in Indian sports history," the actor said. Asked ... http:// bit.ly/JKMZSr @iamsrk";;@iamsrk;#shahrukh;"202692673205837825";https://twitter.com/drshahrukh/status/202692673205837825
Sports_Week;2012-05-16 13:38;0;0;"Indian Sports Minister asks BCCI to take action over spot-fixing claims – Cricket News Update: Indian Sports Min... http:// bit.ly/K5t2Vw";;;;"202671799106940928";https://twitter.com/Sports_Week/status/202671799106940928
IPL_Update;2012-05-16 13:03;0;0;"IPL Match 62--Mumbai Indians vs Kolkata Knight Riders: Players to watch out for… - Indian Sports news: SB Nation... http:// bit.ly/KNF0F1";;;;"202663139186184192";https://twitter.com/IPL_Update/status/202663139186184192
jagbirolympian;2012-05-16 12:15;0;0;"News of Match fixing, Spot fixing.! discussed at all levels in cricket. Embarrassing for Indian Sports . " Proud to be a hockey player"";;;;"202650899766722560";https://twitter.com/jagbirolympian/status/202650899766722560
fni;2012-05-16 10:25;0;0;"Pune FC beat Lajong to wear U20 I-League crown - Indian Sports news: ESPN STAR SportsPune FC beat Lajong to wear... http:// tinyurl.com/ctd5tbj";;;;"202623180148441089";https://twitter.com/fni/status/202623180148441089
CricLatest;2012-05-16 08:10;0;0;"Anand vs Gelfand: Game four ends in a tame draw - Indian Sports news: The HinduAnand vs Gelfand: Game four ends ... http:// bit.ly/LPONtI";;;;"202589230998880258";https://twitter.com/CricLatest/status/202589230998880258
point_spreads;2012-05-15 23:04;0;0;"Indiana Pacers vs Miami Heat Game 2 2012 NBA Point Spreads: The Miami Heat entertain the Indian... http:// bit.ly/J9HsY2 #sports #spreads";;;#sports #spreads;"202451890615758848";https://twitter.com/point_spreads/status/202451890615758848
CricLivScore;2012-05-15 20:39;0;0;"Ajay Maken, the Indian sports minister, called on the BCCI to sort out the problems of spot fixing raised by a… http:// goo.gl/fb/irrSM #fb";;;#fb;"202415320030392322";https://twitter.com/CricLivScore/status/202415320030392322
Dav_inder;2012-05-15 19:20;0;0;"Indian Sports news: Shah Rukh tries to put an end to comparison with #Ganguly - http:// goo.gl/news/ZyPx #news";;;#Ganguly #news;"202395444175839233";https://twitter.com/Dav_inder/status/202395444175839233
iamsaikishore_k;2012-05-15 19:00;0;0;"join :Chak De Indian Sports Our Media were celebrating the Birthday of Sunny Leone yesterday But they didn't... http:// fb.me/12YaphJMv";;;;"202390591689068545";https://twitter.com/iamsaikishore_k/status/202390591689068545
iamsaikishore_k;2012-05-15 18:49;0;0;"join Chak De Indian Sports for all sports updates";;;;"202387854846988288";https://twitter.com/iamsaikishore_k/status/202387854846988288
LiveCricInfo;2012-05-15 16:37;0;0;"Sports minister urges BCCI to find root cause: Ajay Maken, the Indian sports minister, called on the BCCI... http:// bit.ly/MfC32d #cricket";;;#cricket;"202354541444857856";https://twitter.com/LiveCricInfo/status/202354541444857856
Sribabas;2012-05-15 13:09;0;0;"Dwayne gives a bravo finish for CSK against the unlucky KKR - Indian Sports Fan: http:// indiansportsfan.com/cricket/ipl5/d wayne-gives-a-bravo-finish-for-csk-against-the-unlucky-kkr/#.T7ICuxOLEwI.twitter …";;;#;"202302146245439489";https://twitter.com/Sribabas/status/202302146245439489
gautamksheth;2012-05-15 12:33;0;0;"Classic story of the plight of Indian sports administration by @mihirsv in @DNA http:// epaper.dnaindia.com/epapermain.asp x?pgNo=18&edcode=820009&eddate=2012-5-15 …";;@mihirsv @DNA;;"202293230992240640";https://twitter.com/gautamksheth/status/202293230992240640
CricketBooks;2012-05-15 11:17;0;0;"We have played very good cricket throughout and the defeat won't affect us ... - Indian Sports news http:// bit.ly/Jz49TM";;;;"202273956647022592";https://twitter.com/CricketBooks/status/202273956647022592
kupwara24x7;2012-05-15 08:15;0;0;"Olympic qualifier: Sarita beats world champion Gulsum - Indian Sports news: FirstpostOlympic qualifier: Sarita b... http:// bit.ly/JCfm55";;;;"202228169040855041";https://twitter.com/kupwara24x7/status/202228169040855041
amjiddader;2012-05-15 08:15;0;0;"Olympic qualifier: Sarita beats world champion Gulsum - Indian Sports news: FirstpostOlympic qualifier: Sarita b... http:// bit.ly/L4QLK4";;;;"202228163969941505";https://twitter.com/amjiddader/status/202228163969941505
1secondago;2012-05-14 20:39;0;0;"IPL Match 60: Pune Warriors India versus Rajasthan Royals: Hits and flops - Indian Sports news http:// bit.ly/JB37Gf";;;;"202052957150253056";https://twitter.com/1secondago/status/202052957150253056
AsianGame;2012-05-14 15:26;0;0;"ASIAN GAMES :- IOA seeks PM's intervention to host SAG - Indian Sports news http:// goo.gl/fb/GDVBU";;;;"201974327787261952";https://twitter.com/AsianGame/status/201974327787261952
hashPune;2012-05-14 14:34;0;0;"U20 I-League: Pune emerge victorious in the 'Maha-Derby' brighten title chances - Indian Sports news http:// bit.ly/L18LoQ #pune";;;#pune;"201961237704212480";https://twitter.com/hashPune/status/201961237704212480
Rowtown;2012-05-14 13:46;0;0;"Simpson & Kemp boost home interest in British Open - Indian Sports news http:// dlvr.it/1Ys7l3";Runnymede, England;;;"201949045718122496";https://twitter.com/Rowtown/status/201949045718122496
KKR_FAN_PAGE;2012-05-13 20:11;0;0;"Chak De Indian Sports Join";;;;"201683579502198784";https://twitter.com/KKR_FAN_PAGE/status/201683579502198784
Lambogirl2012;2012-05-13 18:10;0;0;"Chennai beat Delhi, fourth in IPL point's ... - Indian Sports News: Delhi Daredevils could never recover from th... http:// bit.ly/KWBhrv";;;;"201653077747580928";https://twitter.com/Lambogirl2012/status/201653077747580928
OreFakorede;2012-05-13 15:53;0;0;"Nigeria set to immortalize late football star - Indian Sports news http:// bit.ly/KAMsTU";;;;"201618689089470464";https://twitter.com/OreFakorede/status/201618689089470464
TheRahulMehra;2012-05-13 13:26;2;0;"@Ra_THORe We together with 40 top Indian icons fm d world of Indian sports conveyed solution (read "Sports Law") but did d pol class listen?";;@Ra_THORe;;"201581762042793984";https://twitter.com/TheRahulMehra/status/201581762042793984
IPL_Update;2012-05-13 11:16;0;0;"IPL Match 60: Pune Warriors India vs Rajasthan Royals: Players to watch out for... - Indian Sports news: ESPNcri... http:// bit.ly/JvtE7Q";;;;"201548881304109056";https://twitter.com/IPL_Update/status/201548881304109056
bestcopydotnet;2012-05-12 21:21;0;0;"Royals desperate to get back to winning ways when they take on Warriors - Indian Sports news: The HinduRoyals de... http:// bit.ly/IVA1DK";;;;"201338892715175937";https://twitter.com/bestcopydotnet/status/201338892715175937
Sribabas;2012-05-12 21:19;0;0;"The fight for the spinner’s spot - Indian Sports Fan: http:// indiansportsfan.com/cricket/the-fi ght-for-the-spinners-spot/#.T66Gjsk2nwo.twitter …";;;#;"201338394792570882";https://twitter.com/Sribabas/status/201338394792570882
Sribabas;2012-05-12 21:19;0;0;"Orange Cap probables : Openers set the tone - Indian Sports Fan: http:// indiansportsfan.com/cricket/ipl5/o range-cap-probables-openers-set-the-tone/#.T66Gb6lXiEc.twitter …";;;#;"201338219047026688";https://twitter.com/Sribabas/status/201338219047026688
TheRajKundra;2012-05-12 18:57;3;1;"SFL2 on @Colorstv in one hour! 8pm #superfightleague enjoy the show! #indianmma #indiansports";;@Colorstv;#superfightleague #indianmma #indiansports;"201302525935226880";https://twitter.com/TheRajKundra/status/201302525935226880
SpartanSportsAU;2012-05-12 18:04;0;0;"Gayle one of the most emotionless, destructive players in cricket today: Harbhajan - Indian Sports news http:// ow.ly/1jGfDv";;;;"201289132591419393";https://twitter.com/SpartanSportsAU/status/201289132591419393
RajenPrasad;2012-05-12 15:31;0;0;"Celebrating Indian Sports achievements this evening. So much talent and so many notable achievements. pic.twitter.com/Pk83BzAR";;;;"201250808896040960";https://twitter.com/RajenPrasad/status/201250808896040960
TweetRussia;2012-05-12 14:02;0;0;"Sochi Winter Olympics preparations are on, says Vladimir Putin - Indian Sports news http:// tinyurl.com/7mybajw #putin";;;#putin;"201228360247021568";https://twitter.com/TweetRussia/status/201228360247021568
DLFIPL2010;2012-05-12 12:17;0;0;"IPL Match 58--Mumbai Indians vs Kolkata Knight Riders: Players to watch out for… - Indian Sports news http:// bit.ly/JM52GP #IPL";;;#IPL;"201201981635825664";https://twitter.com/DLFIPL2010/status/201201981635825664
RamaNewDelhi;2012-05-12 12:00;0;0;"A passionate plea to preserve Indian sports history. Cricket museum? http:// bit.ly/IZKUEl";;;;"201197761264222208";https://twitter.com/RamaNewDelhi/status/201197761264222208
vivek1994;2012-05-12 07:52;0;0;"Anjum Chopra shares her expert opinion – http:// Indiansportsfan.com exclusive - Indian Sports Fan: http:// indiansportsfan.com/celebrity/anju m-chopra-shares-her-expert-opinion-indiansportsfan-com-exclusive-2/#.T63JRpQ-O6Y.twitter …";;;#;"201135350687596544";https://twitter.com/vivek1994/status/201135350687596544
ksdaksh;2012-05-12 06:13;0;0;"Eduardo Costa : Four Vasco da Gama players banned for post-match brawl - Indian Sports news http:// uxp.in/46022536";;;;"201110207881945088";https://twitter.com/ksdaksh/status/201110207881945088
angisdatingads;2012-05-11 22:05;0;0;"Back for more: In the summer of 2008, three men sparked a revolution in Indian sports . ... For 2 hours, he maint... http:// bit.ly/JmGV1T";;;;"200987408005742593";https://twitter.com/angisdatingads/status/200987408005742593
Sportsbuffs;2012-05-11 19:57;0;0;"Indian Sports Fan is proud to announce that women's cricket team captain and TV personality Anjum Chopra will be... http:// fb.me/12D8JbkoY";;;;"200955400420462593";https://twitter.com/Sportsbuffs/status/200955400420462593
indiafollowsu;2012-05-11 19:26;1;0;"Indian Sports Minister ajay makken.:Cannot trust Indian Olympic ass until it removes corrupt chief Kalmadi [ Minister on the right side ]";;;;"200947603846868992";https://twitter.com/indiafollowsu/status/200947603846868992
SpartanSportsAU;2012-05-11 18:12;0;0;"Chris Gayle is the most prized property of IPL, but watch out for Kohli as ... - Indian Sports news http:// ow.ly/1jExU3";;;;"200928928217579520";https://twitter.com/SpartanSportsAU/status/200928928217579520
mumbai24X7;2012-05-11 13:04;0;0;"Mumbai24X7 'Gayle Storm' if not controlled early can do a lot of damage: Ganguly - Indian Sports news... http:// bit.ly/JH31LW Mumbai24X7";;;;"200851398852755456";https://twitter.com/mumbai24X7/status/200851398852755456
hashPune;2012-05-11 12:20;0;0;"IPL Match 57: Pune Warriors vs Royal Challengers Bangalore: Players to watch ... - Indian Sports news http:// bit.ly/K7jZmA #pune";;;#pune;"200840272261816320";https://twitter.com/hashPune/status/200840272261816320
CricLatest;2012-05-11 09:25;0;0;"CM Mamata Banerjee to present Sachin 100 guineas and a golden bat - Indian Sports news: The HinduCM Mamata Baner... http:// bit.ly/KrswCS";;;;"200796152306733056";https://twitter.com/CricLatest/status/200796152306733056
pdftop_net;2012-05-11 04:15;0;0;"indian sports quiz 2010: search results for indian sports quiz 2010 ebook http:// bit.ly/JgmEfn";;;;"200718247870468096";https://twitter.com/pdftop_net/status/200718247870468096
Ping_Pong_News;2012-05-10 21:02;0;0;"#Olympics #PingPong Olympic qualifiers: Indian paddlers start in great style - Indian Sports news http:// ow.ly/1jCUTk";;;#Olympics #PingPong;"200609358931968000";https://twitter.com/Ping_Pong_News/status/200609358931968000
hashPune;2012-05-10 20:05;0;0;"All Is Not Well in jaded Pune Warriors' camp - Indian Sports news http:// bit.ly/J3bA1y #pune";;;#pune;"200594901895884802";https://twitter.com/hashPune/status/200594901895884802
hashPune;2012-05-10 20:05;0;0;"U-20 I-League: Pune FC register second consecutive win - Indian Sports news http:// bit.ly/J3bzLi #pune";;;#pune;"200594898724986880";https://twitter.com/hashPune/status/200594898724986880
OGQ_India;2012-05-10 17:54;1;0;"Let's stop complaining. Let's stop cribbing. Let's make a difference to Indian sports !!! POWER YOUR CHAMPIONS... http:// fb.me/1WcMyAplo";;;;"200561955822518272";https://twitter.com/OGQ_India/status/200561955822518272
starcount;2012-05-10 17:34;0;0;"Congrats again to @mipaltan - the only Indian Sports club to make it to Top 50, with @FCbarcelona at the top http://www. starcount.com/chart/sports-t eam/4f2ad56a2418ae215b000084/alltime/41/2 …";;@mipaltan @FCbarcelona;;"200557018145234944";https://twitter.com/starcount/status/200557018145234944
Ping_Pong_News;2012-05-10 16:57;0;0;"#Chess - Asian Chess: Negi, Gupta register win in third round - Indian Sports news http:// ow.ly/1jCsRR";;;#Chess;"200547483758247936";https://twitter.com/Ping_Pong_News/status/200547483758247936
IPL_Update;2012-05-10 14:14;0;0;"IPL Match 56--Rajasthan Royals vs Chennai Super Kings: Players to watch out for… - Indian Sports news: Daily Mai... http:// bit.ly/LVm7lI";;;;"200506628544532480";https://twitter.com/IPL_Update/status/200506628544532480
SpartanSportsAU;2012-05-10 14:05;0;0;"Harbhajan rues dropping of Gayle by Smith, Kohli happy to beat MI at Wankhade - Indian Sports news http:// ow.ly/1jCdNN";;;;"200504393223770112";https://twitter.com/SpartanSportsAU/status/200504393223770112
KashmirLive;2012-05-10 13:59;0;0;"Orissa defeat Chandigarh in basketball tourney - Indian Sports news http:// bit.ly/JxXutF #Kashmir";;;#Kashmir;"200502793377820672";https://twitter.com/KashmirLive/status/200502793377820672
IPL_Update;2012-05-10 11:11;0;0;"IPL-5 is wide open, Hussey, Dravid say their teams have fair chance to make it ... - Indian Sports news: Zee New... http:// bit.ly/JwUTjx";;;;"200460555415330816";https://twitter.com/IPL_Update/status/200460555415330816
amjiddader;2012-05-10 10:22;0;0;"Kings XI Punjab still in the race for play-offs: Hussey - Indian Sports news: Zee NewsKings XI Punjab still in t... http:// bit.ly/JX214e";;;;"200448217933029376";https://twitter.com/amjiddader/status/200448217933029376
TheRahulMehra;2012-05-09 21:53;0;0;"I hope Aamir supports & fights 4improving d welfare of Indian athletes & 4a bright future of Indian sports ,which has been ignored 4decades?";;;;"200259777379581953";https://twitter.com/TheRahulMehra/status/200259777379581953
KitschCollector;2012-05-09 21:45;0;0;"RT @vivekbabaji : "anybody who has a little idea about non-cricket indian sports would be definitely knowing a lot about north-east india"";;@vivekbabaji;;"200257687752159232";https://twitter.com/KitschCollector/status/200257687752159232
SpartanSportsAU;2012-05-09 21:06;0;0;"It will be Chris Gayle vs Lasith Malinga at Wankhade: Shastri - Indian Sports news http:// ow.ly/1jAPMM";;;;"200247762330206208";https://twitter.com/SpartanSportsAU/status/200247762330206208
PresidentsCup_;2012-05-09 18:23;0;0;"Devendro Singh wins silver medal at President's Cup - Indian Sports news: Devendro Singh wins silver medal at Pr... http:// bit.ly/JU2hkm";;;;"200206896483934208";https://twitter.com/PresidentsCup_/status/200206896483934208
Sant_patil;2012-05-09 14:26;0;0;"Shooting with the real heroes of Indian sports . Hockey team. #HaveCourage pic.twitter.com/8bNFGEvR";;;#HaveCourage;"200147247550300161";https://twitter.com/Sant_patil/status/200147247550300161
CricketBooks;2012-05-09 12:15;0;0;"IPL match 54: Mumbai Indians versus Royal Challengers Bangalore: Players to ... - Indian Sports news http:// bit.ly/JSOyum";;;;"200114376336867328";https://twitter.com/CricketBooks/status/200114376336867328
mumbai24X7;2012-05-09 10:59;0;0;"Mumbai24X7 Bowlers will soon get protection against switch-hit: Pollock - Indian Sports news: Bowlers... http:// bit.ly/LKkvv7 Mumbai24X7";;;;"200095121587441664";https://twitter.com/mumbai24X7/status/200095121587441664
murty_mvr;2012-05-09 00:44;1;0;"Anyhoo, when it comes to Indian sports anchors, just one saccha pyaar. http:// en.wikipedia.org/wiki/Mayanti_L anger …";;;;"199940254042558465";https://twitter.com/murty_mvr/status/199940254042558465
IPL_Update;2012-05-08 15:29;1;0;"IPL Match 53: Deccan Chargers versus Kings XI Punjab: Players to watch out for... - Indian Sports news: Deccan C... http:// bit.ly/KXMTH3";;;;"199800654389186560";https://twitter.com/IPL_Update/status/199800654389186560
Sribabas;2012-05-08 14:47;0;0;"Olympics Hockey : A chance at the medals? - Indian Sports Fan: http:// indiansportsfan.com/hockey/olympic s-hockey-a-chance-at-the-medals/#.T6jkgfh81Cc.twitter …";;;#;"199790068582453248";https://twitter.com/Sribabas/status/199790068582453248
vivek1994;2012-05-08 13:30;0;0;"Arsenal home kit 2012/2013 - Indian Sports Fan: http:// indiansportsfan.com/football/epl/a rsenal-home-kit-20122013/#.T6jRqesnpv8.twitter …";;;#;"199770726641836032";https://twitter.com/vivek1994/status/199770726641836032
vivek1994;2012-05-08 13:30;0;0;"Yonex Sunrise Malaysia Open: Shuttlers fighting tough - Indian Sports Fan: http:// indiansportsfan.com/other-sports/b adminton-other-sports/yonex-sunrise-malaysia-open-shuttlers-fighting-tough/#.T6jRJVeFK2E.twitter …";;;#;"199770709680074756";https://twitter.com/vivek1994/status/199770709680074756
fni;2012-05-07 21:59;0;0;"I have the challenge of developing a 'sleeping giant' into a powerful force ... - Indian Sports news: indiabloom... http:// tinyurl.com/79z3eul";;;;"199536343666270209";https://twitter.com/fni/status/199536343666270209
fni;2012-05-07 18:53;0;0;"I-League: Jose Barreto leaves on a high note - Indian Sports news: I-League: Jose Barreto leaves on a high noteI... http:// tinyurl.com/7vzc8yp";;;;"199489575658323968";https://twitter.com/fni/status/199489575658323968
rkjogs;2012-05-07 18:49;0;0;"IPL: Biggest bowling flops of Season V so far... | Indian Sports News: http://www. indiansportsnews.com/isn-blogs/2012 /05/08/34-ipl-biggest-bowling-flops-of-season-v-so-far.html …";;;;"199488601166327808";https://twitter.com/rkjogs/status/199488601166327808
feelisgood;2012-05-07 18:12;0;0;"I feel good about my chances in coming Grand Slams: Federer - Indian Sports news";;;;"199479266654687233";https://twitter.com/feelisgood/status/199479266654687233
kikykini;2012-05-07 12:34;0;0;"Big big Congratulations @DipikaPallikal for creating history in #IndianSquash ...super proud! #indiansports";;@DipikaPallikal;#IndianSquash #indiansports;"199394276109582337";https://twitter.com/kikykini/status/199394276109582337
CricLatest;2012-05-07 12:29;0;0;"It's anybody's guess, Viru and Warner will open for Daredevils - Indian Sports news: ESPNcricinfo.comIt's anybod... http:// bit.ly/JJuWIN";;;;"199392953444204544";https://twitter.com/CricLatest/status/199392953444204544
mumbai24X7;2012-05-07 10:38;0;0;"Mumbai24X7 I-League: Chirag United thrash Mumbai FC 5-2 - Indian Sports news: I-League: Chirag United... http:// bit.ly/KxAptk Mumbai24X7";;;;"199365167614664705";https://twitter.com/mumbai24X7/status/199365167614664705
BrendenPierre;2012-05-07 05:34;0;0;"I'm going to a Indian sports shop and get A1 on my Cleveland Indians gear";;;;"199288615526875136";https://twitter.com/BrendenPierre/status/199288615526875136
mumbai24X7;2012-05-06 21:18;0;0;"Mumbai24X7 Dwayne Smith gatecrashes Chennai Super Kings' party - Indian Sports news: Dwayne Smith gat... http:// bit.ly/KDRvls Mumbai24X7";;;;"199163661414170627";https://twitter.com/mumbai24X7/status/199163661414170627
SportsNutDan;2012-05-06 16:06;0;0;"Just finished listening to #couchtalk where @thecricketcouch was in conversation with my favorite Indian sports presenter @gauravCNNIBN";;@thecricketcouch @gauravCNNIBN;#couchtalk;"199085317117067264";https://twitter.com/SportsNutDan/status/199085317117067264
TheRajKundra;2012-05-06 10:30;2;0;"A great nite celebratings with @rajasthanroyals off to Delhi now for #SFL3 #IndianSports on the rise finally!!!";;@rajasthanroyals;#SFL3 #IndianSports;"199000613282004992";https://twitter.com/TheRajKundra/status/199000613282004992
SRK_King_Khan;2012-05-06 10:29;0;0;"All Is Well: Sourav, Shah Rukh display camaraderie at Eden - Indian Sports news http:// bit.ly/LjQHVW";;;;"199000426325090304";https://twitter.com/SRK_King_Khan/status/199000426325090304
vishnu_vst;2012-05-06 00:34;0;0;"http:// olympicgoldquest.in/./ Just came to know about this beautiful concept and work headed by many Indian sports legends. check it! #Olympics";;;#Olympics;"198850580339359744";https://twitter.com/vishnu_vst/status/198850580339359744
