username;date;retweets;favorites;text;geo;mentions;hashtags;id;permalink
tarunstweet;2012-03-19 01:10;0;0;"Saina Nehwal wins Swiss Open. India beats Pakistan in Asia Cup. Near-perfect day for Indian Sports .";;;;"181465179970740224";https://twitter.com/tarunstweet/status/181465179970740224
kotuli;2012-03-19 00:56;0;0;"what a day for Indian sports and politics, in one place saina and Virat rocks while in politics due to didi we lost a capable minister";;;;"181461548135493633";https://twitter.com/kotuli/status/181461548135493633
sahilk99;2012-03-19 00:47;0;0;"Virat Kohli unbelievable saina nehwal awesome day for Indian sports ... And throwing dinesh trivedi as railway minister was awesome lol";;;;"181459216383475712";https://twitter.com/sahilk99/status/181459216383475712
VenuThomas;2012-03-19 00:35;0;0;"Whoa... Indian Sports on a ROLL!! Congratulations to Saina Nehwal for winning Swiss Open title & Indian Cricket team for great victory!!";;;;"181456291884048384";https://twitter.com/VenuThomas/status/181456291884048384
shayne_dsouz;2012-03-19 00:26;0;0;"Let's not forget#SainaNehwal 's win at the #SwissOpen it's been a good day for Indian sports";;;#SainaNehwal #SwissOpen;"181454029455499264";https://twitter.com/shayne_dsouz/status/181454029455499264
sartajsangha;2012-03-19 00:23;0;0;"Equally awesome win for Indian sports , Saina Nehwal wins Swiss Open !! Salute to her as well !!!";;;;"181453404739084288";https://twitter.com/sartajsangha/status/181453404739084288
nehamore;2012-03-18 23:53;0;0;"Saina Nehwal has defended her Swiss Open title, beating 2nd seed Shixian Wang of China 21-19, 21-16 in final...gud day 4 indian sports :)";;;;"181445759311425538";https://twitter.com/nehamore/status/181445759311425538
ShaliniSharma_;2012-03-18 23:43;3;0;"#sainanehwal trained & owes her success to that great Hyderabadi #gopichand who surely is the purest human being in Indian sports";;;#sainanehwal #gopichand;"181443306012672000";https://twitter.com/ShaliniSharma_/status/181443306012672000
socalsaree;2012-03-18 23:35;0;0;"RT @bookmyshow : Congrats Saina Nehwal on winning Swiss GP! Congrats Indian cricket team on defeating Pakistan! A good day for Indian sports !";;@bookmyshow;;"181441090069606400";https://twitter.com/socalsaree/status/181441090069606400
ref_kartik;2012-03-18 23:32;1;0;"A day meant for #IndianSports - Kohli and Saina Nehwal briallance stroked happiness in the nation";;;#IndianSports;"181440379403517952";https://twitter.com/ref_kartik/status/181440379403517952
Gunjan47;2012-03-18 23:21;4;0;"Super Sunday for Indian sports - Saina Nehwal wins Swiss Open";;;;"181437762241708032";https://twitter.com/Gunjan47/status/181437762241708032
maleabhi;2012-03-18 23:14;0;0;"Also Saina Nehwal won the Swiss Open title!!! What a day for Indian sports !!"";;;;"181435861655752704";https://twitter.com/maleabhi/status/181435861655752704
Sai_Ki_Artist;2012-03-18 22:59;0;1;"what a day for Indian sports ... kohli screwed Pakistan n sania nehwal won d swiss open";;;;"181432243884011520";https://twitter.com/Sai_Ki_Artist/status/181432243884011520
deepti3feb;2012-03-18 22:46;0;0;"Congrats Sania Nehwal for Winning the Swizz Open!! Superb sunday for Indian Sports ...:)";;;;"181428856249524225";https://twitter.com/deepti3feb/status/181428856249524225
Thalanamass;2012-03-18 22:43;0;0;"CONGRATULATIONS SAINA FOR MAKING INDIAN SPORTS PROUD :) Indian shuttler Saina Nehwal has won the Swiss Open Grand... http:// fb.me/1tDVbgJix";;;;"181428190462488577";https://twitter.com/Thalanamass/status/181428190462488577
subisamuel;2012-03-18 22:37;1;0;"Kudos Sania Nehwal and Virat Kohli. Great day for Indian Sports !!!! Way to go....";;;;"181426542025519104";https://twitter.com/subisamuel/status/181426542025519104
anandsmaurya;2012-03-18 22:35;0;0;"Great day for Indian sports India beats Pakistan in Asia cup .............. and Saina Nehwal (world ranking=5)... http:// fb.me/1EVU0HFpr";;;;"181426228522262530";https://twitter.com/anandsmaurya/status/181426228522262530
Abhijitkorti;2012-03-18 22:34;0;0;"Great day for Indian Sports ...Saina Nehwal lifting the Swiss open cup by beating World #2 and India beating Pakistan convincingly..!";;;#2;"181425796810936320";https://twitter.com/Abhijitkorti/status/181425796810936320
rijuta25;2012-03-18 22:26;0;0;"gr8 day 4 indian sports saina wins n indian cricket team beat pak :)";;;;"181423750917521408";https://twitter.com/rijuta25/status/181423750917521408
vishwav;2012-03-18 22:20;0;0;"Another news to rejoice as an Indian sports fan. Saina Nehwal successfully defends the Swiss Open title and wins her first title this season";;;;"181422334362652674";https://twitter.com/vishwav/status/181422334362652674
Atit_226;2012-03-18 22:20;1;0;"Please don't ignore other indian sports person...even they are playng for india...saina nehwal retained swiss cup#swissopen #sainanehwal";;;#swissopen #sainanehwal;"181422234563379201";https://twitter.com/Atit_226/status/181422234563379201
sriramumashank;2012-03-18 22:07;0;0;"Saina Nehwal has defended her Swiss Open title,beating 2nd seed Shixian Wang of China in final.wow gud news for Indian sports #indvspak";;;#indvspak;"181419160331501568";https://twitter.com/sriramumashank/status/181419160331501568
avishekpatra;2012-03-18 22:04;0;0;"Not just cricket! Saina Nehwal defends Swiss Open Grand Prix... Great day for Indian Sports ! http:// timesofindia.indiatimes.com/sports/more-sp orts/badminton/Saina-Nehwal-defends-Swiss-Open-title/articleshow/12318548.cms …";;;;"181418267804581889";https://twitter.com/avishekpatra/status/181418267804581889
vritikukreja;2012-03-18 22:03;0;0;"Tho we are all blinded by our pure passion for cricket but congrats saina nehwal, good time for Indian Sports ! Still high on indiapak game";;;;"181418072769437696";https://twitter.com/vritikukreja/status/181418072769437696
ShyFyy;2012-03-18 21:54;0;0;"Awesome day for Indian sports ! India have beaten Pakistan. Saina Nehwal has won and defended her Swiss Open Title!";;;;"181415667982024704";https://twitter.com/ShyFyy/status/181415667982024704
vikaas_khanna;2012-03-18 21:52;0;0;"Great Day for Indian Sports " @Sports_NDTV : Saina Nehwal wins the Swiss Open title for the 2nd consecutive year"";;@Sports_NDTV;;"181415307045376000";https://twitter.com/vikaas_khanna/status/181415307045376000
amithpr;2012-03-18 21:51;0;0;"Now Bombay Times will come up with Saina Nehwal and Virat Kohli as most eligible singles in Indian sports .";;;;"181415093253312514";https://twitter.com/amithpr/status/181415093253312514
rkjogs;2012-03-18 21:45;0;0;"Asia Cup: Virat’s ton helps India chase 330 against Pak | Indian Sports News http://www. indiansportsnews.com/top-stories/10 860--asia-cup-virats-ton-helps-india-chase-330-against-pakistan.html …";;;;"181413500474765314";https://twitter.com/rkjogs/status/181413500474765314
ajaymaken;2012-03-18 21:43;74;5;"Congrats Saina Nehwal on winning Swiss GP! Congrats Indian cricket team on defeating Pakistan! A good day for Indian Sports !";;;;"181413129505357824";https://twitter.com/ajaymaken/status/181413129505357824
Naim_K;2012-03-18 21:38;0;0;"+1 RT " @Aayu : Saina Nehwal has defended her Swiss Open title! great day for Indian sports :)"";;@Aayu;;"181411645329907714";https://twitter.com/Naim_K/status/181411645329907714
NotThatMP;2012-03-18 21:33;0;0;"Double Delight for Indian sports fans: Saina Nehwal wins Swiss Open and historical ODI win over Pak! Jai Hind!! #indvspak @rajeshkalra";;@rajeshkalra;#indvspak;"181410421574610945";https://twitter.com/NotThatMP/status/181410421574610945
indianalltheway;2012-03-18 21:32;6;0;"Saina Nehwal wins Swiss Open...what a player...Gr8 day for Indian sports";;;;"181410374921363456";https://twitter.com/indianalltheway/status/181410374921363456
Gkhetan;2012-03-18 21:27;0;0;"So great day for Indian sports ...Saina wins Swiss Open and Kohli smashed Pakistan";;;;"181409121499750403";https://twitter.com/Gkhetan/status/181409121499750403
tikgan;2012-03-18 21:21;0;0;"Big day for Indian Sports : Kohli thrashing Pakistan and Saina Nahiwal defending Swiss Open #ProudIndian";;;#ProudIndian;"181407442473721856";https://twitter.com/tikgan/status/181407442473721856
KingBollywoodUK;2012-03-18 20:28;0;0;"Best of sports movies in Bollywood - Indian Sports news Visit: http:// bit.ly/vh5PoB #Bollywood";;;#Bollywood;"181394173184847872";https://twitter.com/KingBollywoodUK/status/181394173184847872
rkjogs;2012-03-18 19:27;0;0;"Brand Sachin! A perfect role model for youngsters | Indian Sports News http://www. indiansportsnews.com/component/cont ent/article/13-featured-news/10857-brand-sachin-a-perfect-role-model-for-youngsters.html …";;;;"181378687411826688";https://twitter.com/rkjogs/status/181378687411826688
rkjogs;2012-03-18 17:57;0;0;"Amitabh Bachchan geared up to perform in IPL opening ceremony | Indian Sports News http://www. indiansportsnews.com/component/cont ent/article/970-out-of-box/10852-amitabh-bachchan-geared-up-to-perform-in-ipl-opening-ceremony.html …";;;;"181356171393896448";https://twitter.com/rkjogs/status/181356171393896448
rkjogs;2012-03-18 17:53;0;0;"Congressman demands museum in Mumbai to honor Sachin | Indian Sports News http://www. indiansportsnews.com/component/cont ent/article/970-out-of-box/10853-congressman-demands-museum-in-mumbai-to-honor-sachin.html …";;;;"181355169429196800";https://twitter.com/rkjogs/status/181355169429196800
SamikshanDC;2012-03-18 13:07;0;0;"BNP Paribas Open: Sania-Vesnina’s party gate crashed | Indian Sports News http://www. indiansportsnews.com/top-stories/10 832-bnp-paribas-open-sania-vesninas-party-gate-crashed.html …";;;;"181283108866367488";https://twitter.com/SamikshanDC/status/181283108866367488
CricketBooks;2012-03-18 10:02;0;0;"Deodhar Trophy: Jadhav, Iqbal steer West Zone into finals - Indian Sports news http:// bit.ly/zfUfRE";;;;"181236726335930370";https://twitter.com/CricketBooks/status/181236726335930370
yaymadtsud;2012-03-18 00:50;0;0;"http:// bit.ly/A7af7i Dhoni's boys looking to seal final berth by beating Bangladesh in Asia Cup on ... - Indian Sports news";;;;"181097765680586752";https://twitter.com/yaymadtsud/status/181097765680586752
amitsinha69;2012-03-17 22:37;0;0;"#nowwatching master blaster Sachin interview with Boria Majumdar one of the finest Indian sports journalist";;;#nowwatching;"181064227165966336";https://twitter.com/amitsinha69/status/181064227165966336
newsmandu;2012-03-17 20:12;0;0;"Google News - Abhijit Chadha wins Surya #Nepal Masters 2012 - Indian Sports news http:// is.gd/X1aarG";;;#Nepal;"181027675001982977";https://twitter.com/newsmandu/status/181027675001982977
rrsahaya;2012-03-17 18:19;0;0;"Indian sports lover should stop idol worshipping,attitude of Australian cricket is commended,th(cont) http:// kvs.co/JnnI";;;;"180999416587628545";https://twitter.com/rrsahaya/status/180999416587628545
SamikshanDC;2012-03-17 18:01;0;0;"Narain endures a difficult qualifying session in Australia | Indian Sports News: https:// twitter.com/#!/indiansport news … via @AddThis";;@AddThis;#;"180994732888043520";https://twitter.com/SamikshanDC/status/180994732888043520
tenforever;2012-03-17 10:39;0;0;"India celebrates Sachin's century of centuries Indian Sports news New Delhi: Fans of Sachin Tendulkar all around the... http:// dlvr.it/1KZSQv";;;;"180883423752224768";https://twitter.com/tenforever/status/180883423752224768
Nepal_travels;2012-03-17 06:52;0;0;"Surya Nepal: Local lad Shiva Ram in contention - Indian Sports news http:// dlvr.it/1KYJNj";;;;"180826298933981184";https://twitter.com/Nepal_travels/status/180826298933981184
ChetanChawla;2012-03-17 02:51;0;0;"Inspiring (the man) & sad (state of Indian sports ) at the same time http://www. economist.com/node/21550233";;;;"180765768986804224";https://twitter.com/ChetanChawla/status/180765768986804224
altamishjiwa;2012-03-16 22:11;1;0;"Next time if I meet an Indian Sports Journalist this is what I'm gonna say - hahahaha moohaahah heehehe hahahhaha n once more hahahahaa!";;;;"180695274585468928";https://twitter.com/altamishjiwa/status/180695274585468928
penguin_hoia_ja;2012-03-16 22:07;1;0;"i want to see the reaction of those indian sports analysts hu were celebratin sachin's 100th 100 their ass off.";;;;"180694185882566656";https://twitter.com/penguin_hoia_ja/status/180694185882566656
RujutaDiwekar;2012-03-16 19:20;2;0;"@sachin_rt u r simply awesome!!! Thanks thanks!!! Glorious day for Indian sports !:)";;@sachin_rt;;"180652368742973441";https://twitter.com/RujutaDiwekar/status/180652368742973441
praveenravi;2012-03-16 17:56;0;0;"Congratulations sir @sachin_rt . Your the greatest player of cricket and ambassdor for indian sports";;@sachin_rt;;"180631042498105345";https://twitter.com/praveenravi/status/180631042498105345
ramkrsna;2012-03-16 16:35;2;0;"Guess all the Indian sports journalists would be stretching their wrists and palms & also some kegal exercises once sachin gets to his 100.";;;;"180610676635607041";https://twitter.com/ramkrsna/status/180610676635607041
CricketBooks;2012-03-16 11:50;0;0;"All eyes on Sachin when India take on Bangladesh - Indian Sports news http:// bit.ly/xAyIlr";;;;"180538945854128129";https://twitter.com/CricketBooks/status/180538945854128129
Hoopistani;2012-03-16 11:06;0;0;"Indian Sports News on Kerala Girls' tough Federation Cup win over Tamil Nadu http://www. indiansportsnews.com/component/cont ent/article/38-local-sports/10694-kerela-sweats-it-out-in-the-federation-cup-basketball-.html …";;;;"180527876746117120";https://twitter.com/Hoopistani/status/180527876746117120
latestfeeds;2012-03-16 10:30;0;0;"Virat Kohli will play a bigger role in Indian cricket: Dilip Vengsarkar - Indian Sports news http:// v8no.com/bsr2 RT http:// v8no.com/!bsr2";;;;"180518790520516609";https://twitter.com/latestfeeds/status/180518790520516609
tenforever;2012-03-16 04:55;0;0;"Tendulkar's new hair style makes him look Perkier and young! Indian Sports news Our very own Sachin Tendulkar seems... http:// dlvr.it/1KKN3Q";;;;"180434475493244928";https://twitter.com/tenforever/status/180434475493244928
indiansportnews;2012-03-16 00:58;0;0;"Pretty cool Squidoo lens: indian sports news http://www. squidoo.com/indian-sports- news …";;;;"180374917798309890";https://twitter.com/indiansportnews/status/180374917798309890
newsmandu;2012-03-15 21:51;0;0;"Google News - Surya #Nepal Masters: Gaurav Pratap scores hole-in-one - Indian Sports news http:// is.gd/zHniE0";;;#Nepal;"180327829735616512";https://twitter.com/newsmandu/status/180327829735616512
KingBollywoodUK;2012-03-15 13:18;0;0;"Best of sports movies in #Bollywood - Indian Sports news Visit: http:// bit.ly/vh5PoB #Bollywood";;;#Bollywood #Bollywood;"180198739456163840";https://twitter.com/KingBollywoodUK/status/180198739456163840
CricketBooks;2012-03-15 09:03;0;0;"Sachin Tendulkar trains harder at nets with Sharma and Pathan - Indian Sports news http:// bit.ly/yDKOGA";;;;"180134606668963843";https://twitter.com/CricketBooks/status/180134606668963843
imSherAli;2012-03-15 00:18;1;0;"@sportsptv Is Abhishek really an Indian Sports Journalist ??? He is not talking typical Indian stereo type.";;@sportsptv;;"180002531978641409";https://twitter.com/imSherAli/status/180002531978641409
AbuBakarMamat;2012-03-15 00:01;0;0;"Malaysia to also play?: India to take part in the Hockey Tourney in Pakistan | Indian Sports News http://www. indiansportsnews.com/hot-picks/1062 7-india-to-take-part-in-the-hockey-tourney-in-pakistan.html … @knizam94";;@knizam94;;"179998193621282816";https://twitter.com/AbuBakarMamat/status/179998193621282816
malviyamit;2012-03-14 23:45;1;0;"Last update for the day: Watch Paan Singh Tomar if you haven't already. A touching story on unsung heroes of Indian sports .";;;;"179994223104376832";https://twitter.com/malviyamit/status/179994223104376832
malviyamit;2012-03-14 20:06;0;0;"Have you seen Paan Singh Tomar ? If not, go see it NOW. It is must must watch. Great film on unsung heroes of Indian sports .";;;;"179939027141664768";https://twitter.com/malviyamit/status/179939027141664768
SamikshanDC;2012-03-14 19:10;0;0;"Swiss Open: Saina Nehwal advances to round two | Indian Sports News: https:// twitter.com/#!/indiansport news … via @AddThis";;@AddThis;#;"179925072113451009";https://twitter.com/SamikshanDC/status/179925072113451009
HiBlitz;2012-03-14 17:46;0;0;"Identify this famous Indian sports Icon. http:// fb.me/1tJAxEbe8";;;;"179903839892287488";https://twitter.com/HiBlitz/status/179903839892287488
IndiaPlaysBQC;2012-03-14 11:33;0;0;"Which was the first Indian sports team to do around-the-world tour in early 1930's? a. Basketball team b. Kabaddi... http:// fb.me/TlAStc7T";;;;"179809952196599808";https://twitter.com/IndiaPlaysBQC/status/179809952196599808
rkjogs;2012-03-13 17:09;0;0;"Asia Cup: Centuries from Gambhir, Kohli help India finish at 304 for three | Indian Sports News http://www. indiansportsnews.com/component/cont ent/article/952-isn-front-stories/10611-asia-cup-centuries-from-gambhir-kohli-help-india-finish-at-304-for-three.html …";;;;"179532176327589890";https://twitter.com/rkjogs/status/179532176327589890
KingBollywoodUK;2012-03-13 17:05;0;0;"Best of sports movies in #Bollywood - Indian Sports news Visit: http:// bit.ly/vh5PoB #Bollywood";;;#Bollywood #Bollywood;"179531137444618241";https://twitter.com/KingBollywoodUK/status/179531137444618241
rkjogs;2012-03-13 16:09;0;0;"Twitter’s best friend is that you?? YES YESYES!! | Indian Sports News http://www. indiansportsnews.com/component/cont ent/article/970-out-of-box/10607-twitters-best-friend-is-that-you-yes-yesyes.html …";;;;"179516976987770880";https://twitter.com/rkjogs/status/179516976987770880
tenforever;2012-03-13 11:33;0;0;"Indian Express Asia Cup: All eyes on Sachin Tendulkar Indian Sports news At the Indian training session in Dhaka,... http:// dlvr.it/1JhVpD";;;;"179447466498854912";https://twitter.com/tenforever/status/179447466498854912
tenforever;2012-03-13 09:55;0;0;"Tendulkar will once again be the cynosure of all eyes: Vengsarkar Indian Sports news Sachin Tendulkar will once... http:// dlvr.it/1Jh00j";;;;"179423012800561152";https://twitter.com/tenforever/status/179423012800561152
SamtheAnswer;2012-03-13 02:07;0;0;"I haven't written anything but the title and this is already an amazing paper. my title is "Are Indian Sports Logos a No-Go?"";;;;"179305136710090752";https://twitter.com/SamtheAnswer/status/179305136710090752
InglJ;2012-03-12 23:55;1;0;"What's with the 2 east Indian sports commentators on #tsn ? #worst #danotoole";;;#tsn #worst #danotoole;"179271932326313984";https://twitter.com/InglJ/status/179271932326313984
JOBHUNTERZIN;2012-03-12 20:33;0;1;"The Wheels: Yamaha R15 Indian sports Bike Wallpapers and Image... http:// 2thewheels.blogspot.com/2012/03/yamaha -r15-indian-sports-bike.html?spref=tw …";;;;"179221196116721665";https://twitter.com/JOBHUNTERZIN/status/179221196116721665
JaquesLondon;2012-03-12 17:04;0;0;"#London #Olympics - Indian boxers ready for London Olympics - Indian Sports news http:// ow.ly/1hYSTA";;;#London #Olympics;"179168527855529984";https://twitter.com/JaquesLondon/status/179168527855529984
indiansportnews;2012-03-12 15:21;0;0;"MS Dhoni urges youngsters not to copy seniors | Indian Sports News http://www. indiansportsnews.com/top-stories/10 543-dhoni-urges-youngsters-not-to-copy-the-seniors.html …";;;;"179142508691996672";https://twitter.com/indiansportnews/status/179142508691996672
RqzoneBiz;2012-03-12 12:00;0;0;"Sordid saga of match fixing comes to haunt cricket again, Bollywood actress … – Indian Sports news http:// dlvr.it/1JTFVX";;;;"179091890883407872";https://twitter.com/RqzoneBiz/status/179091890883407872
indiansportnews;2012-03-12 09:41;0;0;"WSH: Wizards hold Marines in sensational finish | Indian Sports News http://www. indiansportsnews.com/top-stories/10 556--wsh-wizards-hold-marines-in-sensational-finish.html …";;;;"179057075853328384";https://twitter.com/indiansportnews/status/179057075853328384
RasherQuivers;2012-03-12 01:45;0;0;"We are working hard for London Olympics: L. Bombayla Devi | Indian Sports News http://www. indiansportsnews.com/sports-intervi ews/10553-we-are-working-hard-for-london-olympics-l-bombayla-devi.html …";;;;"178937170311122944";https://twitter.com/RasherQuivers/status/178937170311122944
IyerMurali;2012-03-11 20:17;0;0;"@Irfanatam @dirtigmanshu just watched 'PST' - super! #Irrfan - u rock! Thanx for original language, super cast, and visuals! #IndianSports";;@Irfanatam @dirtigmanshu;#Irrfan #IndianSports;"178854717743579137";https://twitter.com/IyerMurali/status/178854717743579137
earlygains;2012-03-11 19:23;0;0;"Dravid's retirement may buy some time for other seniors - Indian Sports news http:// goo.gl/fb/ieHMW #money";;;#money;"178840970295656448";https://twitter.com/earlygains/status/178840970295656448
ShwetaKawaatra;2012-03-11 15:59;0;0;"Hmm its still entrtnmt@drmalvika6: @ShwetaKawaatra sarcasm on indian sports system..!! sarcasm on ppl who governs sports except cricket..!!"";;@drmalvika6 @ShwetaKawaatra;;"178789769621409793";https://twitter.com/ShwetaKawaatra/status/178789769621409793
indiansportnews;2012-03-11 14:20;0;0;"Steven Smith roped in by Pune Warriors | Indian Sports News http://www. indiansportsnews.com/other-sports/c ricket-news/10546-steven-smith-roped-in-by-pune-warriors.html …";;;;"178764761553584128";https://twitter.com/indiansportnews/status/178764761553584128
KingBollywoodUK;2012-03-11 13:38;0;0;"Best of sports movies in #Bollywood - Indian Sports news Visit: http:// bit.ly/vh5PoB";;;#Bollywood;"178754330072055808";https://twitter.com/KingBollywoodUK/status/178754330072055808
indiansportnews;2012-03-11 13:25;0;0;"MS Dhoni urges youngsters not to copy seniors | Indian Sports News http://www. indiansportsnews.com/top-stories/10 543-dhoni-urges-youngsters-not-to-copy-the-seniors.html …";;;;"178751058212962304";https://twitter.com/indiansportnews/status/178751058212962304
indiansportnews;2012-03-11 13:16;0;0;"British PM David Cameron says it would be sad if India pull out of Olympics | Indian Sports News http://www. indiansportsnews.com/from-newspaper s/10541-british-pm-david-cameron-says-it-would-be-sad-if-india-pull-out-of-olympics.html …";;;;"178748635624902656";https://twitter.com/indiansportnews/status/178748635624902656
santhanamvijay;2012-03-11 11:43;0;0;"As a Indian sports enthusiast, "Paan Singh Tamar" is a must watch. Overall, a riveting, gripping movie and Irrfan Khan is fantastic";;;;"178725240950620160";https://twitter.com/santhanamvijay/status/178725240950620160
bombayinformer;2012-03-11 10:54;0;0;"#Bombay Vijay Hazare Trophy: Mumbai thrash Delhi, enter final – Indian Sports news http:// bit.ly/A79HWw";;;#Bombay;"178712960460525569";https://twitter.com/bombayinformer/status/178712960460525569
philippines_tip;2012-03-10 17:53;0;0;"India to face Philippines in AFC Cup - Indian Sports news http:// dlvr.it/1J9W6w";;;;"178455926427234306";https://twitter.com/philippines_tip/status/178455926427234306
webbytech;2012-03-10 13:40;0;0;"http:// Webby.co.in - India places bid for 2015 World Club Championship - Indian Sports news http:// goo.gl/fb/Av30r";;;;"178392335212748800";https://twitter.com/webbytech/status/178392335212748800
hockey_fanatics;2012-03-10 09:24;2;0;"goodbye Rahul, you were a true ambassador for Indian Sports . pic.twitter.com/JYkT2C5f";;;;"178327855078449152";https://twitter.com/hockey_fanatics/status/178327855078449152
MainBhiNaAmo;2012-03-10 00:07;0;0;"Sad day for Indian sports . Rahul Dravid retired, Saina Nehwal knocked out of All England Championships and India lost to Tajikistan 2-0 :|";;;;"178187823667625984";https://twitter.com/MainBhiNaAmo/status/178187823667625984
Mehitabel_Delhi;2012-03-09 23:55;0;0;"T obsession wt cricket just infuriates me more wt stories like #paansinghtomar . Indian sports needs a reality check! As does t govt & police";;;#paansinghtomar;"178184692015710208";https://twitter.com/Mehitabel_Delhi/status/178184692015710208
foreignstudents;2012-03-09 21:45;0;0;"Traditional Indian Sports and Games | Foreign Students Blog http:// bit.ly/xtx5LY";;;;"178152027468218371";https://twitter.com/foreignstudents/status/178152027468218371
faiz_gulaothi;2012-03-09 18:10;0;0;"IPL seems to be the easiest scapegoat for ‘self proclaimed critics’ | Indian Sports News: http://www. indiansportsnews.com/index.php?view =category&id=1:LatestItemid=0 … via @AddThis";;@AddThis;;"178097884867203073";https://twitter.com/faiz_gulaothi/status/178097884867203073
LocalBanya;2012-03-09 12:46;0;0;"The wall in action : A TRIBUTE to one of the greatest Indian sports legend .. http:// fb.me/1r1rlb2CN";;;;"178016347341594624";https://twitter.com/LocalBanya/status/178016347341594624
Oomahe;2012-03-09 10:27;0;0;"But, it was ironic to see people walk out when the names of the unsung hero's of Indian sports were being displayed during end credits. #PST";;;#PST;"177981342808686592";https://twitter.com/Oomahe/status/177981342808686592
bruce_arthur;2012-03-09 07:06;7;0;"Capitals kick a puck into their own net. Maybe Ted Leonsis's bank account was built on an old Indian sports burial ground.";;;;"177930848086147072";https://twitter.com/bruce_arthur/status/177930848086147072
Arsbiswas;2012-03-08 23:11;0;0;"A women's day tribute on the BCCI page courtesy Indian Sports Books http://www. bcci.tv/bcci/bccitv/in dex/viewarticle?article=%2Fmedia%2Freleases%2Fcontent%2F4f5779741ee3c.html …";;;;"177811389400875009";https://twitter.com/Arsbiswas/status/177811389400875009
rls_tajikistan;2012-03-08 20:17;0;0;"Confident India get ready for Tajikistan challenge - Indian Sports news http:// goo.gl/fb/0EWrd";;;;"177767609142480896";https://twitter.com/rls_tajikistan/status/177767609142480896
kritika13;2012-03-08 20:03;0;0;"Paan Singh Tomar - brilliiant and outstandiing film. Resect to the unsung heroes of Indian Sports . Irfan Khan Rocks. #lovedit";;;#lovedit;"177764035436093440";https://twitter.com/kritika13/status/177764035436093440
