username;date;retweets;favorites;text;geo;mentions;hashtags;id;permalink
kalpajitgogoi2;2013-10-13 17:02;0;0;"India’s silent sentinels in space save million lives: http://www. indiandefence.com/forums/indian- strategic-forces/34456-india%92s-silent-sentinels-space-save-million-lives.html#.UlqEgnSGR3c.twitter … via @indian_defence";;@indian_defence;#;"389352900595433473";https://twitter.com/kalpajitgogoi2/status/389352900595433473
indian_defence;2013-10-13 15:43;0;0;"Over 50 killed and 100 injured in stampede at Datia district in Madhya Pradesh http:// dlvr.it/47MSy9 #india";;;#india;"389333002070663168";https://twitter.com/indian_defence/status/389333002070663168
indian_defence;2013-10-13 15:21;1;0;"Australias defence forces must gear up for South China Sea, says expert http:// dlvr.it/47LtBv #world";;;#world;"389327618811494402";https://twitter.com/indian_defence/status/389327618811494402
indian_defence;2013-10-13 15:21;0;0;"IRGC Rejects Report on Maximum Range of Iranian Missiles http:// dlvr.it/47Lt8y #world";;;#world;"389327613820293120";https://twitter.com/indian_defence/status/389327613820293120
kingscrusher;2013-10-13 14:07;0;0;"I added a video to a @YouTube playlist http:// youtu.be/T7oaRvYhG7U?a Queens Indian Defence (E15) - Veselin Topalov vs Levon Aronian";;@YouTube;;"389308894394458112";https://twitter.com/kingscrusher/status/389308894394458112
rotarydeonar;2013-10-13 11:05;0;0;"I posted 4 photos on Facebook in the album "Guest Speaker Atul Pathak speaking on New Tech in Indian Defence " http:// fb.me/1TXwbfgoJ";;;;"389263107274838016";https://twitter.com/rotarydeonar/status/389263107274838016
JKevinBrent;2013-10-13 08:57;0;0;"Making of a General » Indian Defence Review | Page 2 http:// wp.me/p2NdkX-7W";;;;"389230793446674432";https://twitter.com/JKevinBrent/status/389230793446674432
kabirgrewal1;2013-10-13 08:08;0;1;"Happy dashera.. @Military_Indian @indian_defence @Indians4Israel pic.twitter.com/OZeZvoeBKy";;@Military_Indian @indian_defence @Indians4Israel;;"389218491963682816";https://twitter.com/kabirgrewal1/status/389218491963682816
IndiaShining_;2013-10-13 00:29;0;0;"The India Shining Daily is out! http:// paper.li/IndiaShining_ ▸ Top stories today via @PrabhuChawla @indian_defence @vikramgee";;@PrabhuChawla @indian_defence @vikramgee;;"389103120523214848";https://twitter.com/IndiaShining_/status/389103120523214848
nc1776;2013-10-12 22:57;0;0;"UK Ministry of Defence £2bn 'cash pile' scandal as thousands of troops sacked: http://www. indiandefence.com/forums/u-s-eur ope/34441-uk-ministry-defence-%A32bn-cash-pile-scandal-thousands-troops-sacked.html#.UlmGhK7iwlo.twitter … via @indian_defence";;@indian_defence;#;"389079949593690112";https://twitter.com/nc1776/status/389079949593690112
ManuPutra;2013-10-12 18:13;0;0;"@BhaskarChat they don't want to lose their 6 decade monopoly over Indian defence purchase it seems. All strategic areas!";;@BhaskarChat;;"389008334176919552";https://twitter.com/ManuPutra/status/389008334176919552
AC_NavalHistory;2013-10-12 17:29;0;0;"Land forces air defence #GlobalReach " @indian_defence : UK MOD places new order for Thales STARStreak missiles http:// dlvr.it/479rKM #world "";;@indian_defence;#GlobalReach #world;"388997308308013056";https://twitter.com/AC_NavalHistory/status/388997308308013056
imSreelekshmi;2013-10-12 16:49;0;3;"RT #PROUD @iCanSaveLife #Phailin Whenever Natural calamities coms They alwys come ahead to help and save lives. We salute #Indian #Defence";;@iCanSaveLife;#PROUD #Phailin #Indian #Defence;"388987319950123008";https://twitter.com/imSreelekshmi/status/388987319950123008
AC_NavalHistory;2013-10-12 15:03;0;0;"#GlobalInterests " @indian_defence : Indian economy likely to recover significantly by 2014: IMF http:// dlvr.it/476fVR #india "";;@indian_defence;#GlobalInterests #india;"388960589143638016";https://twitter.com/AC_NavalHistory/status/388960589143638016
AC_NavalHistory;2013-10-12 14:57;1;0;"#Cool " @indian_defence : Intercontinental Ballistic Missile launch as seen from the International Space Statio http:// dlvr.it/475jkD #world "";;@indian_defence;#Cool #world;"388959204796809216";https://twitter.com/AC_NavalHistory/status/388959204796809216
id2talk;2013-10-12 12:17;0;0;"Al-Qaeda set to burn the Ganges Post 2014 » Indian Defence Review: http://www. indiandefencereview.com/news/al-qaeda- set-to-burn-the-ganga-post-2014/#.UljsF80toj8.twitter … …";;;#;"388918861136793600";https://twitter.com/id2talk/status/388918861136793600
AbhayRishi28;2013-10-12 12:12;3;1;"Al-Qaeda set to burn the Ganga Post 2014 » Indian Defence Review: http://www. indiandefencereview.com/news/al-qaeda- set-to-burn-the-ganga-post-2014/#.UljsPg4Q5H8.twitter …";;;#;"388917473107406848";https://twitter.com/AbhayRishi28/status/388917473107406848
indian_defence;2013-10-12 11:50;1;0;"Symmetric and assymetric counters http:// dlvr.it/476Tc1 #world";;;#world;"388911945870368768";https://twitter.com/indian_defence/status/388911945870368768
wak1950;2013-10-12 11:06;0;0;"BJP AND N. MODI should remember indian defence budget in 1966 was rs. 600 crore, now it is 2.5 lakh crore.400%+ enhanced within 4.5 decades.";;;;"388901023739179009";https://twitter.com/wak1950/status/388901023739179009
indian_defence;2013-10-12 10:49;0;0;"Stars in ancient costume http:// dlvr.it/4766vP #china";;;#china;"388896576908701696";https://twitter.com/indian_defence/status/388896576908701696
indian_defence;2013-10-12 10:48;0;0;"Shutdown halts NASA efforts to re-invite banned Chinese researchers: organizers http:// dlvr.it/4766Tf #world";;;#world;"388896361350848512";https://twitter.com/indian_defence/status/388896361350848512
telanganafacts;2013-10-12 04:54;0;0;"#Telangana Formation of Telangana State - Page 38 - Indian Defence Analysis http:// ow.ly/2AEGvj";;;#Telangana;"388807360996978688";https://twitter.com/telanganafacts/status/388807360996978688
prem661987;2013-10-12 00:43;0;0;"Brides in Pakistan wear dresses other than hijab? RT @indian_defence Pakistani Bridal Fashion Week kicks off in Lahore http:// dlvr.it/471Cdd";;@indian_defence;;"388744178504450048";https://twitter.com/prem661987/status/388744178504450048
SUNNYSINGH4376;2013-10-11 22:54;1;0;"RT @indian_defence : Ashton Carter quits, blow to US-India defence ties http:// dlvr.it/4703kf #india @YusufDFI";;@indian_defence @YusufDFI;#india;"388716836692303872";https://twitter.com/SUNNYSINGH4376/status/388716836692303872
lotusbuddhababa;2013-10-11 22:31;1;0;"@Gen_VKSingh Idiots in the UPA & RAW cannot match the Defence establishment ? Indian Defence can have a better say than Pakistani ISI or Army";;@Gen_VKSingh;;"388710872526245888";https://twitter.com/lotusbuddhababa/status/388710872526245888
SumannSharrma;2013-10-11 12:45;2;1;"China’s Interests in Shaksgam Valley » Indian Defence Review: http://www. indiandefencereview.com/news/chinas-in terests-in-shaksgam-valley/#.Ulej2vchjvE.twitter …";;;#;"388563567223377920";https://twitter.com/SumannSharrma/status/388563567223377920
h_bhatnagar;2013-10-11 11:29;0;0;"what is inside KAABA: http://www. indiandefence.com/forums/members -room/8641-what-inside-kaaba.html#.UleRcZPxORs.twitter … via @indian_defence";;@indian_defence;#;"388544403406483456";https://twitter.com/h_bhatnagar/status/388544403406483456
jiboyv;2013-10-11 09:39;0;0;"@Berges @Mosiqi The flight probbly was to Islamabad, so that they can bring them up to date on recent findings in Indian defence .";;@Berges @Mosiqi;;"388516575201865729";https://twitter.com/jiboyv/status/388516575201865729
indipro;2013-10-11 09:35;0;0;"US Army plans 'Iron Man' armour http://www. bbc.co.uk/news/technolog y-24474336 … Will Indian Defence R&D follow suit?";;;;"388515734663360513";https://twitter.com/indipro/status/388515734663360513
AC_NavalHistory;2013-10-11 06:36;0;0;"See science fiction serves a purpose ..." @indian_defence : US Army plans 'Iron Man' armour for soldiers http:// dlvr.it/46kgG5 #world "";;@indian_defence;#world;"388470652766023680";https://twitter.com/AC_NavalHistory/status/388470652766023680
LauraHuu;2013-10-11 01:58;1;0;"oh well “ @indian_defence : Brazil plans to go offline from US-centric internet http:// dlvr.it/46hk2R #world ”";;@indian_defence;#world;"388400591833399296";https://twitter.com/LauraHuu/status/388400591833399296
ranjandey007;2013-10-11 00:32;1;0;"God! Please protect ur creation! " @indian_defence : Woman denied help, forced to deliver baby outside hospital http:// dlvr.it/46hL9x #world "";;@indian_defence;#world;"388379150551375872";https://twitter.com/ranjandey007/status/388379150551375872
DharmicReviver;2013-10-10 18:57;0;0;"Pathetic Indian electors & their governments! >>>> We can't do anything in Saurabh Kalia's case - Indian Defence ... http:// fb.me/3nYxGceyl";;;;"388294786186493952";https://twitter.com/DharmicReviver/status/388294786186493952
jaimehta;2013-10-10 18:01;0;0;"An Indian Forest officer single-handedly reclaims 6,000 acres in 3 years: http://www. indiandefence.com/forums/social- current-affairs/34310-forest-officer-single-handedly-reclaims-6-000-acres-3-years.html#.Uladn7c_e50.twitter … via @indian_defence";;@indian_defence;#;"388280582116868096";https://twitter.com/jaimehta/status/388280582116868096
lohithmbm;2013-10-10 16:59;0;0;"See What a Drone can see from 17,500 ft » Indian Defence Review: http://www. indiandefencereview.com/media/spy-dron e-can-see-what-you-are-wearing-from-17500-feet/#.UlaPZ_BhVBY.twitter …";;;#;"388265065658347520";https://twitter.com/lohithmbm/status/388265065658347520
lohithmbm;2013-10-10 16:56;0;0;"Making of a General » Indian Defence Review: http://www. indiandefencereview.com/interviews/mak ing-of-a-general/#.UlaOT6Yibto.twitter …";;;#;"388264245307002880";https://twitter.com/lohithmbm/status/388264245307002880
indian_defence;2013-10-10 16:50;1;0;"Forest officer single-handedly reclaims 6,000 acres in 3 years http:// dlvr.it/46Yzvg #india";;;#india;"388262852408000512";https://twitter.com/indian_defence/status/388262852408000512
SHIV139;2013-10-10 16:20;0;0;"@indian_defence Looks like the Israeli army chief must have been reading Cold Start !";;@indian_defence;;"388255183228403712";https://twitter.com/SHIV139/status/388255183228403712
indian_defence;2013-10-10 14:57;0;0;"Countrys aerial defence impregnable: Nawaz Sharif http:// dlvr.it/46X7Ry #pakistan";;;#pakistan;"388234224697745408";https://twitter.com/indian_defence/status/388234224697745408
indian_defence;2013-10-10 14:57;0;0;"Pakistan to continue steps for peace, says Nawaz http:// dlvr.it/46X7Pc #pakistan";;;#pakistan;"388234216426573824";https://twitter.com/indian_defence/status/388234216426573824
akki_kapoor;2013-10-10 14:10;0;0;"@madhukishwar Please dont forget the immense contribution of Punjabis to the Indian defence forces.";;@madhukishwar;;"388222574825451520";https://twitter.com/akki_kapoor/status/388222574825451520
agniveer;2013-10-10 14:01;2;0;"We can't do anything in Saurabh Kalia's case - Indian Defence Minister. A government that can make US... http:// fb.me/2p224bCeZ";;;;"388220190942834688";https://twitter.com/agniveer/status/388220190942834688
DefenceInBiz;2013-10-10 11:42;0;0;"#DefenceOfficersinBusiness Daily is out! http:// paper.li/DefenceInBiz/1 316239902 … ▸ Top stories today via @Military_Tech @indian_defence";;@Military_Tech @indian_defence;#DefenceOfficersinBusiness;"388185243817353216";https://twitter.com/DefenceInBiz/status/388185243817353216
Sanjay_Dixit;2013-10-10 10:26;0;0;"Pak Regulars Combine with LeT, Mujahids, and Taliban against India » Indian Defence Review: http://www. indiandefencereview.com/news/pak-regul ars-combine-with-let-mujahids-and-taliban-against-india/#.UlYx7edAuaE.twitter …";;;#;"388166070994878464";https://twitter.com/Sanjay_Dixit/status/388166070994878464
bdkavach;2013-10-10 01:08;0;0;"Indian Defence News - India-Iran Relations and Strategic importance of Chabahar Port http://www. bharatdefencekavach.com/News/37663_Ind ia-Iran-Relations-and--Strategic-importance-of-Chabahar-Port.html#.UlWwyeGd1WE.twitter …";;;#;"388025811028033536";https://twitter.com/bdkavach/status/388025811028033536
kabirgrewal1;2013-10-10 01:01;1;0;"@Military_Indian death from heaven.. #JaiHind @indian_defence @Nations_Choice pic.twitter.com/2hXYoxpZs3";;@Military_Indian @indian_defence @Nations_Choice;#JaiHind;"388023948413120512";https://twitter.com/kabirgrewal1/status/388023948413120512
bdkavach;2013-10-10 00:43;0;0;"Indian Defence News - Kashmir assembly to summon former army chief http://www. bharatdefencekavach.com/News/37902_Kas hmir-assembly-to-summon-former-army-chief.html#.UlWqyR9lxH0.twitter …";;;#;"388019374163902464";https://twitter.com/bdkavach/status/388019374163902464
kalpajitgogoi2;2013-10-10 00:41;0;0;"@indian_defence China is preparing for the future war and India will be caught with pants down if the same attitude and policy persists.";;@indian_defence;;"388018780757966848";https://twitter.com/kalpajitgogoi2/status/388018780757966848
AVALsshh;2013-10-09 23:53;0;0;"@DrShobha @indian_defence R Delhites so idiot that they will make a separatist-communist as kejri to win?";;@DrShobha @indian_defence;;"388006859233570816";https://twitter.com/AVALsshh/status/388006859233570816
gangawat;2013-10-09 23:25;0;0;"Indian Defence News - Antony to examine issues raised by Patel on IAF tender http://www. bharatdefencekavach.com/News/37909_Ant ony-to-examine-issues-raised-by-Patel-on-IAF-tender.html#.UlWYibJBj0I.twitter …";;;#;"387999768233795584";https://twitter.com/gangawat/status/387999768233795584
gangawat;2013-10-09 23:24;0;0;"Indian Defence News - Dhruv Helicopter Clocks 1,00,000 Flying Hours http://www. bharatdefencekavach.com/News/37908_Dhr uv-Helicopter-Clocks-1-00-000-Flying-Hours.html#.UlWYOH-eDpc.twitter …";;;#;"387999456206913537";https://twitter.com/gangawat/status/387999456206913537
vijaybahadurpa;2013-10-09 22:43;0;0;"Madrasa scam in UP: Over 100 institutions getting govt funds exist only on paper: http://www. indiandefence.com/forums/nationa l-politics/34221-madrasa-scam-up-over-100-institutions-getting-govt-funds-exist-only-paper.html#.UlWOasrFq08.twitter … via @indian_defence";;@indian_defence;#;"387989282264084481";https://twitter.com/vijaybahadurpa/status/387989282264084481
IndianRenaisanc;2013-10-09 18:46;1;0;"The Inside Story of Samba Attack » Indian Defence Review: http://www. indiandefencereview.com/news/the-insid e-story-of-samba-attack/#.UlVV-9ePztg.twitter …";;;#;"387929493311983616";https://twitter.com/IndianRenaisanc/status/387929493311983616
SumannSharrma;2013-10-09 16:43;1;0;"Praful Patel should know about the past performance record of Indian defence PSUs before saying all that ,read here http://www. chhindits.blogspot.in/2013/10/80-lif e-of-kirans-is-over-ijt-urgently.html …";;;;"387898545887379456";https://twitter.com/SumannSharrma/status/387898545887379456
thefansofhockey;2013-10-09 14:45;0;0;"The Last Line of #Indian Defence, Indian #Hockey Goalkeepers !!! RT / Share <3 Hit (y) The Fans of Hockey /... http:// fb.me/2BGAiMmbF";;;#Indian #Hockey;"387868958780825600";https://twitter.com/thefansofhockey/status/387868958780825600
indian_defence;2013-10-09 14:40;1;0;"China developing worlds first 180,000-ton double-hull aircraft carrier http:// dlvr.it/46CBMs #china";;;#china;"387867764313964544";https://twitter.com/indian_defence/status/387867764313964544
indian_defence;2013-10-09 14:38;0;1;"Afghan Taliban say Pakistan still keeping Mullah Baradar in jail http:// dlvr.it/46C7KZ #world";;;#world;"387867155733041154";https://twitter.com/indian_defence/status/387867155733041154
indian_defence;2013-10-09 14:38;0;1;"MU90 torpedo enters Royal Australian Navy service http:// dlvr.it/46C7HB #world";;;#world;"387867148493668352";https://twitter.com/indian_defence/status/387867148493668352
Buzzy14;2013-10-09 12:02;1;0;"@HelpingRhinos Where,s the Indian Defence Force??? They shld protect their heritage!!! Sad,very sad!!!";;@HelpingRhinos;;"387827846418530305";https://twitter.com/Buzzy14/status/387827846418530305
shaels;2013-10-09 09:52;0;0;"For Antony, Praful Patel and all the Babu's midwives of Defence PSUs: The Great Betrayal » Indian Defence Review - http://www. indiandefencereview.com/spotlights/def ence-psus-the-great-betrayl/ …";;;;"387795137210109953";https://twitter.com/shaels/status/387795137210109953
kalpajitgogoi2;2013-10-09 08:43;0;0;"@indian_defence The court ruling goes against what the international observers are saying. Seems like authoritarian days are back.";;@indian_defence;;"387777722300125184";https://twitter.com/kalpajitgogoi2/status/387777722300125184
kalpajitgogoi2;2013-10-08 22:54;0;0;"@indian_defence Airforce will be the biggest looser in the fight between HAL and IAF.";;@indian_defence;;"387629685695184896";https://twitter.com/kalpajitgogoi2/status/387629685695184896
SumukhNaik;2013-10-08 22:47;0;0;"Best wishes on the eve of Indian Air Force Day - Guardians of skies. @adgpi @indian_defence @IndianAirforce_ #India #Mumbai #Pune #Nashik";;@adgpi @indian_defence @IndianAirforce_;#India #Mumbai #Pune #Nashik;"387627796215767040";https://twitter.com/SumukhNaik/status/387627796215767040
RTAF_JSG;2013-10-08 21:27;0;0;"インド-オマーン両国空軍が、オマーン・マシーラ島一帯で合同演習を開始した由（12日迄 RT @indian_defence : India-Oman joint aerial exercise on http:// dlvr.it/460WD0 #india";;@indian_defence;#india;"387607642492776448";https://twitter.com/RTAF_JSG/status/387607642492776448
RTAF_JSG;2013-10-08 20:28;0;0;"中国がブータンで軍も利用可能な道路の建設を行っているという話 RT @indian_defence : China's massive infrastructure build up in Bhutan http:// dlvr.it/45zZmM #india";;@indian_defence;#india;"387592738482298880";https://twitter.com/RTAF_JSG/status/387592738482298880
bharat_builder;2013-10-08 20:23;4;0;"Time bomb is ticking. " @indian_defence : China's massive infrastructure build up in Bhutan http:// dlvr.it/45zZmM #india "";;@indian_defence;#india;"387591551188099072";https://twitter.com/bharat_builder/status/387591551188099072
Sanjay_Dixit;2013-10-08 20:01;0;0;"Lost opportunities in Operation Parakram » Indian Defence Review | Page 2: http://www. indiandefencereview.com/spotlights/los t-opportunities-in-operation-parakram/#.UlQWdIfjJ_Y.twitter …";;;#;"387586035313430528";https://twitter.com/Sanjay_Dixit/status/387586035313430528
shaels;2013-10-08 19:32;0;0;"What National Security? By Lt Gen Prakash Katoch » Indian Defence Review: http://www. indiandefencereview.com/news/what-nati onal-security/#.UlQPmpkYwPM.twitter …";;;#;"387578766576218112";https://twitter.com/shaels/status/387578766576218112
sajin_awesome;2013-10-08 19:30;0;0;"Now this is what we call GLORIOUS INDIAN DEFENCE FORCES­­ Ranges of Agni II ,III,V http:// fb.me/227tdtD2S";;;;"387578280502894592";https://twitter.com/sajin_awesome/status/387578280502894592
Vidyut;2013-10-08 18:51;1;0;"Chinese Aggressiveness: Need for appropriate response » Indian Defence Review http:// j.mp/15Y13Br";;;;"387568348159963136";https://twitter.com/Vidyut/status/387568348159963136
jaybhaskar;2013-10-08 16:53;0;0;"Kashmir: India-China-Pakistan Triangular Conflict » Indian Defence Review: http:// bit.ly/15jMb37";;;;"387538743218810883";https://twitter.com/jaybhaskar/status/387538743218810883
mkmahala;2013-10-08 12:36;0;0;""Indian #AirForce : One of the wings of Indian Defence ". at 4:00PM in AE (Details here... http:// fb.me/2qTVlTjE5";;;#AirForce;"387473963775188992";https://twitter.com/mkmahala/status/387473963775188992
PairsonnalitesA;2013-10-08 12:32;0;0;"IN: Bangladesh Honours Former Indian Defence Minister: Bangladesh Honours Former Indian Defence Minister - More... http:// dlvr.it/45rDB9";;;;"387473120983908352";https://twitter.com/PairsonnalitesA/status/387473120983908352
armoured74;2013-10-08 12:28;0;0;"Why does Indian defence forces always reacts. Can't they act to stop infiltration and reduce unnecessary arguments on national TV channels.";;;;"387471967059582977";https://twitter.com/armoured74/status/387471967059582977
indian_defence;2013-10-08 12:21;0;0;"Egyptian soldiers killed in Ismailiya and Sinai attacks http:// dlvr.it/45r60W #world";;;#world;"387470206429179905";https://twitter.com/indian_defence/status/387470206429179905
indian_defence;2013-10-08 12:21;1;0;"Brazil summons Canadian envoy over spy claims http:// dlvr.it/45r60N #world";;;#world;"387470204302655488";https://twitter.com/indian_defence/status/387470204302655488
indian_defence;2013-10-08 12:21;0;0;"Bettencourt affair: Sarkozy secret cash case 'dropped' http:// dlvr.it/45r608 #world";;;#world;"387470201672855552";https://twitter.com/indian_defence/status/387470201672855552
PairsonnalitesA;2013-10-08 12:19;0;0;"Bangladesh Honours Former Indian Defence Minister - More than four decades after its Liberation War, Bangladesh has… http:// goo.gl/fb/jYnQY";;;;"387469807802929152";https://twitter.com/PairsonnalitesA/status/387469807802929152
RoshanSdrprop;2013-10-08 10:44;1;1;"Three Most Dependable Indian Organisations :- 1. Indian Defence Forces ! 2. Rashtriya Swayam Sewak Sangh ! 3. Bhartiya Janta Party !";;;;"387445831223099393";https://twitter.com/RoshanSdrprop/status/387445831223099393
Kusum_Negi_;2013-10-08 09:27;0;0;"Indian Defence #Proud";;;#Proud;"387426500120559616";https://twitter.com/Kusum_Negi_/status/387426500120559616
DTNMilitary;2013-10-08 08:03;0;0;"DTN Military News: Outgoing Indian Defence Attaché meets Secretary: The outgoing Indian Defence Attaché Captai... http:// bit.ly/19aZCSn";;;;"387405350950813697";https://twitter.com/DTNMilitary/status/387405350950813697
TheOsintJournal;2013-10-08 02:29;0;0;"The OsintJournal Daily Report is out! http:// paper.li/TheOsintJourna l/1326056383 … ▸ Top stories today via @TerrorismWatch @stratsoc @indian_defence";;@TerrorismWatch @stratsoc @indian_defence;;"387321420545814529";https://twitter.com/TheOsintJournal/status/387321420545814529
henrycobb;2013-10-08 00:39;0;0;"@indian_defence The F-22 will not use its own radar vs Su-35. The Russian radar will provide sufficient targeting information to kill it.";;@indian_defence;;"387293599827623938";https://twitter.com/henrycobb/status/387293599827623938
DaHumanist;2013-10-08 00:18;0;0;"U.S. pilot scares off Iranians with 'Top Gun'-worthy stunt - http:// wtim.es/1fdu1Wg via @washtimes @theyoungturks @CombatAir @indian_defence";;@washtimes @theyoungturks @CombatAir @indian_defence;;"387288394415357952";https://twitter.com/DaHumanist/status/387288394415357952
mkmahala;2013-10-07 23:09;1;0;"#AirForce Day Lecture "IAF: One of the Wings of Indian #Defence " by Wing Commander (Retd) H. R. Parthasarthy on... http:// fb.me/3mOU6iUWK";;;#AirForce #Defence;"387270954424229888";https://twitter.com/mkmahala/status/387270954424229888
vivalanka;2013-10-07 22:22;0;0;"Outgoing Indian Defence Attaché meets Secretary http://www. vivalanka.com/news/page.jsp? articleid=555655 …";;;;"387259094324637696";https://twitter.com/vivalanka/status/387259094324637696
TAMILTODAY;2013-10-07 21:09;1;0;"Outgoing Indian Defence Attaché meets Secretary: The outgoing Indian Defence Attaché Captain Sumeet Kapoor pai... http:// bit.ly/1b3zpGB";;;;"387240813366743040";https://twitter.com/TAMILTODAY/status/387240813366743040
IHS4DefRiskSec;2013-10-07 20:48;2;1;"Are Indian defence self-sufficiency reforms falling flat? Read this op ed piece in full and for free at http:// ihsjanes360.com";;;;"387235457764823041";https://twitter.com/IHS4DefRiskSec/status/387235457764823041
ayushbht;2013-10-07 20:36;0;0;"http://www. indiandefencereview.com/wp-content/plu gins/sam-images/LM_C130_India_331x270_9-26-13.jpg … Indian Defence Review http://www. indiandefencereview.com /";;;;"387232495017537536";https://twitter.com/ayushbht/status/387232495017537536
kalpajitgogoi2;2013-10-07 19:50;1;0;"@indian_defence Its the money from the gulf that's fueling the terror aspect in the state. Rule by congress and LDF doesn't help the matter.";;@indian_defence;;"387220934077063168";https://twitter.com/kalpajitgogoi2/status/387220934077063168
bdkavach;2013-10-07 16:07;0;0;"Indian Defence News - Fishing community wants to continue TN n-plant stir http:// fb.me/N3Bt4wCn";;;;"387164797625593856";https://twitter.com/bdkavach/status/387164797625593856
bdkavach;2013-10-07 15:40;0;0;"Indian Defence News - West Asia: Would Nehru, Vajpayee have remained silent?: Saeed Naqvi http:// fb.me/POjlzkaL";;;;"387158003427708930";https://twitter.com/bdkavach/status/387158003427708930
AC_NavalHistory;2013-10-07 14:52;0;0;"#GlobalInterests #RoyalNavy " @indian_defence : MBDAs Sea Ceptor Selected for Royal New Zealand Navys ANZAC http:// dlvr.it/45Xd2M #world "";;@indian_defence;#GlobalInterests #RoyalNavy #world;"387145899140734976";https://twitter.com/AC_NavalHistory/status/387145899140734976
AC_NavalHistory;2013-10-07 14:51;0;0;"#BMD " @indian_defence : Lockheed Martins Aegis Ballistic Missile Defense System complete highest target http:// dlvr.it/45Xczm #world "";;@indian_defence;#BMD #world;"387145690478305280";https://twitter.com/AC_NavalHistory/status/387145690478305280
indian_defence;2013-10-07 14:45;0;1;"Bomb kills seven during anti-polio campaign in Pakistan http:// dlvr.it/45YK8M #pakistan";;;#pakistan;"387144036525428736";https://twitter.com/indian_defence/status/387144036525428736
bdkavach;2013-10-07 14:38;0;0;"Indian Defence News - I made ISI answerable to parliament : Gilani http:// fb.me/2xXrcwJPv";;;;"387142454706577409";https://twitter.com/bdkavach/status/387142454706577409
indian_defence;2013-10-07 14:12;0;1;"Spearhead completes testing milestone http:// dlvr.it/45Xd66 #world";;;#world;"387135809645576192";https://twitter.com/indian_defence/status/387135809645576192
indian_defence;2013-10-07 14:12;1;1;"MBDAs Sea Ceptor Air Defence System Selected for Royal New Zealand Navys ANZAC http:// dlvr.it/45Xd2M #world";;;#world;"387135770592415745";https://twitter.com/indian_defence/status/387135770592415745
