username;date;retweets;favorites;text;geo;mentions;hashtags;id;permalink
indian_defence;2013-09-04 14:48;0;0;"SLs relationship with China was questioned by visiting defence officials  Gotabaya http:// dlvr.it/3vjWtv #india";;;#india;"375186133421793280";https://twitter.com/indian_defence/status/375186133421793280
indian_defence;2013-09-04 14:48;0;0;"Pakistan-India skirmishes reignite Kashmir tensions http:// dlvr.it/3vjWjh #india";;;#india;"375186126970974208";https://twitter.com/indian_defence/status/375186126970974208
AC_NavalHistory;2013-09-04 13:52;0;0;"And probably #LRMP as well " @indian_defence :Co-development,co-production in defence top PM agenda on US visit http:// dlvr.it/3vh0k2 #india "";;@indian_defence;#LRMP #india;"375171956246843392";https://twitter.com/AC_NavalHistory/status/375171956246843392
DJGalbreath;2013-09-04 13:52;0;0;"Effective “ @indian_defence : Al Qaeda set up anti-drone cells, secret US documents show: Post http:// dlvr.it/3vhW0n #world ”";;@indian_defence;#world;"375171948986523648";https://twitter.com/DJGalbreath/status/375171948986523648
wkdpolitics;2013-09-04 11:49;0;0;"@indian_defence go in peace & feed your starving children";;@indian_defence;;"375141100174184448";https://twitter.com/wkdpolitics/status/375141100174184448
kishorebudha;2013-09-04 02:28;1;0;"After some awful Hindi typography, now design plagiarism by Indian defence forces http://www. livefistdefence.com/2013/09/new-ia f-squadron-logo-steals-from-vin.html … via @shivaroor @livefist";;@shivaroor @livefist;;"374999913999765505";https://twitter.com/kishorebudha/status/374999913999765505
SusnathaNath;2013-09-04 01:58;0;0;"Great thing for Indian defence ! http:// ecoti.ms/kUxdbY";;;;"374992204663906304";https://twitter.com/SusnathaNath/status/374992204663906304
Francesco1407;2013-09-03 20:30;0;0;"Indian Defence sources slam auditor's report on #AW101 deal but nobody talks about it! #Finmeccanica #AgustaWestland http:// lnkd.in/XYEubG";;;#AW101 #Finmeccanica #AgustaWestland;"374909863425372161";https://twitter.com/Francesco1407/status/374909863425372161
emouchet2;2013-09-03 19:58;0;0;"@indian_defence hilarious report from russia and india reports...";;@indian_defence;;"374901713356226560";https://twitter.com/emouchet2/status/374901713356226560
DefenceReview;2013-09-03 19:38;0;0;"National Security: Can the nation expect PM to stop swimming in slush? » Indian Defence Review: http://www. indiandefencereview.com/news/national- security-can-the-nation-expect-pm-to-stop-swimming-in-slush/#.UiXtQPdatqo.twitter …";;;#;"374896669294206977";https://twitter.com/DefenceReview/status/374896669294206977
sudsmobile;2013-09-03 17:37;0;0;"" @indian_defence :Pak Navy inducts new F-22P guided missile frigate http:// dlvr.it/3vR0fx " Moily will announce *austerity* measures on 16th!";;@indian_defence;;"374866225634897920";https://twitter.com/sudsmobile/status/374866225634897920
kabirgrewal1;2013-09-03 16:58;0;0;"@indian_defence @Nations_Choice @Military_Indian ♡ #jaiHind ♡ #vandeMatram ♡ vandeMatram♡ vandeMatram♡vandeMatram♡ pic.twitter.com/45KxikObkJ";;@indian_defence @Nations_Choice @Military_Indian;#jaiHind #vandeMatram;"374856338142003203";https://twitter.com/kabirgrewal1/status/374856338142003203
kalpajitgogoi2;2013-09-03 14:36;0;0;"@indian_defence Also from the report that Brazil and Pakistan are collaborating closely in the Industrial sector.";;@indian_defence;;"374820629293199360";https://twitter.com/kalpajitgogoi2/status/374820629293199360
AC_NavalHistory;2013-09-03 13:43;0;1;"@Thinking_Major @indian_defence it makes sense, as I said a non-story";;@Thinking_Major @indian_defence;;"374807467152375808";https://twitter.com/AC_NavalHistory/status/374807467152375808
AC_NavalHistory;2013-09-03 13:18;0;0;"Unreliable officers or unreliable command chain? #ReadItAll " @indian_defence : Unreliable British officers http:// dlvr.it/3vMnmr #world "";;@indian_defence;#ReadItAll #world;"374801004518453248";https://twitter.com/AC_NavalHistory/status/374801004518453248
DJGalbreath;2013-09-03 12:49;0;0;"Mole hill/mountain “ @indian_defence : Unreliable British officers left out of US meetings on Syria http:// dlvr.it/3vMnmr #world ”";;@indian_defence;#world;"374793831360626688";https://twitter.com/DJGalbreath/status/374793831360626688
FrancescoBalbo;2013-09-03 12:46;0;0;"Chinese keen to relocate textile plants for exports: http://www. indiandefence.com/forums/china/3 1753-chinese-keen-relocate-textile-plants-exports.html#.UiWMwry3Czc.twitter … via @indian_defence";;@indian_defence;#;"374793057205370880";https://twitter.com/FrancescoBalbo/status/374793057205370880
BeSharmaji;2013-09-03 10:45;0;0;"Lol IAF, wtf? “ @indian_defence New IAF Squadron Logo Lifts From Vin Diesel Film http:// dlvr.it/3vLkbw #india ”";;@indian_defence;#india;"374762616624656384";https://twitter.com/BeSharmaji/status/374762616624656384
indian_defence;2013-09-03 10:39;0;0;"New IAF Squadron Logo Lifts From Vin Diesel Film http:// dlvr.it/3vLkbw #india";;;#india;"374761076895649792";https://twitter.com/indian_defence/status/374761076895649792
indian_defence;2013-09-03 10:39;0;0;"Hürkuş Realizes Its Maiden Flight http:// dlvr.it/3vLkGt #world";;;#world;"374760937653170177";https://twitter.com/indian_defence/status/374760937653170177
indian_defence;2013-09-03 10:39;0;0;"A United States Attack on Syria and its Implications for Israel http:// dlvr.it/3vLkFK #world";;;#world;"374760934977187840";https://twitter.com/indian_defence/status/374760934977187840
apmeena;2013-09-03 09:44;0;0;"“ @indian_defence : Indian Navy gets its biggest offshore patrol vessel http:// dlvr.it/3vL1ZV #india ” INS Sunayana ... Smthing for the navy..";;@indian_defence;#india;"374747200766492673";https://twitter.com/apmeena/status/374747200766492673
amz360;2013-09-03 05:34;0;0;"RT @indian_defence India manufacturing hits over 4-year low as China rebounds http:// dlvr.it/3vJT94 #india #BharatNirman";;@indian_defence;#india #BharatNirman;"374684381996015619";https://twitter.com/amz360/status/374684381996015619
stucrow;2013-09-03 02:55;0;0;"@AC_NavalHistory @indian_defence Interesting in view of current situation that UK evidently denied US approval to use bases for recon in '73";;@AC_NavalHistory @indian_defence;;"374644280406462464";https://twitter.com/stucrow/status/374644280406462464
digvijayankoti;2013-09-03 02:19;0;0;"C-17 heavy-lift transport plane inducted into Indian AirForce ystrdy.Hope DRDO and HAL were invites to the induction party. @indian_defence";;@indian_defence;;"374635203165036545";https://twitter.com/digvijayankoti/status/374635203165036545
AC_NavalHistory;2013-09-03 00:59;0;0;"The SR-71 was a whole other future put to one side " @indian_defence : Top Secret: SR-71 Blackbird MiddleEast http:// dlvr.it/3vG8X4 #world "";;@indian_defence;#world;"374615202056376320";https://twitter.com/AC_NavalHistory/status/374615202056376320
AC_NavalHistory;2013-09-02 22:44;0;0;"In theory anything is possible" @indian_defence : Russias Stealth Fighter Could Outfly, Outshoot American Jets http:// dlvr.it/3vDl4F #india "";;@indian_defence;#india;"374580986396569600";https://twitter.com/AC_NavalHistory/status/374580986396569600
Andhra_HitHot;2013-09-02 22:42;0;0;"#Defence #Minister #Andhra Pradesh Indian Defence News - Andhra chief minister warns Congress over ... http:// hitft.hithot.cc/en_IN/Defence+ Minister/ …";;;#Defence #Minister #Andhra;"374580597592580097";https://twitter.com/Andhra_HitHot/status/374580597592580097
kashoz;2013-09-02 21:42;0;0;"@military_indian Indian defence minister acceptd dat those soldiers were killed by militants";;@military_indian;;"374565402786820097";https://twitter.com/kashoz/status/374565402786820097
kalpajitgogoi2;2013-09-02 19:14;0;0;"@indian_defence Lets call it a proxy war between Arabs and the Persians.";;@indian_defence;;"374528269678157827";https://twitter.com/kalpajitgogoi2/status/374528269678157827
raviraidurg;2013-09-02 18:57;0;0;"Military: Arrogance of Seniority » Indian Defence Review: http://www. indiandefencereview.com/news/military- arrogance-of-seniority/#.UiSRibOQUOc.twitter …";;;#;"374524003886444545";https://twitter.com/raviraidurg/status/374524003886444545
LindaCollins11;2013-09-02 18:55;1;0;"Attack on Syria: Competitive Shia-Sunni Gas Pipelines Politics? » Indian Defence Review: http://www. indiandefencereview.com/news/attack-on -syria-competitive-shia-sunni-gas-pipelines-politics/#.UiSRu_IUSnk.twitter …";;;#;"374523499718516737";https://twitter.com/LindaCollins11/status/374523499718516737
AC_NavalHistory;2013-09-02 15:29;0;0;"So its a test of skill & luck then " @indian_defence : Su-27SMs vs Su-27SMs Dogfight Training http:// dlvr.it/3v7TVb #india "";;@indian_defence;#india;"374471668854689792";https://twitter.com/AC_NavalHistory/status/374471668854689792
DefenceReview;2013-09-02 15:22;0;0;"FDI in Defence: Dispelling the Myths » Indian Defence Review: http://www. indiandefencereview.com/news/fdi-in-de fence-dispelling-the-myths/#.UiRfubB4wqU.twitter …";;;#;"374469767140093952";https://twitter.com/DefenceReview/status/374469767140093952
maker_14;2013-09-02 09:48;0;0;"GSAT-7, the first Indian defence satellite was launched by the European Arianespace’s Ariane 5 Rocket from the... http:// fb.me/2ociXiPVB";;;;"374385781114425344";https://twitter.com/maker_14/status/374385781114425344
leomanjari;2013-09-02 03:03;0;0;"#Globemaster will add wings to #indian #defence sector! #indianairforce #army #navy";;;#Globemaster #indian #defence #indianairforce #army #navy;"374283862790004737";https://twitter.com/leomanjari/status/374283862790004737
kalpajitgogoi2;2013-09-01 22:31;0;0;"@indian_defence Will they be allowed to stop the Chinese without political interference.";;@indian_defence;;"374215360825671680";https://twitter.com/kalpajitgogoi2/status/374215360825671680
KesariDhwaj;2013-09-01 22:12;0;0;"" @indian_defence : ITBP to create 35 new border posts along China border http:// dlvr.it/3tyH4k #india " Another Fwd Policy in making?";;@indian_defence;#india;"374210716686753792";https://twitter.com/KesariDhwaj/status/374210716686753792
KesariDhwaj;2013-09-01 22:12;0;0;"@indian_defence Another Forward Policy in making?";;@indian_defence;;"374210571651923968";https://twitter.com/KesariDhwaj/status/374210571651923968
indian_defence;2013-09-01 21:58;1;0;"ITBP to create 35 new border posts along China border http:// dlvr.it/3tyH4k #india";;;#india;"374207172474703872";https://twitter.com/indian_defence/status/374207172474703872
indian_defence;2013-09-01 21:28;1;0;"Denmark Prioritizes Jobs in New Fighter Competition http:// dlvr.it/3ty0Qw #world";;;#world;"374199562354712576";https://twitter.com/indian_defence/status/374199562354712576
indian_defence;2013-09-01 21:28;0;0;"Navy Divers Recover US Bombs From Barrier Reef http:// dlvr.it/3ty0N4 #world";;;#world;"374199557975846912";https://twitter.com/indian_defence/status/374199557975846912
ChiranjitOjha;2013-09-01 20:05;0;0;"Pakistan come in but Indian defence keeps them off the penalty box. 1 min to go. #INDvsPAK #indianfootball";;;#INDvsPAK #indianfootball;"374178613584621568";https://twitter.com/ChiranjitOjha/status/374178613584621568
FootballPak;2013-09-01 19:34;0;0;"61' Pakistan rampant!!! Faisal dribbles past the Indian defence and Riaz with the final effort, but Pak Shaheens... http:// fb.me/6y4He9pJn";;;;"374170789530337280";https://twitter.com/FootballPak/status/374170789530337280
FootballPak;2013-09-01 19:30;0;0;"57' Kaleem terrorizing the Indian defence , but his cross is well blocked. The ensuing corner wasn't capitalized... http:// fb.me/6tuTUFvq5";;;;"374169845191172096";https://twitter.com/FootballPak/status/374169845191172096
baggiholic;2013-09-01 19:23;0;0;"Goo counter from Pakistan, needed a better finish. Indian defence caught up the field #indvspak";;;#indvspak;"374168158447218689";https://twitter.com/baggiholic/status/374168158447218689
TheHockeyIndia;2013-09-01 18:30;1;0;"Indian defence holding; they get that last Korean attack out of the way. Let them not set up a #PenaltyCorner please. #AsiaCup13";;;#PenaltyCorner #AsiaCup13;"374154749538340864";https://twitter.com/TheHockeyIndia/status/374154749538340864
ramitmkaul;2013-09-01 18:19;0;0;"@hockeyind last 8 mins, Indian defence sleeping";;@hockeyind;;"374152032782802944";https://twitter.com/ramitmkaul/status/374152032782802944
KesariDhwaj;2013-09-01 18:13;0;0;"Great article by Maj Gen Thapliyal Return of Haji Pir Pass in 1965 – Myth and the Reality » Indian Defence Review: http://www. indiandefencereview.com/spotlights/ret urn-of-haji-pir-pass-in-1965-myth-and-the-reality/#.UiMzTURYFfo.twitter …";;;#;"374150577615163392";https://twitter.com/KesariDhwaj/status/374150577615163392
GDhyanchand;2013-09-01 17:58;2;1;"Indian Defence putting up a great fight! Need mid-field to be tightened and forwards to penetrate and score!! #AsiaCup13";;;#AsiaCup13;"374146641449603072";https://twitter.com/GDhyanchand/status/374146641449603072
TheHockeyIndia;2013-09-01 17:56;2;1;"Korea slip through Indian defence to enter D, but deflect wide off the mark. #AsiaCup13 15 min left of 1st half.";;;#AsiaCup13;"374146209444675584";https://twitter.com/TheHockeyIndia/status/374146209444675584
jignesh17007;2013-09-01 17:54;0;0;"there is no sandeep n therefore Indian defence is very solid. #IndianHockey";;;#IndianHockey;"374145784716869632";https://twitter.com/jignesh17007/status/374145784716869632
TheHockeyIndia;2013-09-01 17:51;2;1;"#AsiaCup13 Nevertheless a solid Indian defence led by Raghunath and Ramandeep; no attacks on the India goal yet. 15 min over, 0-0";;;#AsiaCup13;"374144891216879616";https://twitter.com/TheHockeyIndia/status/374144891216879616
AC_NavalHistory;2013-09-01 17:19;0;0;"Well it could be scary " @indian_defence : France will not attack Syria alone, PM to meet parliament leaders http:// dlvr.it/3tvfNN #world "";;@indian_defence;#world;"374136970311913472";https://twitter.com/AC_NavalHistory/status/374136970311913472
DefenceReview;2013-09-01 16:50;0;1;"China-US- North Korea: The Dynamics of a Strategic Triangle » Indian Defence Review: http://www. indiandefencereview.com/spotlights/chi na-us-north-korea-the-dynamics-of-a-strategic-triangle/#.UiMhnuWkNy8.twitter …";;;#;"374129679688421376";https://twitter.com/DefenceReview/status/374129679688421376
flwaustralia;2013-09-01 16:01;0;0;"“ @mickryan09 : #India lost in #Afghan endgame » Indian #Defence Review: http://www. indiandefencereview.com/news/india-los t-in-afghan-endgame/#.UiMVfEw4-3c.twitter … ”";;@mickryan09;#India #Afghan #Defence #;"374117256017350657";https://twitter.com/flwaustralia/status/374117256017350657
mickryan09;2013-09-01 15:53;0;0;"India lost in Afghan endgame » Indian Defence Review: http://www. indiandefencereview.com/news/india-los t-in-afghan-endgame/#.UiMVfEw4-3c.twitter …";;;#;"374115260568858624";https://twitter.com/mickryan09/status/374115260568858624
Neilnitin1984;2013-09-01 14:59;0;0;"Court foils police bid to shield Shahi Imam Bukhari: http://www. indiandefence.com/forums/nationa l-politics/20436-court-foils-police-bid-shield-shahi-imam-bukhari.html#.UiMISmSUgfQ.twitter … via @indian_defence";;@indian_defence;#;"374101630141992960";https://twitter.com/Neilnitin1984/status/374101630141992960
indian_defence;2013-09-01 14:40;3;0;"Iran Deploys Air Defense Shield in Vital Economic Centers http:// dlvr.it/3tt8wX #world";;;#world;"374096880788987904";https://twitter.com/indian_defence/status/374096880788987904
indian_defence;2013-09-01 14:38;0;0;"Mars rover Curiosity drives solo for first time http:// dlvr.it/3tt82S #india";;;#india;"374096445789319170";https://twitter.com/indian_defence/status/374096445789319170
apmeena;2013-09-01 13:52;0;0;"“ @indian_defence : #Ikea cracks China market, but success has meant adapting to local ways http:// dlvr.it/3tsHRh #china ” bizarre,must read";;@indian_defence;#Ikea #china;"374084932152197120";https://twitter.com/apmeena/status/374084932152197120
akmdelhi;2013-09-01 13:45;0;0;"Poor Mapping by Military Survey » Indian Defence Review: http://www. indiandefencereview.com/spotlights/poo r-mapping-by-military-survey/#.UiL0JiXG16U.twitter …";;;#;"374083101678256129";https://twitter.com/akmdelhi/status/374083101678256129
AC_NavalHistory;2013-09-01 13:22;0;1;"Why not 50 or a Hong Kong century? " @indian_defence : US wants Philippines bases for 20 years http:// dlvr.it/3ts1dt #world "";;@indian_defence;#world;"374077332623208448";https://twitter.com/AC_NavalHistory/status/374077332623208448
greenxgene;2013-09-01 13:16;0;0;"@indian_defence Russia is also adding up some ships to the same pond. Did they already include Hide n Seek in Olympics?";;@indian_defence;;"374075837860966400";https://twitter.com/greenxgene/status/374075837860966400
indian_defence;2013-09-01 13:08;1;0;"USS San Antonio (LPD 17) becomes sixth US Navy vessel deployed off Syria http:// dlvr.it/3tsJd7 #world";;;#world;"374073653962358784";https://twitter.com/indian_defence/status/374073653962358784
InfoHeaders;2013-09-01 12:09;0;0;"The InfoHeaders Journal On #Defense is out! http:// paper.li/InfoHeaders/13 69247770 … ▸ Top stories today via @indian_defence @hidayj @TheStudyofWar";;@indian_defence @hidayj @TheStudyofWar;#Defense;"374059017423036416";https://twitter.com/InfoHeaders/status/374059017423036416
okenjeet;2013-09-01 12:09;0;0;"From my unforgetable lens: Former Chief of Indian Army Gen JJ Singh and Present Indian Defence Minister AK... http:// fb.me/2CEHMXsXY";;;;"374058978944118784";https://twitter.com/okenjeet/status/374058978944118784
kalpajitgogoi2;2013-09-01 11:19;0;0;"@indian_defence One child policy should be the law. But it will be hard to implement it with some communities.";;@indian_defence;;"374046227198787585";https://twitter.com/kalpajitgogoi2/status/374046227198787585
vppopli;2013-09-01 10:44;0;0;"@indian_defence Stupid Juvenile Law of India Must be changed";;@indian_defence;;"374037427716751360";https://twitter.com/vppopli/status/374037427716751360
Sandeepkumar_W;2013-09-01 10:35;0;0;"R u hearing Indian PM, DM & Sabka baap Sonia? RT @indian_defence : China, Pakistan to boost military ties http:// dlvr.it/3trJY9 #India";;@indian_defence;#India;"374035207222878212";https://twitter.com/Sandeepkumar_W/status/374035207222878212
arunambie;2013-09-01 07:08;0;0;"Chinese are coming… » Indian Defence Review: http://www. indiandefencereview.com/news/chinese-a re-coming/#.UiKJnfpDJ-U.twitter …";;;#;"373983082962882560";https://twitter.com/arunambie/status/373983082962882560
AC_NavalHistory;2013-09-01 05:40;0;0;"In face of Growing Threats = < Uncertainty " @indian_defence : Japanese Defense Ministry Seeks 3% Budget Hike http:// dlvr.it/3tlQH8 #world "";;@indian_defence;#world;"373961044462686208";https://twitter.com/AC_NavalHistory/status/373961044462686208
vanngocthanh;2013-09-01 03:23;0;0;"Evolution of Indian Military Concepts » Indian Defence Review: http://www. indiandefencereview.com/spotlights/evo lution-of-indian-military-concepts/#.UiIMToiWN9E.twitter …";;;#;"373926645746266113";https://twitter.com/vanngocthanh/status/373926645746266113
kabirgrewal1;2013-09-01 01:54;5;0;"Life @Siachen ! 1of brave & Greatest Army all over the World #Proud to be an indian @Military_Indian @indian_defence pic.twitter.com/QxaJewwOoQ";;@Siachen @Military_Indian @indian_defence;#Proud;"373904036023373825";https://twitter.com/kabirgrewal1/status/373904036023373825
ItalianPolitics;2013-09-01 00:47;1;0;"Very unusual side... RT @indian_defence : US should take military action against #Syria http:// dlvr.it/3tmgrC #world";;@indian_defence;#Syria #world;"373887259738509312";https://twitter.com/ItalianPolitics/status/373887259738509312
kalpajitgogoi2;2013-09-01 00:14;0;0;"@indian_defence The golds in temples is a national property. No interest is bigger than the national interest.";;@indian_defence;;"373878889983913984";https://twitter.com/kalpajitgogoi2/status/373878889983913984
kalpajitgogoi2;2013-09-01 00:12;0;0;"@indian_defence India is expecting Pakistan to take action against those responsible for 26/11. There can't be bigger joke than this.";;@indian_defence;;"373878466669580288";https://twitter.com/kalpajitgogoi2/status/373878466669580288
rawisen;2013-08-31 23:40;0;0;"India and its neighbours » Indian Defence Review: http:// idr.qburst.com/interviews/ind ia-and-its-neighbours/#.UiIw1FVW4_k.twitter …";;;#;"373870508384608256";https://twitter.com/rawisen/status/373870508384608256
indian_defence;2013-08-31 23:14;0;0;"Mumbai 26/11 attacks: Pakistani judicial panel to visit Mumbai in September http:// dlvr.it/3tlz2w #india";;;#india;"373863817081413633";https://twitter.com/indian_defence/status/373863817081413633
indian_defence;2013-08-31 23:14;1;0;"BJP to oppose govt move to take gold from temples http:// dlvr.it/3tlz1V #india";;;#india;"373863805362507776";https://twitter.com/indian_defence/status/373863805362507776
indian_defence;2013-08-31 22:42;0;0;"US Spying Is Costly But Often Ineffective http:// dlvr.it/3tlhMp #world";;;#world;"373855863309467649";https://twitter.com/indian_defence/status/373855863309467649
DJGalbreath;2013-08-31 22:15;0;0;"Sec Dilemma“ @indian_defence : BrahMos missiles substantially increase strike capacity of India's armed forces http:// dlvr.it/3tlQWf #india ”";;@indian_defence;#india;"373849043975557121";https://twitter.com/DJGalbreath/status/373849043975557121
DJGalbreath;2013-08-31 22:14;0;0;"Indian COIN? “ @indian_defence : Maoist rebels kill four troops in India landmine blast http:// dlvr.it/3tlQY6 #india ”";;@indian_defence;#india;"373848821841027072";https://twitter.com/DJGalbreath/status/373848821841027072
shamroseh;2013-08-31 22:12;0;0;"According to some Indian defence study in 2005 , Pakistan would seize to exist in exactly 5 years. Well,suck it brah!";;;;"373848344931876864";https://twitter.com/shamroseh/status/373848344931876864
brahmasingh417;2013-08-31 19:35;1;1;"@Military_Indian Written essentially on lack of Indian defence preparedness against Pak & China.";;@Military_Indian;;"373808745597243392";https://twitter.com/brahmasingh417/status/373808745597243392
IndusStrategic;2013-08-31 16:59;1;0;"“ @indian_defence : India bans Gmail for gov workers after Snowden http:// dlvr.it/3tdSvW #india ”...only way some govt officials have email";;@indian_defence;#india;"373769488745103360";https://twitter.com/IndusStrategic/status/373769488745103360
greenxgene;2013-08-31 16:13;0;0;"@indian_defence Every nation has its own share of Skylines and Slums. The GDP is not a real measure of growth. Human Development Index is.";;@indian_defence;;"373757828785115136";https://twitter.com/greenxgene/status/373757828785115136
BillionIndian;2013-08-31 04:16;1;1;"" @indian_defence : Radioactive material lies unclaimed for five years at Chennai airport http:// dlvr.it/3tZ4bp #india "";;@indian_defence;#india;"373577519842488320";https://twitter.com/BillionIndian/status/373577519842488320
BillionIndian;2013-08-31 03:18;0;0;"" @indian_defence : Taiwan plans to buy two warships from US http:// dlvr.it/3tZ3yQ #world " Hullo China? U deserve this,India shd befriend Tai";;@indian_defence;#world;"373562822963507200";https://twitter.com/BillionIndian/status/373562822963507200
fiziecool;2013-08-30 20:34;0;0;"Well decipline position by indian players.. Hard for malaysian player to get in indian defence ..";;;;"373461273570062337";https://twitter.com/fiziecool/status/373461273570062337
TheHockeyIndia;2013-08-30 20:29;1;0;"Come on Indian defence , you can't rely solely on Sreejesh. And attack needs teeth. #AsiaCup13 India lead 1-0";;;#AsiaCup13;"373459946433556481";https://twitter.com/TheHockeyIndia/status/373459946433556481
sukib001;2013-08-30 18:23;0;0;"@indian_defence It has been exported to all the Muslim world at large.";;@indian_defence;;"373428242541068288";https://twitter.com/sukib001/status/373428242541068288
sukib001;2013-08-30 18:22;0;1;"@indian_defence So this is set to books used to brain wash Pakistan population at large and bread intolerance towards non believers.";;@indian_defence;;"373427983446323200";https://twitter.com/sukib001/status/373427983446323200
kabirgrewal1;2013-08-30 16:31;0;1;"THE MARINE COMMANDOS INDIAN Magermach Crocodile #Jai_Hind_Jai_bharat @Military_Indian @indian_defence @Indians4Israel pic.twitter.com/12l5kSvnVm";;@Military_Indian @indian_defence @Indians4Israel;#Jai_Hind_Jai_bharat;"373400174057357316";https://twitter.com/kabirgrewal1/status/373400174057357316
kabirgrewal1;2013-08-30 14:10;0;0;"______________________________________ x_x @MikaSingh @sameeratweeter @Military_Indian @narendramodi @indian_defence pic.twitter.com/iDUrRiNENo";;@MikaSingh @sameeratweeter @Military_Indian @narendramodi @indian_defence;;"373364664228249600";https://twitter.com/kabirgrewal1/status/373364664228249600
MrShashiRaj;2013-08-30 14:07;1;0;"Ti phir @PM ji kiske rakhawale hai @aajtak @IyerIdeology @PMOIndia @hm_eVOTS @ippatel @shilpitewari @RightAndBold @indian_defence @SabooVika";;@PM @aajtak @IyerIdeology @PMOIndia @hm_eVOTS @ippatel @shilpitewari @RightAndBold @indian_defence @SabooVika;;"373363830555807745";https://twitter.com/MrShashiRaj/status/373363830555807745
IndianWitchHunt;2013-08-30 14:02;0;0;"#CONgress was going to give him credit for this.... “ @indian_defence : Outgoing RBI governor Subbarao blames govt for sinking rupee”";;@indian_defence;#CONgress;"373362683308826625";https://twitter.com/IndianWitchHunt/status/373362683308826625
ssharma9519;2013-08-30 12:51;0;0;"{IAS prelims 2003} 7.With reference to the Indian Defence ,which one of the following statements is NOT correct?... http:// fb.me/301qMOUvb";;;;"373344610653044736";https://twitter.com/ssharma9519/status/373344610653044736
indian_defence;2013-08-30 12:25;0;0;"Kim Jong-un's Ex-Girlfriend 'Shot by Firing Squad' http:// dlvr.it/3tMr8T #china";;;#china;"373338136723480576";https://twitter.com/indian_defence/status/373338136723480576
